,Link,New Book Name,Budget,Gross,Opening,Awards List,Book Name,Characters,Genres,Num_reviews,Other editions,Pages,Star votes,Stars,publish_date,Award Count,Release Date
0,http://www.imdb.com/title/tt0373889/,Harry Potter and the Order of the Phoenix,150000000,292004738,77108414,"
Bram Stoker Award for Works for Young Readers (2003), Anthony Award for Young Adult (2004), Mythopoeic Fantasy Award for Children's Literature (2008), Audie Award for Audiobook of the Year (2004), Books I Loved Best Yearly (BILBY) Awards for Older Readers (2004)
...more
Colorado Blue Spruce Young Adult Book Award (2006), Golden Archer Award for Middle/Junior High (2005), Deutscher Jugendliteraturpreis Nominee for Preis der Jugendjury (2004), Carnegie Medal Nominee (2003)
...less ",Harry Potter and the Order of the Phoenix (Harry Potter #5),"[Sirius Black, Draco Malfoy, Ron Weasley, Petunia Dursley, Vernon Dursley, Dudley Dursley, Albus Dumbledore, Severus Snape, Rubeus Hagrid, Lord Voldemort, Minerva McGonagall, Neville Longbottom, Fred Weasley, George Weasley, Percy Weasley, Ginny Weasley, Colin Creevey, Filius Flitwick, Gilderoy Lockhart, Lucius Malfoy, Pomona Sprout, Arthur Weasley, Molly Weasley, Cho Chang, Cornelius Fudge, Remus Lupin, Sybil Trelawney, Stan Shunpike, Bellatrix Lestrange, Alastor Moody, Rita Skeeter, Luna Lovegood, Nymphadora Tonks, Dolores Umbridge, Dobby, Kingsley Shacklebolt, Padma Patil, Parvati Patil, Kreacher, Dean Thomas, Seamus Finnigan, Harry Potter, Hermione Granger]","[Childrens, Fantasy, Novels]","25,751",278.0,870 pages,"[1041580, 467679, 172852, 30465, 9227]",4.45,June 21st 2003,8.0,11 July 2007
1,http://www.imdb.com/title/tt0373889/,Harry Potter and the Order of the Phoenix,150000000,292004738,77108414,"
Bram Stoker Award for Works for Young Readers (2003), Anthony Award for Young Adult (2004), Mythopoeic Fantasy Award for Children's Literature (2008), Audie Award for Audiobook of the Year (2004), Books I Loved Best Yearly (BILBY) Awards for Older Readers (2004)
...more
Colorado Blue Spruce Young Adult Book Award (2006), Golden Archer Award for Middle/Junior High (2005), Deutscher Jugendliteraturpreis Nominee for Preis der Jugendjury (2004), Carnegie Medal Nominee (2003)
...less ",Harry Potter and the Order of the Phoenix (Harry Potter #5),"[Sirius Black, Draco Malfoy, Ron Weasley, Petunia Dursley, Vernon Dursley, Dudley Dursley, Albus Dumbledore, Severus Snape, Rubeus Hagrid, Lord Voldemort, Minerva McGonagall, Neville Longbottom, Fred Weasley, George Weasley, Percy Weasley, Ginny Weasley, Colin Creevey, Filius Flitwick, Gilderoy Lockhart, Lucius Malfoy, Pomona Sprout, Arthur Weasley, Molly Weasley, Cho Chang, Cornelius Fudge, Remus Lupin, Sybil Trelawney, Stan Shunpike, Bellatrix Lestrange, Alastor Moody, Rita Skeeter, Luna Lovegood, Nymphadora Tonks, Dolores Umbridge, Dobby, Kingsley Shacklebolt, Padma Patil, Parvati Patil, Kreacher, Dean Thomas, Seamus Finnigan, Harry Potter, Hermione Granger]","[Childrens, Fantasy, Novels]","25,751",278,870 pages,"[1041580, 467679, 172852, 30465, 9227]",4.45,June 21st 2003,8.0,11 July 2007
2,http://www.imdb.com/title/tt1099212/,Twilight,37000000,191465414,69637740,"
Georgia Peach Book Award (2007), Buxtehuder Bulle (2006), Kentucky Bluegrass Award for 9-12 (2007), Prijs van de Kinder- en Jeugdjury Vlaanderen (2008), Books I Loved Best Yearly (BILBY) Awards for Older Readers (2009)
...more
West Australian Young Readers' Book Award (WAYRBA) for Older Readers (2008), Garden State Book Award for Fiction (Grades 9-12) (2008), South Carolina Book Award for Young Adult Book Award (2008), Grand Canyon Reader Award for Teen Book (2008), Maryland Black-Eyed Susan Book Award for High School (2007), Golden Sower Award for Young Adult (2009), Nevada Young Readers' Award for Young Adult Category  (2007), The Flume: New Hampshire Teen Reader's Choice Award (2007), Pennsylvania Young Readers' Choice Award for Young Adult (2009), Rhode Island Teen Book Award (2007), Evergreen Teen Book Award (2008), Michigan Library Association Thumbs Up! Award Nominee (2006), Teen Read Award Nominee for Best All-Time-Fave (2010), Deutscher Jugendliteraturpreis Nominee for Preis der Jugendjury (2007), Iowa High School Book Award (2008), Abraham Lincoln Award (2008), Literaturpreis der Jury der jungen Leser for Cover (2007), Missouri Gateway Readers Award (2008)
...less ",Twilight (Twilight #1),"[Edward Cullen, Jacob Black, Laurent, Renee, Bella Swan, Billy Black, Esme Cullen, Alice Cullen, Jasper Hale, Carlisle Cullen, Emmett Cullen, Rosalie Hale, Charlie Swan, Mike Newton, Jessica Stanley, Angela Weber, Tyler Crowley]","[Young Adult, Fantasy, Romance, Paranormal, Vampires, Fiction, Fantasy, Paranormal]","93,258",229,498 pages,"[1258780, 814235, 738275, 407909, 428866]",3.57,October 5th 2005,22.0,21 November 2008
3,http://www.imdb.com/title/tt0330373/,Harry Potter and the Goblet of Fire,150000000,290013036,102335066,"
Hugo Award for Best Novel (2001), Mythopoeic Fantasy Award for Children's Literature (2008), Publieksprijs voor het Nederlandse Boek (2001), Audie Award for Solo Narration - Male (2001), West Australian Young Readers' Book Award (WAYRBA) for Younger Readers (2001)
...more
Golden Archer Award for Middle/Junior High (2002), Indian Paintbrush Book Award (2002), Deutscher Bücherpreis for Publikumspreis
...less ",Harry Potter and the Goblet of Fire (Harry Potter #4),"[Sirius Black, Draco Malfoy, Ron Weasley, Petunia Dursley, Vernon Dursley, Dudley Dursley, Albus Dumbledore, Severus Snape, Rubeus Hagrid, Lord Voldemort, Minerva McGonagall, Neville Longbottom, Fred Weasley, George Weasley, Percy Weasley, Ginny Weasley, Arthur Weasley, Molly Weasley, Cho Chang, Cornelius Fudge, Sybil Trelawney, Ludo Bagman, Bartemius Crouch, Bartemius Crouch, Jr., Fleur Delacour, Cedric Diggory, Viktor Krum, Bellatrix Lestrange, Alastor Moody, Rita Skeeter, Charlie Weasley, Bill Weasley, Harry Potter, Hermione Granger]","[Fantasy, Young Adult, Fiction, Fantasy, Magic, Childrens, Adventure, Science Fiction Fantasy, Classics, Novels, Childrens, Middle Grade]","27,770",299,734 pages,"[1081875, 463920, 144699, 19224, 6183]",4.51,July 8th 2000,7.0,18 November 2005
4,http://www.imdb.com/title/tt0304141/,Harry Potter and the Prisoner of Azkaban,130000000,249358727,93687367,"
Bram Stoker Award for Best Work for Young Readers (1999), Hugo Award Nominee for Best Novel (2000), Locus Award for Best Fantasy Novel (2000), Whitbread Award for Children's Book of the Year (1999), Mythopoeic Fantasy Award for Children's Literature (2008)
...more
Smarties Prize (1999), Books I Loved Best Yearly (BILBY) Awards for Older Readers (2005), Colorado Blue Spruce Young Adult Book Award (2004), Maine Student Book Award (2000), Golden Archer Award for Intermediate (2001), Indian Paintbrush Book Award (2004), Soaring Eagle Book Award (2002), Hotze de Roosprijs (2001)
...less ",Harry Potter and the Prisoner of Azkaban (Harry Potter #3),"[Sirius Black, Draco Malfoy, Ron Weasley, Petunia Dursley, Vernon Dursley, Dudley Dursley, Albus Dumbledore, Severus Snape, Rubeus Hagrid, Minerva McGonagall, Neville Longbottom, Fred Weasley, George Weasley, Percy Weasley, Ginny Weasley, Colin Creevey, Filius Flitwick, Pomona Sprout, Arthur Weasley, Molly Weasley, Cho Chang, Marjorie Dursley, Cornelius Fudge, Remus Lupin, Sybil Trelawney, Peter Pettigrew, Poppy Pomfrey, Stan Shunpike, Oliver Wood, Cedric Diggory, Dean Thomas, Seamus Finnigan, Rolanda Hooch, Katie Bell, Ernie Prang, Harry Potter, Hermione Granger]","[Fantasy, Young Adult, Fiction]","32,160",331,435 pages,"[1144372, 477102, 158646, 19530, 6204]",4.51,July 8th 1999,12.0,4 June 2004
5,http://www.imdb.com/title/tt0241527/,Harry Potter and the Sorcerer's Stone,125000000,317557891,90294621,"
Mythopoeic Fantasy Award for Children's Literature (2008), British Book Award for Children's Book of the Year (1998), Smarties Prize (1997), Prijs van de Nederlandse Kinderjury for 6-9 jaar en 10-12 jaar (2002), American Booksellers Book Of The Year  Award for Children (1999)
...more
West Australian Young Readers' Book Award (WAYRBA) for Younger Readers (2000), Rebecca Caudill Young Reader's Book Award (2001), South Carolina Book Award for Junior Book Award (2001), Grand Canyon Reader Award for Teen Book (2000), Charlotte Award (2000), Nene Award (2000), Massachusetts Children's Book Award (2000), Colorado Blue Spruce Young Adult Book Award (2001), Blue Hen Book Award for Chapter Book (2001), Nevada Young Readers' Award for Young Reader Category (2000), Golden Archer Award for Middle/Junior High (2000), Indian Paintbrush Book Award (2000), Hotze de Roosprijs (2002), Kinderboekwinkelprijs (1999), National Book Award (UK) (1997), Parenting Book of the Year Award (1998), North East Teenage Book Award (1999), Washington State Sasquatch Award (2000), Literaturpreis der Jury der jungen Leser for Kinderbuch (1999), Carnegie Medal Nominee (1997)
...less ",Harry Potter and the Sorcerer's Stone (Harry Potter #1),"[Draco Malfoy, Ron Weasley, Petunia Dursley, Vernon Dursley, Dudley Dursley, Albus Dumbledore, Severus Snape, Quirinus Quirrell, Rubeus Hagrid, Lord Voldemort, Minerva McGonagall, Neville Longbottom, Fred Weasley, George Weasley, Percy Weasley, Filius Flitwick, Pomona Sprout, Molly Weasley, Poppy Pomfrey, Oliver Wood, Parvati Patil, Lavender Brown, Dean Thomas, James Potter, Lily Potter, Seamus Finnigan, Garrick Ollivander, Rolanda Hooch, Katie Bell, Harry Potter, Hermione Granger, Dedalus Diggle]","[Fantasy, Young Adult, Fiction]","67,668",156,320 pages,"[2650321, 1054137, 423981, 94447, 67115]",4.43,,24.0,16 November 2001
6,http://www.imdb.com/title/tt0295297/,Harry Potter and the Chamber of Secrets,100000000,261970615,88357488,"
Mythopoeic Fantasy Award for Children's Literature (2008), British Book Award (1999), Smarties Prize (1999), Booklist Editors' Choice (1999), Prijs van de Jonge Jury (2002)
...more
Books I Loved Best Yearly (BILBY) Awards for Older Readers (2006), Colorado Blue Spruce Young Adult Book Award (2008), Golden Archer Award for Middle/Junior High (2008)
...less ",Harry Potter and the Chamber of Secrets (Harry Potter #2),"[Draco Malfoy, Ron Weasley, Petunia Dursley, Vernon Dursley, Dudley Dursley, Albus Dumbledore, Severus Snape, Rubeus Hagrid, Lord Voldemort, Minerva McGonagall, Neville Longbottom, Fred Weasley, George Weasley, Percy Weasley, Ginny Weasley, Colin Creevey, Filius Flitwick, Gilderoy Lockhart, Lucius Malfoy, Pomona Sprout, Arthur Weasley, Molly Weasley, Cornelius Fudge, Poppy Pomfrey, Oliver Wood, Dobby, Parvati Patil, Dean Thomas, James Potter, Seamus Finnigan, Rolanda Hooch, Katie Bell, Harry Potter, Hermione Granger]","[Fantasy, Young Adult, Fiction, Fantasy, Magic, Childrens, Adventure, Science Fiction Fantasy, Classics, Childrens, Middle Grade, Novels]","29,953",360,341 pages,"[955969, 507584, 230507, 40686, 7721]",4.36,1998,7.0,15 November 2002
7,http://www.imdb.com/title/tt0417741/,Harry Potter and the Half-Blood Prince,250000000,301959197,77835727,"
British Book of the Year (2006)
",Harry Potter and the Half-Blood Prince (Harry Potter #6),"[Ron Weasley, Harry Potter, Hermione Granger, Albus Dumbledore]","[Fantasy, Young Adult, Fiction]","24,934",255,652 pages,"[1059719, 433145, 130525, 20619, 6852]",4.53,July 16th 2005,1.0,15 July 2009
8,http://www.imdb.com/title/tt1932888/,Eragon,,,,"
Book Sense Book of the Year Award for Children's Literature (2004), Books I Loved Best Yearly (BILBY) Awards for Older Readers (2007), Rebecca Caudill Young Reader's Book Award (2006), South Carolina Book Award for Young Adult Book (2006), Grand Canyon Reader Award for Teen Book (2006)
...more
Nene Award (2006), Colorado Blue Spruce Young Adult Book Award (2005), Pennsylvania Young Readers' Choice Award for Grades 6-8 (2005), Rhode Island Teen Book Award (2005), Beehive Award for Young Adult Book (2005), Evergreen Teen Book Award (2006), Golden Archer Award for Middle/Junior High (2006), Soaring Eagle Book Award (2005), Pacific Northwest Library Association Young Reader's Choice Award for Intermediate (2006), Iowa Teen Award (2008), Literaturpreis der Jury der jungen Leser for Kinderbuch (2005), Virginia Reader's Choice Award for Middle (2005), Missouri Gateway Readers Award for Young Adult (2006), Oklahoma Sequoyah Award for YA (2006)
...less ",Eragon (The Inheritance Cycle #1),"[Eragon (The Inheritance Cycle), Saphira (The Inheritance Cycle), Roran Garrowsson, Arya (The Inheritance Cycle), Brom (The Inheritance Cycle), Orik (The Inheritance Cycle), Horst (The Inheritance Cycle), Murtagh (The Inheritance Cycle), Solembum, Queen Islanzadi, Angela the Herbalist]","[Fantasy, Young Adult, Fiction, Fantasy, Dragons, Adventure, Fantasy, Magic, Fantasy, High Fantasy, Science Fiction Fantasy, Young Adult, Teen, Young Adult, Young Adult Fantasy]","17,413",199,503 pages,"[374199, 313859, 225705, 84229, 48311]",3.84,June 2002,18.0,
9,http://www.imdb.com/title/tt0397535/,Memoirs of a Geisha,85000000,57010853,682504,,Memoirs of a Geisha,"[Nitta Sayuri, Mr. Bekku, Mr. Tanaka, Dr. Crab]","[Fiction, Historical Fiction, Romance, Historical, Cultural, Japan]","24,630",201,434 pages,"[522756, 489841, 248098, 57061, 22646]",4.07,September 1997,0.0,23 December 2005
10,http://www.imdb.com/title/tt0312528/,The Cat in the Hat,109000000,100446895,38329160,"
Books I Loved Best Yearly (BILBY) Awards for Early Readers (2004, 2012) (2004)
",The Cat in the Hat (Beginner Books B-1),[The Cat in the Hat],"[Childrens, Childrens, Picture Books, Classics, Fiction]","4,009",96,61 pages,"[147625, 83392, 56319, 14189, 5992]",4.15,March 12th 1957,2.0,21 November 2003
11,http://www.imdb.com/title/tt1201607/,Harry Potter and the Deathly Hallows,125000000,381011219,169189427,"
Locus Award Nominee for Best Young Adult Novel (2008), Mythopoeic Fantasy Award for Children's Literature (2008), Odyssey Award for Excellence in Audiobook Production Honor (2008), Books I Loved Best Yearly (BILBY) Awards for Older Readers (2008), Teen Read Award Nominee for Best All-Time-Fave (2010)
...more
Puddly Award for Fiction (2008), Andre Norton Award for Young Adult Science Fiction and Fantasy (2007), Carnegie Medal Nominee (2008)
...less ",Harry Potter and the Deathly Hallows (Harry Potter #7),"[Sirius Black, Draco Malfoy, Ron Weasley, Petunia Dursley, Vernon Dursley, Dudley Dursley, Albus Dumbledore, Severus Snape, Rubeus Hagrid, Lord Voldemort, Minerva McGonagall, Neville Longbottom, Fred Weasley, George Weasley, Percy Weasley, Ginny Weasley, Colin Creevey, Filius Flitwick, Lucius Malfoy, Pomona Sprout, Arthur Weasley, Molly Weasley, Cho Chang, Remus Lupin, Sybil Trelawney, Peter Pettigrew, Oliver Wood, Fleur Delacour, Viktor Krum, Bellatrix Lestrange, Alastor Moody, Bill Weasley, Luna Lovegood, Nymphadora Tonks, Dolores Umbridge, Dobby, Kingsley Shacklebolt, Padma Patil, Parvati Patil, Kreacher, Narcissa Malfoy, Horace Slughorn, Rufus Scrimgeour, Lavender Brown, Dean Thomas, Aberforth Dumbledore, James Potter, Lily Potter, Xenophilius Lovegood, Seamus Finnigan, Garrick Ollivander, Katie Bell, Griphook, Lily Luna Potter, James Sirius Potter, Albus Severus Potter, Teddy Lupin, Rose Weasley, Hugo Weasley, Harry Potter, Hermione Granger]","[Fantasy, Young Adult, Fiction]","48,842",256,784 pages,"[1205643, 360677, 108348, 21270, 8804]",4.6,,7.0,15 July 2011
12,http://www.imdb.com/title/tt1201607/,Harry Potter and the Deathly Hallows,125000000,381011219,169189427,"
Locus Award Nominee for Best Young Adult Novel (2008), Mythopoeic Fantasy Award for Children's Literature (2008), Odyssey Award for Excellence in Audiobook Production Honor (2008), Books I Loved Best Yearly (BILBY) Awards for Older Readers (2008), Teen Read Award Nominee for Best All-Time-Fave (2010)
...more
Puddly Award for Fiction (2008), Andre Norton Award for Young Adult Science Fiction and Fantasy (2007), Carnegie Medal Nominee (2008)
...less ",Harry Potter and the Deathly Hallows (Harry Potter #7),"[Sirius Black, Draco Malfoy, Ron Weasley, Petunia Dursley, Vernon Dursley, Dudley Dursley, Albus Dumbledore, Severus Snape, Rubeus Hagrid, Lord Voldemort, Minerva McGonagall, Neville Longbottom, Fred Weasley, George Weasley, Percy Weasley, Ginny Weasley, Colin Creevey, Filius Flitwick, Lucius Malfoy, Pomona Sprout, Arthur Weasley, Molly Weasley, Cho Chang, Remus Lupin, Sybil Trelawney, Peter Pettigrew, Oliver Wood, Fleur Delacour, Viktor Krum, Bellatrix Lestrange, Alastor Moody, Bill Weasley, Luna Lovegood, Nymphadora Tonks, Dolores Umbridge, Dobby, Kingsley Shacklebolt, Padma Patil, Parvati Patil, Kreacher, Narcissa Malfoy, Horace Slughorn, Rufus Scrimgeour, Lavender Brown, Dean Thomas, Aberforth Dumbledore, James Potter, Lily Potter, Xenophilius Lovegood, Seamus Finnigan, Garrick Ollivander, Katie Bell, Griphook, Lily Luna Potter, James Sirius Potter, Albus Severus Potter, Teddy Lupin, Rose Weasley, Hugo Weasley, Harry Potter, Hermione Granger]","[Fantasy, Young Adult, Fiction]","48,848",256,784 pages,"[1205883, 360740, 108364, 21275, 8805]",4.6,,7.0,15 July 2011
13,http://www.imdb.com/title/tt0363771/,"The Lion, the Witch, and the Wardrobe",180000000,291709845,65556312,"
Hugo Award Nominee for Best Novel (1954), Lewis Carroll Shelf Award (1962)
","The Lion, the Witch, and the Wardrobe (The Chronicles of Narnia (Publication Order) #1)","[Aslan, Lucy Pevensie, Edmund Pevensie, Mr. Tumnus, Peter Pevensie, Susan Pevensie, Jadis, Mr. & Mrs. Beaver]","[Fantasy, Classics, Fiction, Young Adult, Childrens]","13,935",467,206 pages,"[658158, 469101, 242286, 51621, 17431]",4.18,October 16th 1950,2.0,9 December 2005
14,http://www.imdb.com/title/tt5607976/,The Golden Compass,,,,"
Audie Award for Children's Titles (2000), Abraham Lincoln Award Nominee (2005), Carnegie Medal (1995)
",The Golden Compass (His Dark Materials #1),"[Lyra Belacqua, Pantalaimon, Lord Asriel, Iorek Byrnison, Iofur Raknison, Marisa Coulter, Lee Scoresby, Roger Parslow, Serafina Pekkala, Hester]","[Fantasy, Young Adult, Fiction, Childrens]","13,892",276,399 pages,"[350681, 291792, 187669, 61736, 36837]",3.92,1995,3.0,
15,http://www.imdb.com/title/tt0814255/,The Lightning Thief,95000000,88761720,,"
Young Readers' Choice Award (2008), Books I Loved Best Yearly (BILBY) Awards for Older Readers (2011), Rebecca Caudill Young Reader's Book Award (2009), South Carolina Book Award for Junior Book Award (2008), Grand Canyon Reader Award for Tween Book (2008)
...more
Nene Award (2008), Massachusetts Children's Book Award (2008), Pennsylvania Young Readers' Choice Award for Grades 6-8 (2008), Sunshine State Young Readers Award for Grades 6-8 (2007), Pacific Northwest Library Association Young Reader's Choice Award for Intermediate (2008), Iowa Teen Award (2009), Abraham Lincoln Award Nominee (2009), Oklahoma Sequoyah Award for YA (2008)
...less ",The Lightning Thief (Percy Jackson and the Olympians #1),"[Percy Jackson, Annabeth Chase, Grover Underwood, Luke Castellan, Zeus, Dionysus, Ares, Poseidon, Chiron]","[Fantasy, Young Adult, Fantasy, Mythology, Fiction]","43,019",174,377 pages,"[619400, 396458, 202311, 44637, 16637]",4.22,June 28th 2005,12.0,12 February 2010
16,http://www.imdb.com/title/tt0814255/,The Battle of the Labyrinth,95000000,88761720,,,The Battle of the Labyrinth (Percy Jackson and the Olympians #4),"[Nico di Angelo, Percy Jackson, Tyson, Annabeth Chase, Grover Underwood, Daedalus, Rachel Elizabeth Dare]","[Fantasy, Young Adult, Fantasy, Mythology]","13,008",98,361 pages,"[273102, 161996, 58920, 7690, 2346]",4.38,,0.0,12 February 2010
17,http://www.imdb.com/title/tt0327679/,Ella Enchanted,35000000,22913677,6169030,"
Newbery Honor (1998), Mythopoeic Fantasy Award Nominee for Children's Literature (1999), Rebecca Caudill Young Reader's Book Award (2000), Grand Canyon Reader Award for Teen Book (1999), Maryland Black-Eyed Susan Book Award for Grade 6-9 (2000)
...more
Dorothy Canfield Fisher Children's Book Award (1999), Iowa Teen Award (2000)
...less ",Ella Enchanted,"[Ella Varner, Lucinda, Mandy, Prince Charmont, Areida, Hattie, Olive Abroholos Elephanta]","[Fantasy, Young Adult, Fiction, Romance, Fantasy, Fairy Tales, Childrens]","8,084",55,232 pages,"[121535, 105530, 77050, 19348, 6361]",3.96,January 1st 1997,6.0,9 April 2004
18,http://www.imdb.com/title/tt1259571/,New Moon,50000000,296623634,142839137,"
Books I Loved Best Yearly (BILBY) Awards for Older Readers (2010), South Carolina Book Award for Young Adult Book Award (2009), The Flume: New Hampshire Teen Reader's Choice Award (2008), Soaring Eagle Book Award (2007), Pacific Northwest Library Association Young Reader's Choice Award for Senior (2009)
",New Moon (Twilight #2),"[Edward Cullen, Jacob Black, Bella Swan, Billy Black, Esme Cullen, Alice Cullen, Jasper Hale, Carlisle Cullen, Emmett Cullen, Rosalie Hale, Charlie Swan, Mike Newton]","[Young Adult, Fantasy, Romance, Paranormal, Vampires, Fiction]","43,367",184,563 pages,"[335851, 278866, 281575, 153835, 98561]",3.52,,5.0,20 November 2009
19,http://www.imdb.com/title/tt1374989/,Pride and Prejudice,28000000,10907291,5324240,,Pride and Prejudice,"[Mr. Bennet, Mrs. Bennet, Jane Bennet, Elizabeth Bennet, Mary Bennet, Kitty Bennet, Lydia Bennet, Louisa Hurst, Caroline Bingley, Fitzwilliam Darcy, Georgiana Darcy, Lady Catherine de Bourgh, Anne de Bourgh, Colonel Fitzwilliam, Mr. Gardiner, Mrs. Gardiner, Sir William Lucas, Lady Lucas, Charlotte Lucas, Maria Lucas, Mr. Darcy, Charles Bingley, George Wickham, Mr. William Collins]","[Classics, Fiction, Romance, Historical Fiction]","45,880",2887,279 pages,"[1058669, 563191, 264835, 80726, 50206]",4.24,1813,0.0,5 February 2016
20,http://www.imdb.com/title/tt1374989/,Pride and Prejudice and Zombies,28000000,10907291,5324240,"
The Kitschies Nominee for Red Tentacle (Novel) (2009), Goodreads Choice Award Nominee for Favorite Book & Fantasy (2009)
",Pride and Prejudice and Zombies (Pride and Prejudice and Zombies #1),"[Mr. Bennet, Mrs. Bennet, Jane Bennet, Elizabeth Bennet, Mary Bennet, Kitty Bennet, Lydia Bennet, Fitzwilliam Darcy, Georgiana Darcy, Lady Catherine de Bourgh, Colonel Fitzwilliam, Victoria Kitchen, Charles Bingley, George Wickham, Mr. William Collins, Zombies]","[Horror, Horror, Zombies, Fantasy, Humor, Classics, Romance, Historical Fiction]","11,841",89,320 pages,"[18056, 28392, 31990, 16368, 9574]",3.28,2009,2.0,5 February 2016
21,http://www.imdb.com/title/tt0056592/,To Kill a Mockingbird,2000000,13129846,,"
Pulitzer Prize for Fiction (1961), Audie Award for Classic (2007), National Book Award Finalist for Fiction (1961), Alabama Author Award - Fiction (1961)
",To Kill a Mockingbird (To Kill a Mockingbird #1),"[Scout Finch, Atticus Finch, Jem Finch, Arthur Radley, Mayella Ewell, Aunt Alexandra, Bob Ewell]","[Classics, Fiction, Historical Fiction, Academic, School]","68,288",439,324 pages,"[1580161, 931743, 420622, 111263, 56960]",4.25,1960,4.0,16 March 1963
22,http://www.imdb.com/title/tt0413895/,Charlotte's Web,,82506325,11457353,"
Newbery Honor (1953), AudioFile Earphones Award (0), George C. Stone Center for Children's Books Recognition of Merit Award (1970), Massachusetts Children's Book Award (1984), Laura Ingalls Wilder Award (1970)
",Charlotte's Web,"[Fern, Avery, Charlotte French, Wilbur, Templeton, פרם, וילבור, שרלוטה]","[Classics, Childrens, Fiction]","12,003",167,184 pages,"[440094, 320785, 178949, 38139, 16149]",4.14,1952,5.0,15 December 2006
23,http://www.imdb.com/title/tt0311289/,Holes,20000000,67406573,16300155,"
Newbery Medal (1999), National Book Award for Young People's Literature (1998), West Australian Young Readers' Book Award (WAYRBA) for Older Readers (2001), Rebecca Caudill Young Reader's Book Award (2002), Grand Canyon Reader Award for Teen Book (2001)
...more
Nene Award (2001), Maryland Black-Eyed Susan Book Award for Grade 6-9 (2001), Massachusetts Children's Book Award (2001), Flicker Tale Children's Book Award (2000), Pennsylvania Young Readers' Choice Award for Grades 6-8 (2000), Dorothy Canfield Fisher Children's Book Award (2000), Evergreen Teen Book Award (2001), Sunshine State Young Readers Award for Grades 3-5 and Grades 6-8 (2002), Pacific Northwest Library Association Young Reader's Choice Award for Junior (2001), Zilveren Zoen (2000), Deutscher Jugendliteraturpreis Nominee for Jugendbuch (2001), Boston Globe-Horn Book Award for Fiction (1999), New Mexico Land of Enchantment Award for Young Adult (2001), Oklahoma Sequoyah Award for Children and YA (2001)
...less ",Holes (Holes #1),[Stanley Yelnats],"[Young Adult, Fiction, Childrens, Realistic Fiction]","14,802",123,233 pages,"[237631, 250748, 166571, 41263, 14298]",3.92,August 20th 1998,18.0,18 April 2003
