,Link,New Book Name,Budget,Gross,Opening,Awards List,Book Name,Characters,Genres,Num_reviews,Other editions,Pages,Star votes,Stars,publish_date,Award Count,Release Date
1043,http://www.imdb.com/title/tt0058091/,Fate Is the Hunter,2525000,2200000,,,Fate Is the Hunter,[],"[Nonfiction, History, Biography, Autobiography, Memoir, Adventure, Biography, Autobiography, Biography Memoir, War, Philosophy, War, World War II]",120,10,416 pages,"[701, 338, 92, 17, 8]",4.48,1961,0.0,
1044,http://www.imdb.com/title/tt0056541/,Sweet Bird of Youth,,,,,Sweet Bird of Youth,[],"[Plays, Drama, Classics, Literature, American, Fiction, Plays, Theatre]",46,11,72 pages,"[382, 662, 550, 109, 20]",3.74,1959,0.0,
1045,http://www.imdb.com/title/tt5721172/,The Worst Witch,,,,,The Worst Witch (The Worst Witch #1),[],"[Childrens, Fiction, Paranormal, Witches, Fantasy]",294,38,112 pages,"[4425, 4041, 3381, 687, 207]",3.93,1974,0.0,
1046,http://www.imdb.com/title/tt4512742/,Into the Wild,,,,"
Washington State Book Award (1997)
",Into the Wild,[Christopher McCandless],"[Nonfiction, Biography, Adventure, Travel]","16,225",104,207 pages,"[203901, 227630, 125733, 33209, 17896]",3.93,January 1st 1996,1.0,
1047,http://www.imdb.com/title/tt4512742/,Into the Wild,,,,,Into the Wild (Warriors #1),"[Lionheart, Firepaw, Sandpaw, Graypaw, Bluestar, Tigerclaw, Whitestorm, Dustpaw, Crookedstar]","[Fantasy, Animals, Young Adult, Fiction]","3,968",68,288 pages,"[25689, 12312, 6128, 1670, 930]",4.29,January 9th 2003,0.0,
1048,http://www.imdb.com/title/tt0085811/,Krull,47000000,16519460,5469415,,Krull,[],"[Fantasy, Science Fiction, Fiction, Media Tie In, Movies]",20,4,,"[46, 114, 194, 75, 12]",3.24,1983,0.0,29 July 1983
1049,http://www.imdb.com/title/tt5869594/,"Sex with the Queen: 900 Years of Vile Kings, Virile Lovers, and Passionate Politics",,,,,"Sex with the Queen: 900 Years of Vile Kings, Virile Lovers, and Passionate Politics",[],"[History, Nonfiction, Historical, Biography]",351,17,336 pages,"[1064, 1410, 873, 162, 61]",3.91,2005,0.0,
1050,http://www.imdb.com/title/tt1213012/,Alpha and Omega: The Junior Novel,20000000,25077977,9106906,,Alpha and Omega: The Junior Novel,[],[],6,All Editions,128 pages,"[19, 9, 8, 3, 6]",3.71,,0.0,17 September 2010
1051,http://www.imdb.com/title/tt0604045/,The Hundred Dresses,,,,"
Newbery Honor (1945)
",The Hundred Dresses,[],"[Childrens, Fiction, Classics, Realistic Fiction]","1,858",29,80 pages,"[10501, 8426, 5086, 1234, 400]",4.07,1944,1.0,
1052,http://www.imdb.com/title/tt0136244/,Hideous Kinky,12000000,1262786,82431,,Hideous Kinky,[],"[Fiction, Cultural, Africa, Travel, Contemporary, Literary Fiction, Novels, Young Adult, Coming Of Age, Modern, Family, Literature, 20th Century]",203,22,192 pages,"[348, 853, 901, 279, 71]",3.46,January 30th 1992,0.0,
1053,http://www.imdb.com/title/tt3869514/,Burned,,,,"
Goodreads Choice Award Nominee for Fantasy (2015)
",Burned (Fever #7),"[MacKayla Lane, Dani O'Malley, Jericho Barrons, Drustan MacKeltar, Dageus MacKeltar, Christian MacKeltar, Ryodan, Lor, Dancer, Jana, Jo, Cat]","[Fantasy, Urban Fantasy, Fantasy, Fantasy, Paranormal, Romance, Romance, Paranormal Romance, Fairies, Fae]","2,687",19,475 pages,"[7904, 6319, 3163, 882, 296]",4.11,,1.0,
1054,http://www.imdb.com/title/tt2099561/,Hitman: Enemy Within,,,,,Hitman: Enemy Within (Hitman #1),[],"[Fiction, Thriller, Games, Gaming, Games, Video Games, Novels, Mystery, Crime, Adventure, Action, Mystery]",30,6,320 pages,"[112, 124, 116, 29, 10]",3.76,January 1st 2007,0.0,1995
1055,http://www.imdb.com/title/tt0112792/,Dangerous Minds,23000000,84919401,14931503,,Dangerous Minds,[],"[Nonfiction, Autobiography, Memoir, Teaching, Education, Biography]",54,13,278 pages,"[227, 283, 249, 40, 9]",3.84,1992,0.0,11 August 1995
1056,http://www.imdb.com/title/tt1722100/,Mrs. McGinty's Dead,,,,,Mrs. McGinty's Dead (Hercule Poirot #28),"[Ariadne Oliver, Hercule Poirot]","[Mystery, Mystery, Crime, Fiction, Mystery, Detective]",440,149,0 pages,"[2673, 4836, 3851, 532, 53]",3.8,February 1952,0.0,
1057,http://www.imdb.com/title/tt1722100/,The Mystery of the Blue Train,,,,,The Mystery of the Blue Train (Hercule Poirot #6),"[Mr. Goby, Pierre Michel, Monsieur le Marquis, Demetrius Papopolous, Zia Papopolous, Rufus Van Aldin, Major Richard Knighton, Ruth Kettering, Derek Kettering, Armand, the Comte de la Roche, Mademoiselle Mirelle, Katherine Grey, Dr. Arthur Harrison, Polly Harrison, Lady Rosalie Tamplin, Charles Evans, Lenox Tamplin, Monsieur Caux, Ada (Beatrice) Mason, Monsieur Carrege, Miss Amelia Viner, Hippolyte Flavelle, Marie Flavelle, Joseph Aarons, Kitty Kidd, Hercule Poirot]","[Mystery, Classics]",891,206,317 pages,"[4028, 7450, 6063, 1066, 136]",3.76,March 29th 1928,0.0,
1058,http://www.imdb.com/title/tt1722100/,Death in the Clouds,,,,,Death in the Clouds (Hercule Poirot #12),"[Inspector Japp, Hercule Poirot]","[Mystery, Fiction, Mystery, Crime, Mystery, Detective]",788,166,333 pages,"[4087, 7391, 6059, 943, 115]",3.77,March 10th 1935,0.0,
1059,http://www.imdb.com/title/tt1722100/,After the Funeral,,,,,After the Funeral (Hercule Poirot #29),"[Mr. Goby, Hercule Poirot]","[Mystery, Crime, Mystery, Mystery, Detective, Classics]",678,175,256 pages,"[3493, 6244, 4608, 633, 56]",3.83,March 1953,0.0,
1060,http://www.imdb.com/title/tt2558318/,The Dead and the Gone,,,,"
South Carolina Book Award Nominee for Young Adult Book Award (2011)
",The Dead and the Gone (Last Survivors #2),"[Alex Morales, Julie Morales, Briana Morales]","[Young Adult, Science Fiction, Dystopia, Science Fiction, Apocalyptic, Post Apocalyptic, Fiction]","2,890",23,336 pages,"[8719, 10542, 8014, 1961, 539]",3.84,,1.0,
1061,http://www.imdb.com/title/tt0067110/,The Forgotten Man: A New History of the Great Depression,,,,,The Forgotten Man: A New History of the Great Depression,[],"[History, Nonfiction, Economics, Politics, North American Hi..., American History]",580,16,390 pages,"[1306, 1522, 831, 260, 117]",3.9,,0.0,
1062,http://www.imdb.com/title/tt0332047/,Fever Moon: The Fear Dorcha,30000000,42071069,12400125,,Fever Moon: The Fear Dorcha (Fever #5.5),"[MacKayla Lane, Jericho Barrons, V'lane]","[Sequential Art, Graphic Novels, Fantasy, Urban Fantasy, Fantasy, Fantasy, Paranormal, Fairies, Fae, Adult]",451,6,184 pages,"[1297, 1126, 836, 203, 85]",3.94,,0.0,8 April 2005
1063,http://www.imdb.com/title/tt0332047/,Fever Pitch,30000000,42071069,12400125,"
William Hill Sports Book of the Year (1992)
",Fever Pitch,[],"[Fiction, Sports and Games, Sports, Football, Soccer]","1,153",73,272 pages,"[6372, 9719, 7586, 2117, 742]",3.71,1992,1.0,8 April 2005
1064,http://www.imdb.com/title/tt1161402/,The Seventh Scroll,,,,,The Seventh Scroll (Ancient Egypt #2),"[Taita, Duraid, Roana]","[Historical Fiction, Fiction, Adventure, Cultural, Egypt, Historical, Thriller, Mystery, Fantasy, Cultural, Africa, Action]",421,67,614 pages,"[4733, 4686, 2252, 506, 115]",4.09,1995,0.0,1938
1065,http://www.imdb.com/title/tt0404203/,Little Children,26000000,5459824,97953,,Little Children,"[Richard Papen, Sarah Lynn, Kathy, Todd]","[Fiction, Contemporary, Adult Fiction]","2,055",43,355 pages,"[4276, 10285, 7974, 2335, 589]",3.6,January 1st 2004,0.0,9 February 2007
1066,http://www.imdb.com/title/tt4094300/,Crazy,,,,,Crazy,[],"[Young Adult, Fiction, European Literature, German Literature, Academic, School, Contemporary]",81,31,175 pages,"[155, 257, 538, 353, 145]",2.95,1999,0.0,
1067,http://www.imdb.com/title/tt1454530/,Portrait in Sepia,90000,,,,Portrait in Sepia,"[Aurora del Valle, Eliza Sommers, Tao Chi'en, Paulina del Valle, Lynn Sommers, Severo del Valle, Nivea del Valle]","[Fiction, Historical Fiction, Historical, Romance, Novels]","1,060",88,336 pages,"[6532, 10251, 5880, 1001, 173]",3.92,2000,0.0,
1068,http://www.imdb.com/title/tt0097576/,Indiana Jones and the Last Crusade,48000000,197171806,29400000,,Indiana Jones and the Last Crusade (Indiana Jones: Film Novelizations #3),[Indiana Jones],"[Adventure, Fiction, Fantasy, Media Tie In, Movies, Action]",32,14,224 pages,"[784, 506, 290, 35, 16]",4.23,June 1989,0.0,24 May 1989
1069,http://www.imdb.com/title/tt2660888/,Star Trek,185000000,158804470,59253211,,Star Trek (Star Trek: Movie Novelizations #1),"[Spock, James Tiberius Kirk, Leonard Horatio McCoy, Christopher Pike, Hikaru Sulu, Montgomery Scott, Pavel Chekov, Nyota Uhura]","[Media Tie In, Star Trek, Science Fiction, Fiction]",228,23,274 pages,"[594, 737, 543, 144, 34]",3.83,2009,0.0,22 July 2016
1070,http://www.imdb.com/title/tt0426688/,The First World War,,,,"
Duke of Westminster's Medal for Military Literature (1999)
",The First World War (The World Wars #1),[],"[History, Nonfiction, Military, Military History, War, War, World War I, War, Military]",323,29,475 pages,"[2785, 3834, 1885, 315, 101]",4.0,1998,1.0,
1071,http://www.imdb.com/title/tt0058333/,The Masque of the Red Death,,,,,The Masque of the Red Death,[],"[Classics, Fiction, Short Stories, Horror, Mystery]",564,104,16 pages,"[7324, 7055, 3693, 741, 168]",4.09,1842,0.0,
1072,http://www.imdb.com/title/tt0193288/,Warlock,,,,"
California Book Award Gold Medal for Fiction (1958)
",Warlock (Legends West #1),"[John Gannon, Clay Blaisedell, Tom Morgan, Kate Dollar, Henry Holmes Goodpasture]","[Fiction, Western, Historical Fiction, Novels]",194,17,488 pages,"[760, 536, 151, 39, 22]",4.31,1958,1.0,
1073,http://www.imdb.com/title/tt0463373/,Stellaluna,,,,"
American Booksellers Book Of The Year  Award for Children (1994), Keystone to Reading Book Award (1995)
",Stellaluna,[],"[Childrens, Picture Books, Childrens, Animals]","1,076",35,46 pages,"[40947, 22722, 13498, 3063, 1159]",4.22,,2.0,
1074,http://www.imdb.com/title/tt0113501/,Just Cause,,36853222,10607932,,Just Cause,[],"[Thriller, Mystery, Crime, Mystery, Adult, Suspense, Thriller, Mystery Thriller, Contemporary, Fiction, Literature, American]",100,26,494 pages,"[327, 587, 381, 87, 8]",3.82,1992,0.0,17 February 1995
1075,http://www.imdb.com/title/tt1135084/,The Taker,20000000,57744720,20512304,,The Taker (The Taker Trilogy #1),"[Lanore McIlvrae, Luke Findley, Jonathan St. Andrew, Adair]","[Fantasy, Paranormal, Fantasy, Historical Fiction, Romance, Fiction, Historical]","1,194",30,438 pages,"[1718, 2152, 1521, 559, 344]",3.69,April 14th 2011,0.0,27 August 2010
1076,http://www.imdb.com/title/tt1809398/,"Unbroken: A World War II Story of Survival, Resilience, and Redemption",65000000,115637895,30621445,"
Los Angeles Times Book Prize for Biography (2010), Pennsylvania Young Readers' Choice Award Nominee for Young Adults (2014), Indies Choice Book Award for Nonfiction (2011), Dayton Literary Peace Prize Nominee for NonFiction (2011), Abraham Lincoln Award Nominee (2015)
...more
Goodreads Choice Award Nominee for History and Biography (2010)
...less ","Unbroken: A World War II Story of Survival, Resilience, and Redemption","[Louie Zamperini, Russell Allen Phillips]","[Nonfiction, History, Biography, War, War, World War II]","40,294",68,497 pages,"[276017, 126964, 40548, 10594, 7910]",4.41,,5.0,25 December 2014
1077,http://www.imdb.com/title/tt1848902/,"Game Change: Obama and the Clintons, McCain and Palin, and the Race of a Lifetime",,,,"
Goodreads Choice Award Nominee for Nonfiction (2010)
","Game Change: Obama and the Clintons, McCain and Palin, and the Race of a Lifetime (Game Change #1)","[Bill Clinton, Barack Obama, John McCain, Sarah Palin, Hillary Rodham Clinton]","[Politics, Nonfiction, History]","2,531",20,448 pages,"[6159, 8340, 3125, 480, 115]",4.09,January 1st 2010,1.0,
1078,http://www.imdb.com/title/tt0134119/,The Talented Mr. Ripley,40000000,81292135,12738237,"
Edgar Award Nominee for Best Novel (1956)
",The Talented Mr. Ripley (Ripley #1),"[Tom Ripley, Dickie Greenleaf, Marge Sherwood, Freddie Miles]","[Fiction, Mystery, Mystery, Crime, Thriller, Classics]","1,958",133,249 pages,"[9680, 14336, 7595, 1668, 497]",3.92,1955,1.0,25 December 1999
1079,http://www.imdb.com/title/tt0134119/,The Talented Mr. Ripley,40000000,81292135,12738237,"
Edgar Award Nominee for Best Novel (1956)
",The Talented Mr. Ripley (Ripley #1),"[Tom Ripley, Dickie Greenleaf, Marge Sherwood, Freddie Miles]","[Fiction, Mystery, Mystery, Crime, Thriller, Classics]","1,958",133,273 pages,"[9680, 14335, 7595, 1668, 497]",3.92,1955,1.0,25 December 1999
1080,http://www.imdb.com/title/tt0837231/,Tintin in America,,,,,Tintin in America (Tintin #3),"[Tintin, Snowy, Bobby Smiles, Al Capone]","[Sequential Art, Comics, Sequential Art, Graphic Novels, Adventure, Fiction, Sequential Art, Bande Dessinée, Childrens]",261,72,62 pages,"[2867, 2880, 2943, 899, 179]",3.75,1932,0.0,
1081,http://www.imdb.com/title/tt3980490/,Indiana Jones and the Raiders of the Lost Ark,,,,,Indiana Jones and the Raiders of the Lost Ark (Indiana Jones: Film Novelizations #1),[],"[Adventure, Fiction, Fantasy, Historical Fiction, Media Tie In, Movies]",50,22,181 pages,"[1426, 801, 511, 91, 36]",4.22,1981,0.0,
1082,http://www.imdb.com/title/tt0163651/,American Pie,11000000,101736215,18709680,,American Pie,[],"[Fiction, American, Southern, Womens Fiction, Chick Lit, Humor, Womens Fiction]",62,4,336 pages,"[161, 216, 219, 67, 20]",3.63,September 1st 1996,0.0,9 July 1999
1083,http://www.imdb.com/title/tt0113091/,Follow the River,,,,,Follow the River,"[Mary Ingles, Will Ingles, Gander Jack, Henry Lenard, Otter Girl, Mister Harmon, Adam Harmon, Captain Wildcat, Johnny Draper, William Ingles, Blue Ridge, Bettie Draper, Colonel Patton, Bettie Elenor, Colonel Washington, Captain Buchanan, John Ingles, Dunkard's Bottom, Elenor Draper, Mary Draper Ingles, Philip Lybrook, Casper Barrier, Snake Stick]","[Historical Fiction, Fiction, Historical, Adventure]","1,841",17,406 pages,"[6149, 4952, 2011, 387, 171]",4.21,1981,0.0,
1084,http://www.imdb.com/title/tt1395136/,Paris 1919: Six Months That Changed the World,,,,"
Arthur Ross Book Award (2003), Canadian Booksellers Association Libris Award for Non‐Fiction Book (2003), Duff Cooper Prize (2001), Samuel Johnson Prize for Non-Fiction (2002), Hessell-Tiltman Prize (2002)
",Paris 1919: Six Months That Changed the World,"[David Lloyd George, Woodrow Wilson, Georges Clemenceau]","[History, Nonfiction, War, World War I, History, European History, War]",522,21,570 pages,"[2736, 3093, 1385, 282, 80]",4.07,September 6th 2001,5.0,
1085,http://www.imdb.com/title/tt0078586/,Iced,,,,"
Goodreads Choice Award Nominee for Paranormal Fantasy (2012)
",Iced (Fever #6),"[Dani O'Malley, Christian MacKeltar, Ryodan, Dancer, Cruce, Lor]","[Fantasy, Urban Fantasy, Fantasy, Fantasy, Paranormal, Fairies, Fae, Romance, Paranormal Romance, Romance]","3,910",23,512 pages,"[13309, 10011, 4978, 1259, 589]",4.13,October 29th 2012,1.0,
1086,http://www.imdb.com/title/tt4680278/,Para sa Hopeless Romantic,,,,"
Filipino Readers' Choice Award Nominee for Fiction in Filipino/Taglish (2014)
",Para sa Hopeless Romantic,"[Becca, Ryan Sebastian, Maria Christine Lopez, Peter San Jose, Samuel Andoyo]","[Romance, Love, Young Adult, Romantic, Drama, Realistic Fiction, Romance, Love Story, Contemporary, Anthologies, Collections]",204,2,148 pages,"[1970, 532, 443, 180, 171]",4.2,,1.0,
1087,http://www.imdb.com/title/tt0283705/,Anne of Green Gables Boxed Set,,,,,Anne of Green Gables Boxed Set (Anne of Green Gables #1-3),[],"[Classics, Fiction, Young Adult, Historical Fiction]",155,24,0 pages,"[2299, 944, 364, 69, 29]",4.46,1908,0.0,
1088,http://www.imdb.com/title/tt4952458/,Brother in the Land,,,,"
Red House Children's Book Award (1985)
",Brother in the Land,[],"[Young Adult, Science Fiction, Apocalyptic, Post Apocalyptic, Science Fiction, Dystopia, Childrens]",61,12,151 pages,"[254, 265, 150, 48, 17]",3.94,January 1st 1984,1.0,
1089,http://www.imdb.com/title/tt0051028/,The Sun Also Rises,,,,,The Sun Also Rises,"[Jake Barnes, Brett Ashley, Robert Cohn, Michael Campbell, Bill Gorton, Pedro Romero]","[Classics, Fiction, Novels, Literature, American, Historical Fiction]","9,085",36,256 pages,"[88147, 99446, 65764, 22225, 8975]",3.83,1926,0.0,23 August 1957
1090,http://www.imdb.com/title/tt0100116/,"Martians, Go Home",,129778,,,"Martians, Go Home",[],"[Science Fiction, Humor, Fiction, Fantasy, Humor, Comedy, Classics, Science Fiction Fantasy, Mystery, Humor, Funny, Literature, American]",79,33,162 pages,"[312, 500, 373, 79, 21]",3.78,September 1954,0.0,20 April 1990
1091,http://www.imdb.com/title/tt0218687/,Under the Black Flag: The Romance and the Reality of Life Among the Pirates,,,,,Under the Black Flag: The Romance and the Reality of Life Among the Pirates,"[Black Beard, Henry Morgan, Henry Avery, William Kidd, John Rackham, Anne Bonny, Mary Read]","[History, Nonfiction, Adventure, Pirates, Historical]",443,17,319 pages,"[1141, 2226, 1905, 420, 86]",3.68,1995,0.0,2 December 1913
1092,http://www.imdb.com/title/tt3393786/,Faefever,60000000,49113273,22872490,,Faefever (Fever #3),"[MacKayla Lane, Rowena, Dani O'Malley, Jericho Barrons, V'lane, Lord Master, Derek O'Bannion, Christian MacKeltar, Inspector Jayne, Darroc]","[Fantasy, Urban Fantasy, Fantasy, Paranormal, Romance, Paranormal Romance, Fairies, Fae, Fantasy, Adult]","3,763",42,327 pages,"[38151, 23638, 8543, 1459, 528]",4.35,,0.0,21 October 2016
1093,http://www.imdb.com/title/tt0097553/,I Know My First Name Is Steven,,,,,I Know My First Name Is Steven,[],"[Crime, True Crime, Nonfiction, Mystery, Crime, Biography]",62,2,,"[1894, 1505, 848, 132, 49]",4.14,,0.0,
1094,http://www.imdb.com/title/tt0083100/,The Hound of the Baskervilles,,,,"
Audie Award for Best Audio Drama (2015)
",The Hound of the Baskervilles (Sherlock Holmes #5),"[Charles Baskerville, Henry Baskerville, Dr. John Watson, James Mortimer, John Barrymore, Eliza Barrymore, Mr. Perkins, Mr. Frankland, Jack Stapleton, Beryl Stapleton, James Desmond, Johna Clayton, Mr. Selden, Laura Lyons, Sherlock Holmes]","[Classics, Mystery, Fiction, Mystery, Crime]","4,960",1443,256 pages,"[59150, 66075, 33075, 4872, 1002]",4.08,April 1st 1902,1.0,
1095,http://www.imdb.com/title/tt1764666/,The Little Engine That Could,,,,"
Lewis Carroll Shelf Award (1958)
",The Little Engine That Could (The Little Engine That Could),[],"[Childrens, Childrens, Picture Books, Classics]",955,84,48 pages,"[39754, 20822, 15225, 4075, 1555]",4.14,1930,1.0,
1096,http://www.imdb.com/title/tt0633081/,The Little House Collection,,,,,The Little House Collection (Little House #1-9),[],"[Classics, Childrens, Historical Fiction, Young Adult, Fiction, Historical, Childrens, Middle Grade, Childrens, Juvenile, Literature, Kids]","1,966",13,2700 pages,"[69524, 36210, 15433, 3007, 2297]",4.33,1953,0.0,
1097,http://www.imdb.com/title/tt0387059/,Bee Season,14000000,1180560,120544,"
New York Public Library Young Lions Fiction Award Nominee (2001), Guardian First Book Award Nominee for Longlist (2001), Edward Lewis Wallant Award (2001), PEN/Hemingway Foundation Award Nominee (2001), Borders Original Voices Award for Fiction (2000)
",Bee Season,"[Eliza Naumann, Saul Naumann, Miriam Naumann, Aaron Naumann]","[Fiction, Literature, Jewish, Adult Fiction, Contemporary]","1,453",4,275 pages,"[3720, 7746, 7141, 2245, 654]",3.54,2000,5.0,23 November 2005
1098,http://www.imdb.com/title/tt1692928/,The Lastling,,631925,,,The Lastling,[],"[Adventure, Fantasy]",22,4,256 pages,"[19, 26, 26, 28, 18]",3.0,December 31st 2003,0.0,18 February 2011
1099,http://www.imdb.com/title/tt0117093/,Mother Night,6000000,392362,48661,,Mother Night,[],"[Fiction, Classics, Historical Fiction, Literature, War, Humor]","1,949",99,282 pages,"[20923, 20668, 8413, 1015, 177]",4.19,1961,0.0,1 November 1996
1100,http://www.imdb.com/title/tt1154791/,Legacy of Ashes: The History of the CIA,,,,"
National Book Award for Non-Fiction (2007), Lionel Gelber Prize Nominee (2008), Los Angeles Times Book Prize for History (2007)
",Legacy of Ashes: The History of the CIA,"[Bill Clinton, George W. Bush, John F. Kennedy, Richard Nixon, J. Edgar Hoover, Jimmy Carter, George H.W. Bush, Ronald Reagan, Harry S. Truman, Dwight D. Eisenhower, Gerald Ford, Lyndon B. Johnson, Frank G. Wisner, Allen W. Dulles, Bill Bundy, General Dwight D. Eisenhower, Richard Bissell, Mc Cone, James J. Angleton, William Jefferson 'Bill' Clinton, General William J. Donovan, Walter Bedell Smith, Nobusuke Kishi, Albert R. Haney, William Webster, Yuri Nosenko, William E. Colby, Bob Gates, James R. Schlesinger, Porter J. Goss, John McMahon, Red Raborn, John Deutch, Tom Polgar, John Whitten, General Colin Powell, Michael Forrestal, John McCloy, Elfego Monzon, Robert Ames, General Hussein Kamal, Red White, Carlos Enrique Diaz, Luke Battle, Tony Lake, Al Cox, Bob Martens, William Rountree, Thomas L. Hughes, General Reinhard Gehlen, Rene Barrientos, Jack Kubisch, Ed Howard, William Pawley, General Norman Schwarzkopf, L. Patrick Gray, General Vang Pao, Christopher Montague Woodhouse, Don Winters, Peter Sichel, Big Minh, Nestor Sanchez, Dick Lehman, Bill Buckley, Haji Abdul Qadir, General Charles Pearre Cabell, Ed Lansdale, Duane Clarridge, George Carver, Thomas R. Hall, Clyde McAvoy, General Manuel Noriega, James R. Killian, Asadollah Rashidian, Hanson Baldwin, Sherman Kent, John McLaughlin, James V. Forrestal, David K. E. Bruce, James Q. Reber, Tony Poe, General Rene Schneider, Marilyn McAfee, Joseph Grew, Agustín Edwards, Rufus Phillips, Jack Peurifoy, Joseph Mobutu, Robert Amory, Adolf Tolkachev, General Alexander Haig, John Tilton, George W. Allen, Don Gregg, William J. Daugherty, Desmond FitzGerald, Joseph P. O'Neill, Carlos Castillo Armas, General Camilo Valenzuela, James Monnier Simon, ...]","[History, Nonfiction, Politics, Spy Thriller, Espionage, North American Hi..., American History, War]",772,47,702 pages,"[1876, 3095, 1644, 375, 105]",3.88,January 1st 2007,3.0,
1101,http://www.imdb.com/title/tt0394908/,Bloodfever,,,,"
Romantic Times Reviewers' Choice Award (RT Award) for Best Historical Time Travel (1999)
",Bloodfever (Fever #2),"[MacKayla Lane, Rowena, Dani O'Malley, Jericho Barrons, V'lane, Lord Master, Malluce, Derek O'Bannion, Christian MacKeltar, Inspector Jayne]","[Fantasy, Urban Fantasy, Fantasy, Fantasy, Paranormal, Romance, Romance, Paranormal Romance, Fairies, Fae, Adult]","4,052",48,303 pages,"[36554, 25697, 9334, 1567, 361]",4.31,,1.0,
1102,http://www.imdb.com/title/tt0030865/,Three Comrades,,,,,Three Comrades (All Quiet on the Western Front/The Road Back/Three Comrades #3),"[Robert Lohkamp, Gottfried Lenz, Otto Köster]","[Classics, Fiction, European Literature, German Literature, Historical Fiction, War]",373,89,480 pages,"[9356, 3992, 1397, 261, 79]",4.48,1936,0.0,3 June 1938
1103,http://www.imdb.com/title/tt4731008/,Robinson Crusoe,13000000,7965609,3342696,,Robinson Crusoe (Robinson Crusoe #1),"[Robinson Crusoe, Friday Baldwin]","[Classics, Fiction, Adventure, Literature, Historical Fiction, Novels, Literature, 18th Century, Classics, Classic Literature, Academic, School, European Literature, British Literature]","4,219",1926,287 pages,"[43725, 63097, 55241, 16993, 6012]",3.66,April 25th 1719,0.0,9 September 2016
1104,http://www.imdb.com/title/tt5494516/,The Long Winter,,,,"
Newbery Honor (1941), Boston Globe-Horn Book Award (1940)
",The Long Winter (Little House #6),"[Laura Ingalls Wilder, Caroline Quiner Ingalls, Charles Ingalls, Mary Ingalls, Carrie Ingalls, Grace Ingalls, Almanzo Wilder]","[Historical Fiction, Classics, Childrens, Fiction, Young Adult]","1,176",66,422 pages,"[23507, 17924, 9549, 1507, 621]",4.17,1940,2.0,
1105,http://www.imdb.com/title/tt5605638/,Little Earthquakes,,,,,Little Earthquakes,[],"[Womens Fiction, Chick Lit, Fiction, Romance, Adult, Contemporary, Adult Fiction, Humor, Novels, Family, Book Club]","2,389",50,557 pages,"[18672, 29514, 23847, 5095, 1203]",3.76,2004,0.0,
1106,http://www.imdb.com/title/tt0417072/,Ghost Soldiers: The Epic Account of World War II's Greatest Rescue Mission,,6744984,,,Ghost Soldiers: The Epic Account of World War II's Greatest Rescue Mission,[],"[History, Nonfiction, War, War, Military, War, World War II, Military, Military History]","1,068",26,344 pages,"[9859, 8719, 3706, 657, 320]",4.17,2001,0.0,
1107,http://www.imdb.com/title/tt3602718/,Dreamfever,,,,,Dreamfever (Fever #4),"[MacKayla Lane, Rowena, Dani O'Malley, Jericho Barrons, V'lane, Lord Master, Derek O'Bannion, Christian MacKeltar, Ryodan, Darroc]","[Fantasy, Fantasy, Paranormal, Romance, Fantasy, Urban Fantasy, Romance, Paranormal Romance, Fairies, Fae, Adult]","3,979",35,386 pages,"[42537, 21548, 6784, 1256, 473]",4.44,,0.0,
1108,http://www.imdb.com/title/tt2118600/,Citizen Soldiers: The U S Army from the Normandy Beaches to the Bulge to the Surrender of Germany,20000000,,,,Citizen Soldiers: The U S Army from the Normandy Beaches to the Bulge to the Surrender of Germany,[],"[Nonfiction, History, War, Military, War, War, World War II, Military, Military History]",342,30,528 pages,"[6664, 6520, 2585, 375, 134]",4.18,October 7th 1997,0.0,
1109,http://www.imdb.com/title/tt2034647/,Darkfever,,,,,Darkfever (Fever #1),"[MacKayla Lane, Rowena, Jericho Barrons, V'lane, Lord Master, Malluce]","[Fantasy, Urban Fantasy, Fantasy, Fantasy, Paranormal, Romance, Romance, Paranormal Romance, Fairies, Fae]","7,982",56,309 pages,"[53789, 35227, 18613, 5153, 2522]",4.15,October 1st 2006,0.0,
