,Link,New Book Name,Budget,Gross,Opening,Awards List,Book Name,Characters,Genres,Num_reviews,Other editions,Pages,Star votes,Stars,publish_date,Award Count,Num Characters,Star_count_5,Star_count_4,Star_count_3,Star_count_2,Star_count_1,Star_count_total,Genre_Fiction,Genre_Fantasy,Genre_Classics,Genre_Mystery,Genre_Young Adult,Genre_Romance,Genre_Literature,Genre_Historical Fiction,Genre_Thriller,Genre_Childrens,Genre_Science Fiction,Genre_Novels,Genre_Contemporary,Genre_Adventure,Genre_Crime,Genre_Cultural,Genre_Sequential Art,Genre_Historical,Genre_Humor,Genre_Horror,Genre_Paranormal,Genre_Nonfiction,Genre_War,Genre_European Literature,Genre_Biography,Genre_Womens Fiction,Genre_Suspense,Genre_Chick Lit,Genre_Adult,Genre_Autobiography,Genre_History,Release Date,Time Diff
1044,http://www.imdb.com/title/tt2118600/,Citizen Soldiers: The U S Army from the Normandy Beaches to the Bulge to the Surrender of Germany,20000000,,,,Citizen Soldiers: The U S Army from the Normandy Beaches to the Bulge to the Surrender of Germany,[],"[Nonfiction, History, War, Military, War, War, World War II, Military, Military History]",342.0,30.0,528.0,"[6664, 6520, 2585, 375, 134]",4.18,1997-10-07,0.0,0.0,134.0,375.0,2585.0,6520.0,6664.0,16278.0,0.0,0.0,0.0,0.0,0.0,0.0,0.0,0.0,0.0,0.0,0.0,0.0,0.0,0.0,0.0,0.0,0.0,0.0,0.0,0.0,0.0,1.0,1.0,0.0,0.0,0.0,0.0,0.0,0.0,0.0,1.0,,
1045,http://www.imdb.com/title/tt2034647/,Darkfever,,,,,Darkfever (Fever #1),"[MacKayla Lane, Rowena, Jericho Barrons, V'lane, Lord Master, Malluce]","[Fantasy, Urban Fantasy, Fantasy, Fantasy, Paranormal, Romance, Romance, Paranormal Romance, Fairies, Fae]",7982.0,56.0,309.0,"[53789, 35227, 18613, 5153, 2522]",4.15,2006-10-01,0.0,6.0,2522.0,5153.0,18613.0,35227.0,53789.0,115304.0,0.0,1.0,0.0,0.0,0.0,1.0,0.0,0.0,0.0,0.0,0.0,0.0,0.0,0.0,0.0,0.0,0.0,0.0,0.0,0.0,1.0,0.0,0.0,0.0,0.0,0.0,0.0,0.0,0.0,0.0,0.0,,
1046,http://www.imdb.com/title/tt0051383/,Auntie Mame: An Irreverent Escapade,2240000,23300000,,,Auntie Mame: An Irreverent Escapade (Auntie Mame #1),"[Frank Crowninshield, Condé Montrose Nast, Patrick Dennis, Mame Dennis Burnside, Mr. Dennis, Norah Muldoon, Ito, Unforgettable Character, Eunice Babcock, Dwight Babcock, Jr., Ralph Devine, Natalie Devine, Florian McDermott, Horace Liveright, Elsie de Wolfe, Mrs. Riemenschneider, Jessie Franklin Turner, Neysa McMein, Henri Bendel, Frank Case, Euthanasia Gomez, Annie Laurie Williams, Beauregard Jackson Pickett Burnside, Mrs. Burnside, Fan Burnside, Willie Mae Burnside, Sally Randolph Burnside, Sally Cato McDougall, Emory Oglethorpe McDougall, Van Buren Clay-Pickett, Lightning Rod (horse), Basil Fitz-Hugh, Agnes Gooch, Mary Lord Bishop, Lindsay Woolsey, Bella Shuttleworth, Kit Cornell, Brian O'Bannion, Dr. Cheevey, Ernest Pugh, Bubbles from Newark, Biff (Fred Astaire Club), Bill (Fred Astaire Club), Jack (Fred Astaire Club), Alex (Fred Astaire Club), Professor Townsend, Mr. Townsend, Old Casey, Repulsive Remington, Gloria Upson, Claude ""Buster"" Upson, Doris Upson, Boyd Upson, Emily Upson, Deborah Upson, Abraham Bernstein, Sylvia Bernstein, Charlie Haddock, Miss Peabody, Miss Pringle, Edmund Jenkins, Gladys Martin (Auntie Mame), Enid Little, Albert (Auntie Mame), Ginger (Auntie Mame), Margaret Rose (Auntie Mame), Doc Potter, Michael ""Mickey the Mick"" Ryan, Pegeen Ryan Dennis, Margot Maddox, Miranda Maddox, Melissa Maddox (Auntie Mame), Mike Dennis, Vera Charles, Dwight Babcock]","[Fiction, Humor, Classics]",691.0,39.0,299.0,"[2181, 2158, 1043, 205, 48]",4.1,1954-04-01,0.0,76.0,48.0,205.0,1043.0,2158.0,2181.0,5635.0,1.0,0.0,1.0,0.0,0.0,0.0,0.0,0.0,0.0,0.0,0.0,0.0,0.0,0.0,0.0,0.0,0.0,0.0,1.0,0.0,0.0,0.0,0.0,0.0,0.0,0.0,0.0,0.0,0.0,0.0,0.0,1958-12-27,1731 days 00:00:00.000000000
1047,http://www.imdb.com/title/tt0079240/,The Great Train Robbery,6000000,391942,391942,"
California Book Award Silver Medal for Fiction (1975)
",The Great Train Robbery,[],"[Fiction, Historical Fiction, Thriller, Mystery, Historical]",840.0,72.0,300.0,"[4868, 7408, 5028, 1173, 230]",3.83,1975-04-12,1.0,0.0,230.0,1173.0,5028.0,7408.0,4868.0,18707.0,1.0,0.0,0.0,1.0,0.0,0.0,0.0,1.0,1.0,0.0,0.0,0.0,0.0,0.0,0.0,0.0,0.0,1.0,0.0,0.0,0.0,0.0,0.0,0.0,0.0,0.0,0.0,0.0,0.0,0.0,0.0,1979-02-02,1392 days 00:00:00.000000000
1048,http://www.imdb.com/title/tt3077530/,Wolverine: Origin,,,,,Wolverine: Origin (Wolverine Marvel Comics),"[Wolverine, James Howlett]","[Sequential Art, Comics, Sequential Art, Graphic Novels, Superheroes, Marvel, Comics, Comic Book, Marvel, X Men, Fiction, Graphic Novels Comics]",300.0,31.0,200.0,"[4394, 4116, 2732, 769, 203]",3.96,2017-11-01,0.0,2.0,203.0,769.0,2732.0,4116.0,4394.0,12214.0,1.0,0.0,0.0,0.0,0.0,0.0,0.0,0.0,0.0,0.0,0.0,0.0,0.0,0.0,0.0,0.0,1.0,0.0,0.0,0.0,0.0,0.0,0.0,0.0,0.0,0.0,0.0,0.0,0.0,0.0,0.0,,
1049,http://www.imdb.com/title/tt0104454/,Howards End,,157888,23840,,Howards End,[],"[Fiction, Literature, European Literature, British Literature, Historical Fiction, Novels]",1788.0,318.0,368.0,"[18018, 20849, 12429, 2893, 943]",3.95,1910-04-12,0.0,0.0,943.0,2893.0,12429.0,20849.0,18018.0,55132.0,1.0,0.0,0.0,0.0,0.0,0.0,1.0,1.0,0.0,0.0,0.0,1.0,0.0,0.0,0.0,0.0,0.0,0.0,0.0,0.0,0.0,0.0,0.0,1.0,0.0,0.0,0.0,0.0,0.0,0.0,0.0,1993-02-26,30271 days 00:00:00.000000000
1050,http://www.imdb.com/title/tt0092497/,4:50 from Paddington,,,,,4:50 from Paddington (Miss Marple #8),"[Lucy Eyelesbarrow, Jane Marple]","[Mystery, Mystery, Crime, Fiction, Classics, Mystery, Detective]",1099.0,211.0,288.0,"[7007, 11047, 7229, 860, 109]",3.91,2057-11-12,0.0,2.0,109.0,860.0,7229.0,11047.0,7007.0,26252.0,1.0,0.0,1.0,1.0,0.0,0.0,0.0,0.0,0.0,0.0,0.0,0.0,0.0,0.0,1.0,0.0,0.0,0.0,0.0,0.0,0.0,0.0,0.0,0.0,0.0,0.0,0.0,0.0,0.0,0.0,0.0,,
1051,http://www.imdb.com/title/tt2672462/,Shadowfever,,,,"
Romantic Times Reviewers' Choice Award (RT Award) for Best Urban Fantasy Protagonist (2011), DABWAHA Romance Tournament for Best Romance of the Year & Best Novel with Romantic Elements/Crossover (2012), Goodreads Choice Award for Best Paranormal Fantasy (2011)
",Shadowfever (Fever #5),"[MacKayla Lane, Rowena, Dani O'Malley, Jericho Barrons, V'lane, Christian MacKeltar, Inspector Jayne, Ryodan, Queen Aoibheal, Darroc, Cruce, Lor]","[Fantasy, Urban Fantasy, Fantasy, Fantasy, Paranormal, Romance, Romance, Paranormal Romance, Fairies, Fae]",5781.0,35.0,608.0,"[46310, 18010, 5859, 1405, 771]",4.49,,3.0,12.0,771.0,1405.0,5859.0,18010.0,46310.0,72355.0,0.0,1.0,0.0,0.0,0.0,1.0,0.0,0.0,0.0,0.0,0.0,0.0,0.0,0.0,0.0,0.0,0.0,0.0,0.0,0.0,1.0,0.0,0.0,0.0,0.0,0.0,0.0,0.0,0.0,0.0,0.0,,
1052,http://www.imdb.com/title/tt0120915/,Star Wars - Episode I: The Phantom Menace,115000000,43456382,22469932,,Star Wars - Episode I: The Phantom Menace (Star Wars: Novelizations #1),"[Sheev Palpatine, Maul, Qui-Gon Jinn, Padmé Amidala, Panaka, Shmi Skywalker, Obi-Wan Kenobi, Anakin Skywalker, Yoda]","[Media Tie In, Star Wars, Science Fiction, Fiction, Fantasy]",452.0,64.0,255.0,"[2788, 3424, 4150, 1576, 375]",3.54,1999-04-12,0.0,9.0,375.0,1576.0,4150.0,3424.0,2788.0,12313.0,1.0,1.0,0.0,0.0,0.0,0.0,0.0,0.0,0.0,0.0,1.0,0.0,0.0,0.0,0.0,0.0,0.0,0.0,0.0,0.0,0.0,0.0,0.0,0.0,0.0,0.0,0.0,0.0,0.0,0.0,0.0,1999-05-19,37 days 00:00:00.000000000
1053,http://www.imdb.com/title/tt1722099/,Cat Among the Pigeons,,,,,Cat Among the Pigeons (Hercule Poirot #32),"[Julia Upjohn, Miss Chadwick, Hercule Poirot, Jennifer Sutcliffe, Princess Shaista, Mrs. Upjohn, Mrs. Sutcliffe, Honoria Bulstrode, Eleanor Vansittart, Grace Springer, Angele Blanche, Eileen Rich, Ann Shapland, Alì Yusuf, Bob Rawlinson, Adam Goodman, Kelsey, Mr. Robinson]","[Mystery, Fiction, Mystery, Crime, Mystery, Detective]",689.0,161.0,352.0,"[4391, 7124, 5811, 890, 97]",3.81,1959-04-12,0.0,18.0,97.0,890.0,5811.0,7124.0,4391.0,18313.0,1.0,0.0,0.0,1.0,0.0,0.0,0.0,0.0,0.0,0.0,0.0,0.0,0.0,0.0,1.0,0.0,0.0,0.0,0.0,0.0,0.0,0.0,0.0,0.0,0.0,0.0,0.0,0.0,0.0,0.0,0.0,,
1054,http://www.imdb.com/title/tt0475043/,"Guns, Germs, and Steel: The Fates of Human Societies",,,,"
Royal Society Science Book Prize for General Prize (1998), Pulitzer Prize for General Nonfiction (1998), California Book Award Gold Medal for Nonfiction (1997), Puddly Award for History (2001)
","Guns, Germs, and Steel: The Fates of Human Societies",[],"[History, Nonfiction, Science, Anthropology, Culture, Society, Science, Popular Science, War, Academic, School, Sociology, Social Science]",7331.0,107.0,425.0,"[62280, 63773, 33211, 9244, 4142]",3.99,1997-04-12,4.0,0.0,4142.0,9244.0,33211.0,63773.0,62280.0,172650.0,0.0,0.0,0.0,0.0,0.0,0.0,0.0,0.0,0.0,0.0,0.0,0.0,0.0,0.0,0.0,0.0,0.0,0.0,0.0,0.0,0.0,1.0,1.0,0.0,0.0,0.0,0.0,0.0,0.0,0.0,1.0,,
1055,http://www.imdb.com/title/tt0118636/,Apt Pupil,14000000,8838938,3583151,,Apt Pupil,[],"[Fiction, Short Stories, Suspense, Mystery]",507.0,20.0,179.0,"[4536, 6537, 4824, 1048, 244]",3.82,1982-04-12,0.0,0.0,244.0,1048.0,4824.0,6537.0,4536.0,17189.0,1.0,0.0,0.0,1.0,0.0,0.0,0.0,0.0,0.0,0.0,0.0,0.0,0.0,0.0,0.0,0.0,0.0,0.0,0.0,0.0,0.0,0.0,0.0,0.0,0.0,0.0,1.0,0.0,0.0,0.0,0.0,1998-10-23,6038 days 00:00:00.000000000
1056,http://www.imdb.com/title/tt0360486/,Constantine,100000000,75976178,29769098,,Constantine,[],"[Horror, Fantasy, Sequential Art, Graphic Novels, Fiction, Fantasy, Supernatural, Fantasy, Paranormal]",38.0,0.0,336.0,"[246, 198, 176, 43, 7]",3.94,,0.0,0.0,7.0,43.0,176.0,198.0,246.0,670.0,1.0,1.0,0.0,0.0,0.0,0.0,0.0,0.0,0.0,0.0,0.0,0.0,0.0,0.0,0.0,0.0,1.0,0.0,0.0,1.0,1.0,0.0,0.0,0.0,0.0,0.0,0.0,0.0,0.0,0.0,0.0,2005-02-18,
1057,http://www.imdb.com/title/tt0360486/,Hellblazer: Rake at the Gates of Hell,100000000,75976178,29769098,,Hellblazer: Rake at the Gates of Hell (Hellblazer Collection #5),[John Constantine],"[Sequential Art, Comics, Sequential Art, Graphic Novels, Horror, Fantasy, Comics, Comic Book]",28.0,4.0,224.0,"[877, 631, 282, 65, 17]",4.22,2000-01-01,0.0,1.0,17.0,65.0,282.0,631.0,877.0,1872.0,0.0,1.0,0.0,0.0,0.0,0.0,0.0,0.0,0.0,0.0,0.0,0.0,0.0,0.0,0.0,0.0,1.0,0.0,0.0,1.0,0.0,0.0,0.0,0.0,0.0,0.0,0.0,0.0,0.0,0.0,0.0,2005-02-18,1875 days 00:00:00.000000000
1058,http://www.imdb.com/title/tt0054345/,Strangers When We Meet,,,,,Strangers When We Meet,[],"[Fiction, Mystery, Novels, Thriller, Mystery Thriller]",1.0,7.0,375.0,"[19, 22, 22, 3, 1]",3.82,,0.0,0.0,1.0,3.0,22.0,22.0,19.0,67.0,1.0,0.0,0.0,1.0,0.0,0.0,0.0,0.0,1.0,0.0,0.0,1.0,0.0,0.0,0.0,0.0,0.0,0.0,0.0,0.0,0.0,0.0,0.0,0.0,0.0,0.0,0.0,0.0,0.0,0.0,0.0,,
1059,http://www.imdb.com/title/tt2173010/,Gods in Alabama,,,,,Gods in Alabama,[],"[Contemporary, Fiction, Adult]",1621.0,32.0,306.0,"[3931, 6497, 3865, 840, 193]",3.86,2005-04-12,0.0,0.0,193.0,840.0,3865.0,6497.0,3931.0,15326.0,1.0,0.0,0.0,0.0,0.0,0.0,0.0,0.0,0.0,0.0,0.0,0.0,1.0,0.0,0.0,0.0,0.0,0.0,0.0,0.0,0.0,0.0,0.0,0.0,0.0,0.0,0.0,0.0,1.0,0.0,0.0,,
1060,http://www.imdb.com/title/tt0056937/,Cleopatra: A Life,31115000,57777778,,"
PEN/Jacqueline Bograd Weld Award for Biography (2011), Goodreads Choice Award Nominee for History and Biography (2010)
",Cleopatra: A Life,[Cleopatra],"[Historical Fiction, Cultural, Egypt, Biography Memoir]",4357.0,19.0,302.0,"[20275, 23375, 19315, 7386, 4985]",3.62,2006-09-05,2.0,1.0,4985.0,7386.0,19315.0,23375.0,20275.0,75336.0,0.0,0.0,0.0,0.0,0.0,0.0,0.0,1.0,0.0,0.0,0.0,0.0,0.0,0.0,0.0,1.0,0.0,0.0,0.0,0.0,0.0,0.0,0.0,0.0,0.0,0.0,0.0,0.0,0.0,0.0,0.0,,
1061,http://www.imdb.com/title/tt1372686/,Coriolanus,,756452,61136,,Coriolanus,[Gaius Marcius Coriolanus],"[Literature, Poetry, Classics, Plays, Historical Fiction, Plays, Theatre, European Literature, British Literature, Academic, School, Literature, 17th Century, Drama]",486.0,437.0,208.0,"[2205, 3016, 2597, 838, 186]",3.7,,0.0,1.0,186.0,838.0,2597.0,3016.0,2205.0,8842.0,0.0,0.0,1.0,0.0,0.0,0.0,1.0,1.0,0.0,0.0,0.0,0.0,0.0,0.0,0.0,0.0,0.0,0.0,0.0,0.0,0.0,0.0,0.0,1.0,0.0,0.0,0.0,0.0,0.0,0.0,0.0,,
1062,http://www.imdb.com/title/tt0446755/,The Painted Veil,19400000,8060487,71814,,The Painted Veil,[],"[Classics, Fiction, Historical Fiction, Cultural, China, Romance]",2475.0,111.0,246.0,"[6897, 10773, 6123, 1332, 252]",3.9,2017-04-25,0.0,0.0,252.0,1332.0,6123.0,10773.0,6897.0,25377.0,1.0,0.0,1.0,0.0,0.0,1.0,0.0,1.0,0.0,0.0,0.0,0.0,0.0,0.0,0.0,1.0,0.0,0.0,0.0,0.0,0.0,0.0,0.0,0.0,0.0,0.0,0.0,0.0,0.0,0.0,0.0,2007-01-19,-3749 days +00:00:00.000000000
1063,http://www.imdb.com/title/tt0054310/,Sink the Bismarck,1330000,,,,Sink the Bismarck,[],"[War, World War II, War, Nonfiction, Historical]",35.0,22.0,118.0,"[151, 229, 135, 18, 3]",3.95,1958-04-12,0.0,0.0,3.0,18.0,135.0,229.0,151.0,536.0,0.0,0.0,0.0,0.0,0.0,0.0,0.0,0.0,0.0,0.0,0.0,0.0,0.0,0.0,0.0,0.0,0.0,1.0,0.0,0.0,0.0,1.0,1.0,0.0,0.0,0.0,0.0,0.0,0.0,0.0,0.0,1960-02-11,670 days 00:00:00.000000000
1064,http://www.imdb.com/title/tt0099762/,Henry V,,11567449,1032942,,Henry V (Wars of the Roses #4),"[Charles VI of France, Catherine de Valois, Hemphrey, duke of Gloucester, Henry V of England, Edward of Langley, 2nd Duke of York, Richard of Conisburgh, 3rd Earl of Cambridge]","[Classics, Plays, Drama, Fiction, Historical Fiction, Plays, Theatre, Literature, Historical, Poetry, Academic, School]",864.0,563.0,352.0,"[9687, 10333, 7767, 2308, 545]",3.86,,0.0,9.0,545.0,2308.0,7767.0,10333.0,9687.0,30640.0,1.0,0.0,1.0,0.0,0.0,0.0,1.0,1.0,0.0,0.0,0.0,0.0,0.0,0.0,0.0,0.0,0.0,1.0,0.0,0.0,0.0,0.0,0.0,0.0,0.0,0.0,0.0,0.0,0.0,0.0,0.0,1990-10-05,
1065,http://www.imdb.com/title/tt0417126/,The Shoemaker's Wife,,,,,The Shoemaker's Wife,[],"[Historical Fiction, Fiction, Romance, Historical, Cultural, Italy]",6969.0,34.0,496.0,"[18019, 23307, 12181, 2789, 728]",3.97,2012-04-12,0.0,0.0,728.0,2789.0,12181.0,23307.0,18019.0,57024.0,1.0,0.0,0.0,0.0,0.0,1.0,0.0,1.0,0.0,0.0,0.0,0.0,0.0,0.0,0.0,1.0,0.0,1.0,0.0,0.0,0.0,0.0,0.0,0.0,0.0,0.0,0.0,0.0,0.0,0.0,0.0,,
1066,http://www.imdb.com/title/tt1553656/,Under the Dome,,,,"
Locus Award Nominee for Best Science Fiction Novel (2010), British Fantasy Award Nominee for Best Novel (2010), Goodreads Choice Award Nominee for Mystery/Thriller (2009)
",Under the Dome,"[Dale Barbara, Julia Shumway, James Rennie, Junior Rennie, Eric ""Rusty"" Everett, Joseph ""Scarecrow Joe"" McClatchey, Brenda Perkins, Frank DeLesseps, Carter Thibodeau, Melvin Searles, Georgia Roux, Andy Sanders, Phil ""The Chef"" Bushey, Peter Randolph, United States Military, American Law Enforcement, Dale ""Barbie"" Barbara, James ""Big Jim"" Rennie, Bill Allnut, Sarah Allnut, Mabel Alston, Private Clint Ames, Tommy Anderson, Willow Anderson, Elsa Andrews, Aidan Patrick Appleton, Alice Rachel Appleton, Marty Arsenault, Donnie Baribeau, Chaz Bender, Kayla Bevins, Harriet Bigelow, Fernald ""Fern"" Bowie, Stewart Bowie, Joe Boxer, Clayton Brassey, Freeman Brown, Gina Buffalino, Michela Burpee, Romeo ""Rommie"" Burpee, Little Walter Bushey, Phil Bushey, Sammy Bushey, Billy Cale, Jack Cale, Ernie Calvert, Joanie Calvert, Lucien Calvert, Norrie Calvert, Ed Carty, Carrie Carver, Deanna Carver, Johnny Carver, Eddie Chalmers, Pamela Chen, Henrietta Clavard, John Clavard, Reverend Lester Coggins, Cindy Collins, Hanna Compton, Mrs. Connaught, Lauren Conree, Rance Conroy, Arletta Coombs, Anderson Cooper, Mary Lou Costas, Colonel James O. Cox, Wanda Crumley, Wendell Crumley, Wanda Debec, Frederick ""Fred""  Howard Denton, Alden Dinsmore, Oliver ""Ollie"" Dinsmore, Rory Dinsmore, Shelley Dinsmore, Russ Dorr, Alva Drake, Benny Drake, Norman Drake, Coralee Dumagen, Marta Edmunds, Brendan Ellerbee, Myra Evans, Erik ""Rusty"" Everett, Janelle Everett, Judy Everett, Linda Everett, Rusty Evers, George Frederick, Lois Freeman, Will Freeman, Jack Evans, Randall Killian, Ricky Killian, Roger Killian, Leo Lamoine, George Lathrop, Reverend Piper Libby, Rupert ""Rupe"" Libby, Corrie Macintosh, ...]","[Horror, Fiction, Science Fiction, Thriller]",12666.0,105.0,1074.0,"[59047, 69106, 41724, 12088, 4556]",3.89,,3.0,101.0,4556.0,12088.0,41724.0,69106.0,59047.0,186521.0,1.0,0.0,0.0,0.0,0.0,0.0,0.0,0.0,1.0,0.0,1.0,0.0,0.0,0.0,0.0,0.0,0.0,0.0,0.0,1.0,0.0,0.0,0.0,0.0,0.0,0.0,0.0,0.0,0.0,0.0,0.0,,
1067,http://www.imdb.com/title/tt0095238/,The Good Mother,14000000,4764606,,,The Good Mother,[Anna Dunlap],"[Fiction, Contemporary, Novels, Womens Fiction, Chick Lit]",232.0,14.0,320.0,"[2209, 3770, 2600, 520, 156]",3.79,1986-05-12,0.0,1.0,156.0,520.0,2600.0,3770.0,2209.0,9255.0,1.0,0.0,0.0,0.0,0.0,0.0,0.0,0.0,0.0,0.0,0.0,1.0,1.0,0.0,0.0,0.0,0.0,0.0,0.0,0.0,0.0,0.0,0.0,0.0,0.0,1.0,0.0,1.0,0.0,0.0,0.0,1988-11-04,907 days 00:00:00.000000000
1068,http://www.imdb.com/title/tt0075647/,Pretty Good for a Girl: The Autobiography of a Snowboarding Pioneer,,,,,Pretty Good for a Girl: The Autobiography of a Snowboarding Pioneer,[],"[Autobiography, Memoir]",11.0,3.0,240.0,"[20, 21, 23, 3, 1]",3.82,,0.0,0.0,1.0,3.0,23.0,21.0,20.0,68.0,0.0,0.0,0.0,0.0,0.0,0.0,0.0,0.0,0.0,0.0,0.0,0.0,0.0,0.0,0.0,0.0,0.0,0.0,0.0,0.0,0.0,0.0,0.0,0.0,0.0,0.0,0.0,0.0,0.0,1.0,0.0,,
1069,http://www.imdb.com/title/tt0101453/,Billy Bathgate,48000000,15965919,4051590,"
PEN/Faulkner Award for Fiction (1990), William Dean Howells Medal (1990), National Book Critics Circle Award (1989), National Book Award Finalist for Fiction (1989)
",Billy Bathgate,[],"[Fiction, Historical Fiction, Mystery, Crime]",274.0,47.0,326.0,"[1010, 2150, 1494, 280, 37]",3.77,1989-04-12,4.0,0.0,37.0,280.0,1494.0,2150.0,1010.0,4971.0,1.0,0.0,0.0,1.0,0.0,0.0,0.0,1.0,0.0,0.0,0.0,0.0,0.0,0.0,1.0,0.0,0.0,0.0,0.0,0.0,0.0,0.0,0.0,0.0,0.0,0.0,0.0,0.0,0.0,0.0,0.0,1991-11-01,933 days 00:00:00.000000000
1070,http://www.imdb.com/title/tt0121765/,Star Wars - Episode II: Attack of the Clones,115000000,310675583,80027814,,Star Wars - Episode II: Attack of the Clones (Star Wars: Novelizations #2),"[Padmé Amidala, Anakin Skywalker]","[Science Fiction, Media Tie In, Star Wars, Fiction, Science Fiction Fantasy]",233.0,44.0,344.0,"[1812, 2125, 2226, 686, 187]",3.67,2002-05-01,0.0,2.0,187.0,686.0,2226.0,2125.0,1812.0,7036.0,1.0,0.0,0.0,0.0,0.0,0.0,0.0,0.0,0.0,0.0,1.0,0.0,0.0,0.0,0.0,0.0,0.0,0.0,0.0,0.0,0.0,0.0,0.0,0.0,0.0,0.0,0.0,0.0,0.0,0.0,0.0,2002-05-16,15 days 00:00:00.000000000
1071,http://www.imdb.com/title/tt1397129/,Poems,,,,,Poems,[],"[Poetry, Classics, Cultural, African American]",116.0,7.0,224.0,"[1567, 1008, 404, 52, 24]",4.32,1986-02-01,0.0,0.0,24.0,52.0,404.0,1008.0,1567.0,3055.0,0.0,0.0,1.0,0.0,0.0,0.0,0.0,0.0,0.0,0.0,0.0,0.0,0.0,0.0,0.0,1.0,0.0,0.0,0.0,0.0,0.0,0.0,0.0,0.0,0.0,0.0,0.0,0.0,0.0,0.0,0.0,,
1072,http://www.imdb.com/title/tt1766847/,The Thirteen Problems,,,,,The Thirteen Problems (Miss Marple #2),[Jane Marple],"[Mystery, Mystery, Crime, Fiction, Short Stories, Classics]",723.0,136.0,315.0,"[3450, 5069, 3696, 681, 65]",3.86,2032-06-12,0.0,1.0,65.0,681.0,3696.0,5069.0,3450.0,12961.0,1.0,0.0,1.0,1.0,0.0,0.0,0.0,0.0,0.0,0.0,0.0,0.0,0.0,0.0,1.0,0.0,0.0,0.0,0.0,0.0,0.0,0.0,0.0,0.0,0.0,0.0,0.0,0.0,0.0,0.0,0.0,,
1073,http://www.imdb.com/title/tt0068156/,1776,4000000,6104000,,,1776,"[George Washington, Thomas Jefferson, John Adams, Benjamin Franklin, George III of the United Kingdom]","[History, Nonfiction, North American Hi..., American History, Historical, War]",5650.0,37.0,386.0,"[45168, 46254, 20715, 4737, 2591]",4.06,2005-04-12,0.0,5.0,2591.0,4737.0,20715.0,46254.0,45168.0,119465.0,0.0,0.0,0.0,0.0,0.0,0.0,0.0,0.0,0.0,0.0,0.0,0.0,0.0,0.0,0.0,0.0,0.0,1.0,0.0,0.0,0.0,1.0,1.0,0.0,0.0,0.0,0.0,0.0,0.0,0.0,1.0,1972-11-17,-11834 days +00:00:00.000000000
1074,http://www.imdb.com/title/tt0025878/,The Thin Man,226408,,,,The Thin Man,"[Nick Charles, Nora Charles]","[Mystery, Fiction, Classics, Mystery, Crime, Mystery, Noir, Mystery, Detective, Thriller, Mystery Thriller, Novels, Mystery, Hard Boiled, Literature, American]",1411.0,80.0,201.0,"[6510, 8420, 4515, 884, 239]",3.98,1934-04-12,0.0,2.0,239.0,884.0,4515.0,8420.0,6510.0,20568.0,1.0,0.0,1.0,1.0,0.0,0.0,1.0,0.0,1.0,0.0,0.0,1.0,0.0,0.0,1.0,0.0,0.0,0.0,0.0,0.0,0.0,0.0,0.0,0.0,0.0,0.0,0.0,0.0,0.0,0.0,0.0,1934-05-25,43 days 00:00:00.000000000
1075,http://www.imdb.com/title/tt0076759/,Star Wars - Episode IV: A New Hope,11000000,460935665,35906661,,,,,,,,,,,,,,,,,,,,,,,,,,,,,,,,,,,,,,,,,,,,,,,,,,1977-05-25,
1076,http://www.imdb.com/title/tt0026174/,Captain Blood,1200000,,,,Captain Blood (Captain Blood #1),[Dr. Peter Blood],"[Classics, Adventure, Historical Fiction, Fiction, Adventure, Pirates, Historical, Romance, Adventure, Swashbuckling, Literature, Action]",582.0,0.0,236.0,"[4440, 3679, 1895, 319, 99]",4.15,1922-04-12,0.0,1.0,99.0,319.0,1895.0,3679.0,4440.0,10432.0,1.0,0.0,1.0,0.0,0.0,1.0,1.0,1.0,0.0,0.0,0.0,0.0,0.0,1.0,0.0,0.0,0.0,1.0,0.0,0.0,0.0,0.0,0.0,0.0,0.0,0.0,0.0,0.0,0.0,0.0,0.0,1935-12-28,5008 days 00:00:00.000000000
1077,http://www.imdb.com/title/tt0074006/,"I, Claudius",,,,"
James Tait Black Memorial Prize for Fiction (1934), Hawthornden Prize (1935), Audie Award for Audio Drama (2012)
","I, Claudius (Claudius #1)","[Nero Claudius Caesar Augustus Germanicus, Caligula, Livia Drusa, Tiberius Claudius Drusus Nero Germanicus, Agrippina the Elder, Tiberius Claudius Caesar, Augustus, Valeria Messalina]","[Historical Fiction, Fiction, Classics, Historical, Literature, Cultural, Italy, Novels, European Literature, British Literature, Literature, 20th Century, Politics]",1703.0,144.0,468.0,"[18881, 13839, 5036, 1022, 393]",4.27,1934-04-12,3.0,8.0,393.0,1022.0,5036.0,13839.0,18881.0,39171.0,1.0,0.0,1.0,0.0,0.0,0.0,1.0,1.0,0.0,0.0,0.0,1.0,0.0,0.0,0.0,1.0,0.0,1.0,0.0,0.0,0.0,0.0,0.0,1.0,0.0,0.0,0.0,0.0,0.0,0.0,0.0,,
1078,http://www.imdb.com/title/tt1507563/,Onslaught,25000000,,,,"Onslaught (Dark Tide, #1) (Star Wars: The New Jedi Order #2)",[],"[Media Tie In, Star Wars, Science Fiction, Fiction]",93.0,21.0,304.0,"[1766, 2591, 2365, 493, 190]",3.71,1999-04-12,0.0,0.0,190.0,493.0,2365.0,2591.0,1766.0,7405.0,1.0,0.0,0.0,0.0,0.0,0.0,0.0,0.0,0.0,0.0,1.0,0.0,0.0,0.0,0.0,0.0,0.0,0.0,0.0,0.0,0.0,0.0,0.0,0.0,0.0,0.0,0.0,0.0,0.0,0.0,0.0,,
1079,http://www.imdb.com/title/tt1606229/,Goodnight Nobody,,,,,Goodnight Nobody,[],"[Womens Fiction, Chick Lit, Fiction, Mystery]",1817.0,45.0,400.0,"[10728, 18357, 17401, 4333, 1067]",3.64,2005-01-01,0.0,0.0,1067.0,4333.0,17401.0,18357.0,10728.0,51886.0,1.0,0.0,0.0,1.0,0.0,0.0,0.0,0.0,0.0,0.0,0.0,0.0,0.0,0.0,0.0,0.0,0.0,0.0,0.0,0.0,0.0,0.0,0.0,0.0,0.0,1.0,0.0,1.0,0.0,0.0,0.0,,
1080,http://www.imdb.com/title/tt5932728/,"The Professor and the Madman: A Tale of Murder, Insanity and the Making of the Oxford English Dictionary",,,,"
Audie Award for Nonfiction, Abridged (1999), National Book Critics Circle Award Nominee for General Nonfiction (1998)
","The Professor and the Madman: A Tale of Murder, Insanity and the Making of the Oxford English Dictionary","[Dr. William Chester Minor, Sir James Murray]","[History, Nonfiction, Biography, Humanities, Language, Writing, Books About Books, Crime, True Crime, Biography Memoir, European Literature, British Literature, Adult, Mystery, Crime]",4197.0,68.0,252.0,"[19756, 27447, 17474, 4110, 1856]",3.84,1998-04-12,3.0,2.0,1856.0,4110.0,17474.0,27447.0,19756.0,70643.0,0.0,0.0,0.0,1.0,0.0,0.0,0.0,0.0,0.0,0.0,0.0,0.0,0.0,0.0,1.0,0.0,0.0,0.0,0.0,0.0,0.0,1.0,0.0,1.0,1.0,0.0,0.0,0.0,1.0,0.0,1.0,,
1081,http://www.imdb.com/title/tt0053622/,BUtterfield 8,2500000,16462599,,,BUtterfield 8,[],"[Fiction, Classics, Novels, Literary Fiction, Literature, Mystery, Literature, American, Classics, Modern Classics, Literature, 20th Century, New York]",164.0,28.0,256.0,"[214, 711, 526, 113, 33]",3.6,1935-04-12,0.0,0.0,33.0,113.0,526.0,711.0,214.0,1597.0,1.0,0.0,1.0,1.0,0.0,0.0,1.0,0.0,0.0,0.0,0.0,1.0,0.0,0.0,0.0,0.0,0.0,0.0,0.0,0.0,0.0,0.0,0.0,0.0,0.0,0.0,0.0,0.0,0.0,0.0,0.0,1960-11-04,9338 days 00:00:00.000000000
1082,http://www.imdb.com/title/tt1540011/,The Woods,5000000,20747013,,,The Woods,"[Paul Copeland, Cingle Shaker, Loren Muse]","[Mystery, Fiction, Thriller, Mystery, Crime, Suspense, Thriller, Mystery Thriller, Adult, Mystery, Murder Mystery, Contemporary, Adult Fiction]",2914.0,100.0,404.0,"[15054, 21000, 10043, 1374, 263]",4.03,2007-01-01,0.0,3.0,263.0,1374.0,10043.0,21000.0,15054.0,47734.0,1.0,0.0,0.0,1.0,0.0,0.0,0.0,0.0,1.0,0.0,0.0,0.0,1.0,0.0,1.0,0.0,0.0,0.0,0.0,0.0,0.0,0.0,0.0,0.0,0.0,0.0,1.0,0.0,1.0,0.0,0.0,2016-09-16,3546 days 00:00:00.000000000
1083,http://www.imdb.com/title/tt2104965/,"If You're Reading This, It's Too Late",,,,,"If You're Reading This, It's Too Late (Secret #2)",[],"[Mystery, Adventure, Fantasy, Fiction]",845.0,32.0,385.0,"[8957, 6103, 2946, 575, 218]",4.22,2008-04-12,0.0,0.0,218.0,575.0,2946.0,6103.0,8957.0,18799.0,1.0,1.0,0.0,1.0,0.0,0.0,0.0,0.0,0.0,0.0,0.0,0.0,0.0,1.0,0.0,0.0,0.0,0.0,0.0,0.0,0.0,0.0,0.0,0.0,0.0,0.0,0.0,0.0,0.0,0.0,0.0,,
1084,http://www.imdb.com/title/tt1166953/,Team of Rivals: The Political Genius of Abraham Lincoln,,,,"
Lincoln Prize (2006), National Book Critics Circle Award Nominee for Biography (2005)
",Team of Rivals: The Political Genius of Abraham Lincoln,"[Abraham Lincoln, William H. Seward, Edwin McMasters Stanton, Salmon P. Chase, Edward Bates]","[History, Nonfiction, Biography, Politics, North American Hi..., American History, Military History, Civil War]",5561.0,9.0,916.0,"[52541, 28079, 9832, 2687, 2837]",4.3,2005-04-12,2.0,5.0,2837.0,2687.0,9832.0,28079.0,52541.0,95976.0,0.0,0.0,0.0,0.0,0.0,0.0,0.0,0.0,0.0,0.0,0.0,0.0,0.0,0.0,0.0,0.0,0.0,0.0,0.0,0.0,0.0,1.0,0.0,0.0,1.0,0.0,0.0,0.0,0.0,0.0,1.0,,
1085,http://www.imdb.com/title/tt0330702/,Don't Move,,,,"
International IMPAC Dublin Literary Award Nominee (2006), Premio Strega (2002), Premio Grinzane Cavour (2002), Prix Littéraire Européen - Madeleine Zepter (2004)
",Don't Move,[],"[Fiction, European Literature, Italian Literature, Cultural, Italy, Romance, Contemporary, Literary Fiction, Modern, Novels, Literature, 21st Century, Literature]",203.0,42.0,368.0,"[962, 1109, 759, 300, 163]",3.73,2001-04-12,4.0,0.0,163.0,300.0,759.0,1109.0,962.0,3293.0,1.0,0.0,0.0,0.0,0.0,1.0,1.0,0.0,0.0,0.0,0.0,1.0,1.0,0.0,0.0,1.0,0.0,0.0,0.0,0.0,0.0,0.0,0.0,1.0,0.0,0.0,0.0,0.0,0.0,0.0,0.0,,
