,Link,New Book Name,Budget,Gross,Opening,Awards List,Book Name,Characters,Genres,Num_reviews,Other editions,Pages,Star votes,Stars,publish_date,Award Count,Release Date
670,http://www.imdb.com/title/tt0122050/,"Dragon Ball, Vol. 1: The Monkey King",,,,,"Dragon Ball, Vol. 1: The Monkey King (Dragon Ball #1)",[],"[Sequential Art, Manga, Sequential Art, Comics, Fantasy, Sequential Art, Graphic Novels, Adventure]",271,33,192 pages,"[16920, 5651, 2972, 755, 422]",4.42,September 10th 1985,0.0,
671,http://www.imdb.com/title/tt0112688/,Clockers,25000000,13040603,,,Clockers,[],"[Fiction, Mystery, Crime, Mystery, Thriller]",453,29,608 pages,"[2315, 3033, 1207, 204, 89]",4.06,January 1st 1992,0.0,13 September 1995
672,http://www.imdb.com/title/tt0094869/,The Chocolate War,,303624,,"
Lewis Carroll Shelf Award (1979)
",The Chocolate War (Chocolate War #1),[Jerry Renault],"[Young Adult, Fiction, Classics, Realistic Fiction, Literature, Banned Books, Young Adult, Teen]","2,418",59,267 pages,"[6160, 10208, 10013, 3808, 1776]",3.47,1974,1.0,18 November 1988
673,http://www.imdb.com/title/tt0217629/,Looking for Alibrandi,,,,"
New South Wales Premier's Literary Award for Script Writing Award (2000), Children's Book Council of Australia Award for Book of the Year: Older Readers (1993), Kids Own Australian Literature Awards (KOALA) for Secondary (1993), Books I Loved Best Yearly (BILBY) Awards for Older Readers (2000), West Australian Young Readers' Book Award (WAYRBA) for Older Readers (1994)
...more
South Carolina Book Award Nominee for Young Adult Book Award (2002), W.A. Young Readers Book Award (WAYRA) (1994), Fairlight Talking Book of the Year NSW for Best Book (2000), Australian Multicultural Children's BOTY Award (1993)
...less ",Looking for Alibrandi,"[Josephine Alibrandi, Jacob Coote, John Barton, Christina Alibrandi, Katia Alibrandi, Michael Andretti]","[Young Adult, Contemporary, Fiction, Romance]","1,169",39,313 pages,"[4374, 6468, 4113, 928, 270]",3.85,October 5th 1992,8.0,
674,http://www.imdb.com/title/tt0070328/,Live and Let Die,7000000,35377836,,,Live and Let Die (James Bond (Original Series) #2),"[James Bond, M, Felix Leiter, Solitaire]","[Fiction, Spy Thriller, Espionage, Thriller, Mystery, Adventure, Classics, Mystery, Crime, Action, Thriller, Mystery Thriller, European Literature, British Literature]","1,072",125,229 pages,"[2704, 6270, 5833, 1223, 201]",3.62,April 5th 1954,0.0,27 June 1973
675,http://www.imdb.com/title/tt3622592/,Paper Towns,12000000,31990064,12650140,"
Anthony Award Nominee for Best Children's/Young Adult Novel (2009), CORINE Internationaler Buchpreis for Young Adult (2010), Edgar Award for Best Young Adult (2009), Deutscher Jugendliteraturpreis Nominee for Preis der Jugendjury (2011), The Inky Awards Nominee for Silver Inky (2009)
...more
Abraham Lincoln Award Nominee (2011), Bronzener Lufti (2010), Literaturpreis der Jury der jungen Leser for Jugendbuch (2010), The Inky Awards Shortlist for Silver Inky (2009), Missouri Gateway Readers Award Nominee (2011)
...less ",Paper Towns,"[Margo Roth Spiegelman, Quentin  Jacobsen, Marcus ""Radar"" Lincoln, Lacey Pemberton, Ben Starling, Jason Worthington]","[Young Adult, Adventure, Contemporary]","40,964",163,305 pages,"[207026, 210534, 141799, 42158, 12512]",3.91,October 16th 2008,9.0,24 July 2015
676,http://www.imdb.com/title/tt0062376/,"To Sir, With Love",640000,42432803,,,"To Sir, With Love",[],"[Fiction, Classics, Education]",391,45,189 pages,"[3626, 3643, 1706, 246, 50]",4.14,1959,0.0,14 June 1967
677,http://www.imdb.com/title/tt0448075/,The Night Listener,4000000,7825820,3554134,,The Night Listener,[],"[Fiction, Mystery, Glbt, Glbt, Gay, Contemporary, Novels, Glbt, Queer, Literature, Romance, M M Romance, Adult Fiction]",314,33,344 pages,"[788, 1643, 1388, 411, 87]",3.61,2000,0.0,4 August 2006
678,http://www.imdb.com/title/tt2304933/,The 5th Wave,38000000,34912982,10326356,"
Georgia Peach Book Award Nominee for Honor book (2014), Keystone to Reading Book Award Nominee for High School (2015), Milwaukee County Teen Book Award Nominee (2014), The Inky Awards Nominee for Silver Inky (2013), Abraham Lincoln Award Nominee (2015)
...more
Goodreads Choice Award Nominee for Best Young Adult Fantasy & Science Fiction (2013), Carnegie Medal Nominee (2014), Green Mountain Book Award Nominee (2015), Louisiana Teen Readers Choice Award Winner (2016), Missouri Gateway Readers Award Nominee (2016), Oklahoma Sequoyah Award for High School (2016), Premio El Templo de las Mil Puertas Nominee for Mejor novela extranjera perteneciente a saga (2013)
...less ",The 5th Wave (The 5th Wave #1),"[Evan Walker, Cassie Sullivan, Sammy Sullivan, Ben Parish, Colonel Alexander]","[Young Adult, Science Fiction, Science Fiction, Dystopia]","25,243",97,457 pages,"[106822, 84892, 39192, 10569, 5018]",4.13,,11.0,22 January 2016
679,http://www.imdb.com/title/tt0030637/,Pygmalion,350000,,,,Pygmalion,"[Henry Higgins, Eliza Doolittle, Colonel Pickering]","[Classics, Plays, Fiction, Drama, Academic, School, Literature, Romance, European Literature, British Literature, Plays, Theatre, Humor]","1,532",358,134 pages,"[21179, 27796, 18481, 3875, 850]",3.89,October 16th 1913,0.0,3 March 1939
680,http://www.imdb.com/title/tt0030637/,Pygmalion & My Fair Lady,350000,,,,Pygmalion & My Fair Lady,"[Eliza Doolittle, Professor Henry Higgins, Colonel Pickering]","[Plays, Classics, Fiction, Drama, Plays, Theatre, Romance, Historical Fiction, Literature, Music, Music, Musicals]",57,12,240 pages,"[6019, 3886, 2003, 355, 123]",4.24,January 1st 1956,0.0,3 March 1939
681,http://www.imdb.com/title/tt2674426/,Me Before You,20000000,56154094,18723269,"
Goodreads Choice Award Nominee for Fiction (2013)
",Me Before You (Me Before You #1),"[Lou Clark, Will Traynor]","[Romance, Fiction, Contemporary, Womens Fiction, Chick Lit, Adult]","66,533",157,369 pages,"[307845, 208461, 73980, 17404, 8149]",4.28,January 5th 2012,1.0,3 June 2016
682,http://www.imdb.com/title/tt1614950/,Avalon High,,,,"
South Carolina Book Award Nominee for Young Adult Book Award (2009), Abraham Lincoln Award Nominee (2010)
",Avalon High,"[Elaine Harrison, A. William Wagner, Jennifer Gold, Mr. Morton, Lance Reynolds]","[Young Adult, Fantasy, Romance, Womens Fiction, Chick Lit]","2,014",41,304 pages,"[11483, 12484, 10548, 3090, 745]",3.8,January 1st 2005,2.0,
683,http://www.imdb.com/title/tt0062512/,You Only Live Twice,9500000,43084787,,,You Only Live Twice (James Bond (Original Series) #12),"[James Bond, Ernst Stavro Blofeld, M, Irma Bunt, Kissy Suzuki, Dikko Henderson, Tygr Tanaka]","[Fiction, Thriller, Spy Thriller, Espionage, Mystery, Adventure]",395,87,214 pages,"[1959, 3331, 2812, 548, 88]",3.75,January 1st 1964,0.0,13 June 1967
684,http://www.imdb.com/title/tt0493464/,Wanted,75000000,332816,217432,,Wanted (Wanted Complete),[],"[Sequential Art, Comics, Sequential Art, Graphic Novels, Fiction, Comics, Comic Book, Graphic Novels Comics, Mystery, Crime, Comics, Superheroes, Fantasy, Science Fiction, Action]",481,18,192 pages,"[3569, 3403, 2693, 1072, 662]",3.71,January 1st 2005,0.0,27 June 2008
685,http://www.imdb.com/title/tt1594841/,The Hellbound Heart,,,,"
World Fantasy Award Nominee for Best Novella (1987)
",The Hellbound Heart,"[Frank Cotton, Rory Cotton, Julia Cotton, Kirsty Cotton, Cenobites, Pinhead]","[Horror, Fiction, Fantasy, Supernatural, Fantasy, Paranormal, Short Stories, Novella, Fantasy, Dark Fantasy, Novels, Paranormal, Demons, Classics]","1,026",46,164 pages,"[9194, 9894, 5734, 1053, 323]",4.01,November 1986,1.0,
686,http://www.imdb.com/title/tt0086711/,The Far Pavilions,,,,,The Far Pavilions,[],"[Historical Fiction, Fiction, Cultural, India, Romance, Historical, Classics, Adventure]",985,56,958 pages,"[14857, 11224, 5438, 1026, 283]",4.2,1978,0.0,
687,http://www.imdb.com/title/tt1856010/,House,60000000,,,,House (Books of History Chronicles),"[Stephanie Singleton (House), Leslie (House), Betty (House), Randy (House)]","[Christian Fiction, Fiction, Christian, Thriller, Mystery]","1,410",51,368 pages,"[5330, 5280, 4876, 2323, 1138]",3.6,January 1st 2006,0.0,
688,http://www.imdb.com/title/tt0076752/,The Spy Who Loved Me,14000000,1539734,1347927,,The Spy Who Loved Me (James Bond (Original Series) #10),[],"[Fiction, Thriller, Spy Thriller, Espionage, Adventure]",466,81,198 pages,"[1232, 2198, 2519, 1054, 364]",3.39,January 1st 1962,0.0,3 August 1977
689,http://www.imdb.com/title/tt0102015/,Heart of Darkness,,1318449,,,Heart of Darkness,"[Charles Marlow, Kurtz]","[Classics, Fiction, Literature, Cultural, Africa, Academic, School, Historical Fiction, Novels, Academic, Read For School, Adventure, Young Adult, High School]","8,988",1136,200 pages,"[60824, 81012, 77732, 39648, 23814]",3.41,1899,0.0,
690,http://www.imdb.com/title/tt1596365/,The Woman in Black,17000000,54322273,20874072,,The Woman in Black (Ghost Stories),[Arthur Kipps],"[Horror, Fiction, Gothic, Classics, Mystery, Historical Fiction, Paranormal, Ghosts, Fantasy, Paranormal, Horror, Ghost Stories, Historical]","3,870",82,138 pages,"[6875, 10948, 9190, 2845, 679]",3.67,1983,0.0,3 February 2012
691,http://www.imdb.com/title/tt0951631/,Storm Front,,,,,Storm Front (The Dresden Files #1),"[Harry Dresden, Bob Andrews, Donald Morgan, Ron Carmichael, Susan Rodriguez, Bob (Dresden Files), John Marcone, Karrin Murphy]","[Fantasy, Fantasy, Urban Fantasy, Mystery, Fiction, Fantasy, Paranormal, Fantasy, Magic]","11,123",67,320 pages,"[73646, 74329, 42391, 9016, 3007]",4.02,April 1st 2000,0.0,
692,http://www.imdb.com/title/tt0325805/,Matchstick Men: A Novel About Grifters with Issues,62000000,36873198,13087307,,Matchstick Men: A Novel About Grifters with Issues,[],"[Fiction, Adult Fiction, Thriller, Mystery]",72,9,228 pages,"[122, 273, 261, 51, 8]",3.63,2002,0.0,12 September 2003
693,http://www.imdb.com/title/tt0045793/,From Here to Eternity,1650000,30500000,,"
National Book Award for Fiction (1952)
",From Here to Eternity (The World War II Trilogy #1),[Robert E. Lee Prewitt],"[Fiction, Classics, Historical Fiction, War, Literature]",327,53,816 pages,"[5086, 5026, 2551, 487, 151]",4.08,1951,1.0,
694,http://www.imdb.com/title/tt0087469/,Indiana Jones and the Temple of Doom,28000000,179870271,33936113,,Indiana Jones and the Temple of Doom (Indiana Jones: Film Novelizations #2),[Indiana Jones],"[Adventure, Fiction, Fantasy, Action, Media Tie In, Movies]",37,14,224 pages,"[774, 509, 397, 75, 28]",4.08,1984,0.0,23 May 1984
695,http://www.imdb.com/title/tt0268126/,The Orchid Thief: A True Story of Beauty and Obsession,19000000,22245861,384478,,The Orchid Thief: A True Story of Beauty and Obsession,[],"[Nonfiction, Biography, History, Science]",983,22,284 pages,"[2071, 3704, 2753, 763, 270]",3.68,1998,0.0,14 February 2003
696,http://www.imdb.com/title/tt0412536/,Brideshead Revisited,20000000,6414563,339616,,Brideshead Revisited,"[Charles Ryder, Lord Sebastian Flyte, Lady Julia Flyte, Rex Mottram, Anthony Blanche]","[Classics, Fiction, Historical Fiction, Literature, European Literature, British Literature]","3,168",154,351 pages,"[25988, 25410, 14461, 3886, 1452]",3.99,1945,0.0,15 August 2008
697,http://www.imdb.com/title/tt0412536/,Brideshead Revisited,20000000,6414563,339616,,Brideshead Revisited,"[Charles Ryder, Lord Sebastian Flyte, Lady Julia Flyte, Rex Mottram, Anthony Blanche]","[Classics, Fiction, Historical Fiction, Literature, European Literature, British Literature]","3,168",154,452 pages,"[25990, 25413, 14463, 3887, 1453]",3.99,1945,0.0,15 August 2008
698,http://www.imdb.com/title/tt0375063/,Sideways,12000000,71502303,207042,,Sideways (The Sideways Trilogy #1),"[Maya, Jack Cole, Stephanie Logan, Miles Raymond]","[Fiction, Humor, Contemporary]",484,19,368 pages,"[873, 1567, 1137, 362, 115]",3.67,June 2004,0.0,21 January 2005
699,http://www.imdb.com/title/tt0063260/,The Magus,,,,,The Magus,"[Nicholas Urfe, Alison Kelly, Maurice Conchis]","[Fiction, Classics, Fantasy, Mystery, Literature]","1,897",89,656 pages,"[14590, 11204, 5980, 2074, 978]",4.04,1965,0.0,10 December 1968
700,http://www.imdb.com/title/tt0063507/,The Rise and Fall of the Third Reich: A History of Nazi Germany,,,,"
National Book Award for Nonfiction (1961), Cornelius Ryan Award (1960)
",The Rise and Fall of the Third Reich: A History of Nazi Germany,[],"[History, Nonfiction, War, World War II, War, Cultural, Germany, Politics, Historical, World War II, Holocaust, Military, Military History, War, Military]","1,724",94,1614 pages,"[26045, 20820, 10399, 2110, 1049]",4.14,1960,2.0,
701,http://www.imdb.com/title/tt0472186/,The Strange Case of Dr. Jekyll and Mr. Hyde,750000,19111,19111,"
Independent Publisher Book Award (IPPY) for Audio Fiction - Abridged (1999)
",The Strange Case of Dr. Jekyll and Mr. Hyde,"[Mr Gabriel John Utterson, Dr Hastie Lanyon, Dr Henry Jekyll, Mr Edward Hyde]","[Classics, Fiction, Horror, Science Fiction, Mystery, Gothic, Fantasy, Literature, Literature, 19th Century, Academic, School]","6,983",1688,144 pages,"[56625, 90430, 69698, 14577, 2592]",3.79,January 5th 1886,1.0,29 September 2006
702,http://www.imdb.com/title/tt1253864/,The Brotherhood of the Rose,75000000,83504017,32206425,,The Brotherhood of the Rose (Mortalis #1),[],"[Fiction, Mystery, Thriller, Spy Thriller, Espionage, Action, Adventure]",176,35,416 pages,"[1985, 1875, 874, 157, 51]",4.13,1983,0.0,11 November 2011
703,http://www.imdb.com/title/tt1453159/,World Without End,40000000,,,,World Without End (The Pillars of the Earth #2),"[Caris, Merthin, Gwenda, Godwyn, Ralph]","[Historical Fiction, Fiction, Historical]","9,094",128,1014 pages,"[60809, 49823, 19452, 4063, 1149]",4.22,October 4th 2007,0.0,
704,http://www.imdb.com/title/tt0265086/,Black Hawk Down,92000000,108638745,274347,"
National Book Award Finalist for Nonfiction (1999)
",Black Hawk Down,[],"[History, Nonfiction, War, Military, War, Military, Military History]","1,161",39,320 pages,"[18945, 15511, 5543, 744, 266]",4.27,1999,1.0,18 January 2002
705,http://www.imdb.com/title/tt3223730/,The Zahir,,,,,The Zahir,[],"[Philosophy, Fiction, Novels, Spirituality, Contemporary]","2,582",150,336 pages,"[12469, 15953, 15541, 6186, 2533]",3.56,2005,0.0,24 April 2014
706,http://www.imdb.com/title/tt0965410/,Day Watch,,,,,Day Watch (Дозоры #2),"[Anton Gorodetsky, Svetlana Nazarova, Boris Ignatievich Gesar, Semyon, Tiger Cub, Igor Teplov, Zabulon, Alisa Donnikova, Witezslav Grubin, Edgar (Day Watch)]","[Fantasy, Fantasy, Urban Fantasy, Fiction, Horror, Paranormal, Vampires, Cultural, Russia, Fantasy, Paranormal, Science Fiction, Fantasy, Supernatural, Science Fiction Fantasy]",577,55,453 pages,"[5470, 6945, 3146, 572, 124]",4.05,2000,0.0,
707,http://www.imdb.com/title/tt1456941/,"Tomorrow, When the War Began",,,,"
Canberra's Own Outstanding List (COOL) Awards for Section 3 Fiction for Older Readers - Joint Winner (1996), Books I Loved Best Yearly (BILBY) Awards for Older Readers  (1998), West Australian Young Readers' Book Award (WAYRBA) for Older Readers (1995)
","Tomorrow, When the War Began (Tomorrow #1)","[Lee, Robyn Mathers, Chris Lang, Ellie Linton, Corrie Mackenzie, Homer Yannos, Fiona Maxwell, Kevin Holmes]","[Young Adult, Fiction, Science Fiction, Dystopia, Adventure, Science Fiction, Adventure, Survival, War, Apocalyptic, Post Apocalyptic, Young Adult, Teen, Romance]","2,452",74,277 pages,"[14752, 14450, 7028, 1822, 677]",4.05,1993,3.0,24 February 2012
708,http://www.imdb.com/title/tt0167872/,David Copperfield,,,,,David Copperfield,"[Richard Babley, Mr. Barkis, Mr. Chillip, David Copperfield, Mr. Creakle, The Rev. Horace Crewler, Uriah Heep, Mr. Joram, Mr. Jorkens, Littimer, Jack Maldon, Mr. Charles Mell, Mr. Wilkins  Micawber, Master Wilkins Micawber, Mr. Mills, Mr. Edward Murdstone, Mr. Omer, Daniel Peggotty, Ham Peggotty, Mr. Quinion, Mr. Francis Spenlow, James Steerforth, Dr. Strong, Mr. Tiffey, Thomas Traddles, Mr. Wickfield, Mrs. Clara Copperfield, Mrs. Creakle, Miss Creakle, Mrs. Crewler, Mrs. Crupp, Rosa Dartle, Little Emily, Martha Endell, Mrs. Gummidge, Mrs. Heep, Mrs. Marckleham, Mrs. Emma Micawber, Miss Emma Micawber, Miss Julia Mills, Miss Mowcher, Miss Jane Murdstone, Minnie Omer, Clara Peggotty, Miss Clarissa Spenlow, Miss Dora Spenlow, Miss Lavina Spenlow, Mrs. Steerforth, Mrs. Annie Strong, Miss Betsey Trotwood, Agnes Wickfield, Miss Lavinia, Little Em'ly, Mr. Spenlow, Miss Dartle, Doady, Anne Strong, Sophy Crewler]","[Classics, Fiction, Literature, Historical Fiction]","4,269",1087,974 pages,"[55064, 53890, 34063, 9047, 3281]",3.96,1849,0.0,
709,http://www.imdb.com/title/tt0111003/,The Puppet Masters,,8638072,,,The Puppet Masters,[],"[Science Fiction, Fiction]",473,76,416 pages,"[6777, 9718, 7034, 1279, 240]",3.86,December 1st 1951,0.0,21 October 1994
710,http://www.imdb.com/title/tt0120520/,The Wings of the Dove,,13718385,1305573,,The Wings of the Dove,[],"[Classics, Fiction, Literature, Literature, American, Historical Fiction, Cultural, Italy, Literature, 20th Century, Romance, Novels, Classics, Classic Literature]",428,190,741 pages,"[3859, 4500, 3137, 955, 454]",3.8,1901,0.0,13 March 1998
711,http://www.imdb.com/title/tt1682183/,Map of Bones,,,,"
Barry Award Nominee for Best Thriller (2006)
",Map of Bones (Sigma Force #2),"[Gray Pierce, Painter Crowe, Monk Kokkalis, Seichan]","[Thriller, Fiction, Adventure, Mystery, Action]","1,235",65,523 pages,"[15560, 15607, 7850, 1722, 654]",4.06,January 1st 2005,1.0,
712,http://www.imdb.com/title/tt1682183/,Sandstorm,,,,,Sandstorm (Sigma Force #1),"[Painter Crowe, Safia al-Maaz, Kara Kensington]","[Thriller, Fiction, Adventure, Mystery, Action]","1,270",59,608 pages,"[9358, 11476, 6901, 1459, 442]",3.94,June 2004,0.0,
713,http://www.imdb.com/title/tt1682183/,The Last Oracle,,,,,The Last Oracle (Sigma Force #5),"[Gray Pierce, Painter Crowe, Joe Kowalski, Elizabeth Polk, Savina Martov, Yuri Raev, John Maplethorpe]","[Fiction, Adventure, Mystery, Thriller, Action]",697,41,434 pages,"[9226, 9496, 4045, 615, 159]",4.15,2008,0.0,
714,http://www.imdb.com/title/tt0345591/,Love's Abiding Joy,,,,,Love's Abiding Joy (Love Comes Softly #4),[],"[Christian Fiction, Christian, Historical Fiction, Romance, Fiction, Historical]",149,21,240 pages,"[3402, 2517, 1437, 227, 30]",4.19,1983,0.0,
715,http://www.imdb.com/title/tt0345591/,Love's Long Journey,,,,"
ECPA Christian Book Award for Fiction (1983)
",Love's Long Journey (Love Comes Softly #3),"[Missie LaHaye, Willie LaHaye]","[Christian Fiction, Christian, Historical Fiction, Romance, Fiction]",195,19,234 pages,"[3756, 2855, 1593, 257, 40]",4.18,January 1st 1982,1.0,
716,http://www.imdb.com/title/tt0345591/,Love Comes Softly,,,,,Love Comes Softly (Love Comes Softly #1),"[Marty Claridge, Clem Claridge, Clark Davis, Missie Davis]","[Christian Fiction, Romance, Christian, Historical Fiction, Fiction, Historical]",968,27,188 pages,"[14117, 8489, 4680, 1071, 359]",4.22,January 1st 1979,0.0,
717,http://www.imdb.com/title/tt0345591/,Love's Enduring Promise,,,,,Love's Enduring Promise (Love Comes Softly #2),[],"[Christian Fiction, Christian, Romance, Historical Fiction, Fiction]",301,21,240 pages,"[4133, 3190, 1795, 322, 56]",4.16,1979,0.0,
718,http://www.imdb.com/title/tt0345591/,Love Takes Wing,,,,,Love Takes Wing (Love Comes Softly #7),[Belinda Davis(Love Comes Softly Series)],"[Christian Fiction, Christian, Historical Fiction, Fiction, Romance, Historical, Romance, Christian Romance, Inspirational, Adult Fiction, Young Adult]",109,17,240 pages,"[2857, 1987, 1155, 192, 28]",4.2,January 1st 1988,0.0,
719,http://www.imdb.com/title/tt0345591/,Love Finds a Home,,,,,Love Finds a Home (Love Comes Softly #8),[],"[Christian Fiction, Christian, Historical Fiction, Fiction, Romance, Historical]",128,15,237 pages,"[2984, 1940, 1093, 171, 31]",4.23,January 1st 1989,0.0,
720,http://www.imdb.com/title/tt0345591/,Love's Unending Legacy,,,,,Love's Unending Legacy (Love Comes Softly #5),[],"[Christian Fiction, Christian, Romance, Historical Fiction, Fiction, Historical]",126,16,239 pages,"[3059, 2187, 1203, 172, 30]",4.21,1984,0.0,
721,http://www.imdb.com/title/tt0345591/,Love's Unfolding Dream,,,,,Love's Unfolding Dream (Love Comes Softly #6),[],"[Christian Fiction, Christian, Historical Fiction, Fiction, Romance, Historical]",119,16,240 pages,"[3021, 2072, 1177, 169, 33]",4.22,January 1st 1987,0.0,
722,http://www.imdb.com/title/tt0970468/,Miss Pettigrew Lives for a Day,,12294036,2490942,,Miss Pettigrew Lives for a Day,"[Guinevere Pettigrew, Delysia LaFosse]","[Fiction, Classics, Historical Fiction, Humor]","1,351",15,234 pages,"[2845, 3707, 1974, 378, 110]",3.98,1938,0.0,7 March 2008
723,http://www.imdb.com/title/tt0172396/,The End of the Affair,23000000,10660147,198535,"
Audie Award for Audio (2013)
",The End of the Affair,"[Maurice Bendrix, Sarah Miles, Henry Miles]","[Fiction, Classics, Romance, Literature]","2,827",86,192 pages,"[9837, 12150, 6654, 1665, 367]",3.96,1951,1.0,21 January 2000
724,http://www.imdb.com/title/tt0036182/,My Friend Flicka,,,,,My Friend Flicka (Flicka #1),"[Tim, Ken McLaughlin (Flicka), Rob McLaughlin (Flicka), Nell McLaughlin (Flicka), Howard McLaughlin (Flicka), Flicka (Flicka), Gus (Flicka)]","[Animals, Horses, Classics, Fiction, Animals, Young Adult, Childrens]",271,59,304 pages,"[11067, 7854, 4953, 874, 253]",4.14,1941,0.0,
725,http://www.imdb.com/title/tt0036182/,My Friend Flicka,,,,,My Friend Flicka (Flicka #1),"[Tim, Ken McLaughlin (Flicka), Rob McLaughlin (Flicka), Nell McLaughlin (Flicka), Howard McLaughlin (Flicka), Flicka (Flicka), Gus (Flicka)]","[Animals, Horses, Classics, Fiction, Animals, Young Adult, Childrens]",271,59,304 pages,"[11066, 7854, 4953, 874, 253]",4.14,1941,0.0,
726,http://www.imdb.com/title/tt2316204/,Alien,,,,,Alien (Alien #1),[Ellen Ripley],"[Science Fiction, Horror, Fiction, Science Fiction, Aliens, Science Fiction Fantasy, Thriller, Media Tie In, Movies, Culture, Film, Novels, Adventure]",226,43,270 pages,"[5284, 4532, 2738, 547, 169]",4.07,1979,0.0,19 May 2017
727,http://www.imdb.com/title/tt0277434/,We Were Soldiers Once... and Young: Ia Drang - The Battle that Changed the War in Vietnam,75000000,78120196,20212543,,We Were Soldiers Once... and Young: Ia Drang - The Battle that Changed the War in Vietnam (We Soldiers #1),[],"[Nonfiction, War, Military, Military History, History, Biography, War, Military, North American Hi..., American History, Historical, Autobiography, Memoir, Leadership]",449,27,480 pages,"[8986, 6675, 2488, 404, 133]",4.28,October 20th 1991,0.0,1 March 2002
728,http://www.imdb.com/title/tt4116030/,L'Amant,,,,"
Prix Goncourt (1984), PEN Translation Prize for Prose (1986), Prix Ritz-Paris-Hemingway (1986), Scott Moncrieff Prize (1986)
",L'Amant,[],"[Fiction, Historical Fiction, Cultural, France, Adult Fiction, Erotica, Classics]","1,496",133,142 pages,"[6226, 7857, 5862, 2001, 579]",3.76,,4.0,
729,http://www.imdb.com/title/tt4175888/,The Chosen,,,,"
Edward Lewis Wallant Award (1967), National Book Award Finalist for Fiction (1968)
",The Chosen,"[Reuven Malter, Danny Saunders]","[Fiction, Classics, Historical Fiction, Young Adult, Literature, Jewish, Religion, Literature]","3,326",76,304 pages,"[25671, 26185, 13361, 3371, 1242]",4.03,1967,2.0,24 July 2015
730,http://www.imdb.com/title/tt1650043/,Rodrick Rules,21000000,52691009,23751502,,Rodrick Rules (Diary of a Wimpy Kid #2),[],"[Fiction, Realistic Fiction, Childrens, Young Adult, Sequential Art, Graphic Novels, Humor, Funny]","5,485",88,224 pages,"[40969, 25976, 17457, 4915, 1813]",4.09,,0.0,25 March 2011
731,http://www.imdb.com/title/tt0244970/,Animal Husbandry,23000000,27338033,10010600,,Animal Husbandry,[],"[Womens Fiction, Chick Lit, Fiction, Humor, Romance, Contemporary, Adult Fiction, Relationships, Media Tie In, Movies, Romance, Contemporary Romance, Modern]",180,29,320 pages,"[254, 531, 718, 298, 92]",3.29,December 15th 1997,0.0,30 March 2001
732,http://www.imdb.com/title/tt1717455/,Silk,,,,"
Prix des libraires du Québec for Lauréats hors Québec (1998)
",Silk,[Hervé Joncour],"[Fiction, Historical Fiction, European Literature, Italian Literature, Romance, Cultural, Japan, Cultural, Italy, Historical, Literature, Cultural, France, Novels]","1,617",142,91 pages,"[6016, 7660, 5193, 1652, 473]",3.81,1996,1.0,
733,http://www.imdb.com/title/tt1320347/,Midnight Bayou,,,,"
RITA Award by Romance Writers of America Nominee for Contemporary Single Title Romance (2002)
",Midnight Bayou,"[Angelina ""Lena"" Simone, Declan Fitzgerald]","[Romance, Mystery, Fiction, Fantasy, Paranormal, Romance, Contemporary Romance, Contemporary, Romance, Romantic Suspense, Romance, Paranormal Romance, Suspense, Paranormal, Ghosts]",725,74,338 pages,"[8776, 8984, 6534, 1316, 285]",3.95,January 1st 2001,1.0,
734,http://www.imdb.com/title/tt0066661/,A Knight in Shining Armor,,,,,A Knight in Shining Armor (Montgomery/Taggert #15),"[Dougless Montgomery, Nicholas Stafford]","[Romance, Romance, Historical Romance, Science Fiction, Time Travel, Historical, Historical Fiction, Fiction, Fantasy]","1,787",51,464 pages,"[14070, 8028, 4132, 1049, 487]",4.23,1989,0.0,
735,http://www.imdb.com/title/tt0118172/,The Wind in the Willows,,72844,72844,"
Lewis Carroll Shelf Award (1958)
",The Wind in the Willows,"[Badger, Otter, Mole, Rat, Toad]","[Classics, Fiction, Childrens, Fantasy, Animals, Young Adult, Adventure, Literature, Childrens, Juvenile, European Literature, British Literature]","3,752",996,256 pages,"[46097, 44289, 29236, 6660, 2387]",3.97,October 8th 1908,1.0,31 October 1997
736,http://www.imdb.com/title/tt0435625/,The Descent,,26027680,8411,,The Descent (The Descent #1),[],"[Horror, Fiction, Science Fiction, Thriller, Fantasy]",481,23,572 pages,"[1945, 1853, 1050, 351, 122]",3.97,1999,0.0,4 August 2006
