,Link,New Book Name,Budget,Gross,Opening,Awards List,Book Name,Characters,Genres,Num_reviews,Other editions,Pages,Star votes,Stars,publish_date,Award Count,Num Characters,Star_count_5,Star_count_4,Star_count_3,Star_count_2,Star_count_1,Star_count_total,Genre_Fiction,Genre_Fantasy,Genre_Classics,Genre_Mystery,Genre_Young Adult,Genre_Romance,Genre_Literature,Genre_Historical Fiction,Genre_Thriller,Genre_Childrens,Genre_Science Fiction,Genre_Novels,Genre_Contemporary,Genre_Adventure,Genre_Crime,Genre_Cultural,Genre_Sequential Art,Genre_Historical,Genre_Humor,Genre_Horror,Genre_Paranormal,Genre_Nonfiction,Genre_War,Genre_European Literature,Genre_Biography,Genre_Womens Fiction,Genre_Suspense,Genre_Chick Lit,Genre_Adult,Genre_Autobiography,Genre_History,Release Date,Time Diff
0,http://www.imdb.com/title/tt0373889/,Harry Potter and the Order of the Phoenix,150000000,292004738,77108414,"
Bram Stoker Award for Works for Young Readers (2003), Anthony Award for Young Adult (2004), Mythopoeic Fantasy Award for Children's Literature (2008), Audie Award for Audiobook of the Year (2004), Books I Loved Best Yearly (BILBY) Awards for Older Readers (2004)
...more
Colorado Blue Spruce Young Adult Book Award (2006), Golden Archer Award for Middle/Junior High (2005), Deutscher Jugendliteraturpreis Nominee for Preis der Jugendjury (2004), Carnegie Medal Nominee (2003)
...less ",Harry Potter and the Order of the Phoenix (Harry Potter #5),"[Sirius Black, Draco Malfoy, Ron Weasley, Petunia Dursley, Vernon Dursley, Dudley Dursley, Albus Dumbledore, Severus Snape, Rubeus Hagrid, Lord Voldemort, Minerva McGonagall, Neville Longbottom, Fred Weasley, George Weasley, Percy Weasley, Ginny Weasley, Colin Creevey, Filius Flitwick, Gilderoy Lockhart, Lucius Malfoy, Pomona Sprout, Arthur Weasley, Molly Weasley, Cho Chang, Cornelius Fudge, Remus Lupin, Sybil Trelawney, Stan Shunpike, Bellatrix Lestrange, Alastor Moody, Rita Skeeter, Luna Lovegood, Nymphadora Tonks, Dolores Umbridge, Dobby, Kingsley Shacklebolt, Padma Patil, Parvati Patil, Kreacher, Dean Thomas, Seamus Finnigan, Harry Potter, Hermione Granger]","[Childrens, Fantasy, Novels]",25751.0,0.0,870.0,"[1041580, 467679, 172852, 30465, 9227]",4.45,2003-06-21,8.0,43.0,9227.0,30465.0,172852.0,467679.0,1041580.0,1721803.0,0.0,1.0,0.0,0.0,0.0,0.0,0.0,0.0,0.0,1.0,0.0,1.0,0.0,0.0,0.0,0.0,0.0,0.0,0.0,0.0,0.0,0.0,0.0,0.0,0.0,0.0,0.0,0.0,0.0,0.0,0.0,2007-07-11,1481 days 00:00:00.000000000
1,http://www.imdb.com/title/tt1099212/,Twilight,37000000,191465414,69637740,"
Georgia Peach Book Award (2007), Buxtehuder Bulle (2006), Kentucky Bluegrass Award for 9-12 (2007), Prijs van de Kinder- en Jeugdjury Vlaanderen (2008), Books I Loved Best Yearly (BILBY) Awards for Older Readers (2009)
...more
West Australian Young Readers' Book Award (WAYRBA) for Older Readers (2008), Garden State Book Award for Fiction (Grades 9-12) (2008), South Carolina Book Award for Young Adult Book Award (2008), Grand Canyon Reader Award for Teen Book (2008), Maryland Black-Eyed Susan Book Award for High School (2007), Golden Sower Award for Young Adult (2009), Nevada Young Readers' Award for Young Adult Category  (2007), The Flume: New Hampshire Teen Reader's Choice Award (2007), Pennsylvania Young Readers' Choice Award for Young Adult (2009), Rhode Island Teen Book Award (2007), Evergreen Teen Book Award (2008), Michigan Library Association Thumbs Up! Award Nominee (2006), Teen Read Award Nominee for Best All-Time-Fave (2010), Deutscher Jugendliteraturpreis Nominee for Preis der Jugendjury (2007), Iowa High School Book Award (2008), Abraham Lincoln Award (2008), Literaturpreis der Jury der jungen Leser for Cover (2007), Missouri Gateway Readers Award (2008)
...less ",Twilight (Twilight #1),"[Edward Cullen, Jacob Black, Laurent, Renee, Bella Swan, Billy Black, Esme Cullen, Alice Cullen, Jasper Hale, Carlisle Cullen, Emmett Cullen, Rosalie Hale, Charlie Swan, Mike Newton, Jessica Stanley, Angela Weber, Tyler Crowley]","[Young Adult, Fantasy, Romance, Paranormal, Vampires, Fiction, Fantasy, Paranormal]",93258.0,229.0,498.0,"[1258780, 814235, 738275, 407909, 428866]",3.57,2005-10-05,22.0,17.0,428866.0,407909.0,738275.0,814235.0,1258780.0,3648065.0,1.0,1.0,0.0,0.0,1.0,1.0,0.0,0.0,0.0,0.0,0.0,0.0,0.0,0.0,0.0,0.0,0.0,0.0,0.0,0.0,1.0,0.0,0.0,0.0,0.0,0.0,0.0,0.0,0.0,0.0,0.0,2008-11-21,1143 days 00:00:00.000000000
2,http://www.imdb.com/title/tt0330373/,Harry Potter and the Goblet of Fire,150000000,290013036,102335066,"
Hugo Award for Best Novel (2001), Mythopoeic Fantasy Award for Children's Literature (2008), Publieksprijs voor het Nederlandse Boek (2001), Audie Award for Solo Narration - Male (2001), West Australian Young Readers' Book Award (WAYRBA) for Younger Readers (2001)
...more
Golden Archer Award for Middle/Junior High (2002), Indian Paintbrush Book Award (2002), Deutscher Bücherpreis for Publikumspreis
...less ",Harry Potter and the Goblet of Fire (Harry Potter #4),"[Sirius Black, Draco Malfoy, Ron Weasley, Petunia Dursley, Vernon Dursley, Dudley Dursley, Albus Dumbledore, Severus Snape, Rubeus Hagrid, Lord Voldemort, Minerva McGonagall, Neville Longbottom, Fred Weasley, George Weasley, Percy Weasley, Ginny Weasley, Arthur Weasley, Molly Weasley, Cho Chang, Cornelius Fudge, Sybil Trelawney, Ludo Bagman, Bartemius Crouch, Bartemius Crouch, Jr., Fleur Delacour, Cedric Diggory, Viktor Krum, Bellatrix Lestrange, Alastor Moody, Rita Skeeter, Charlie Weasley, Bill Weasley, Harry Potter, Hermione Granger]","[Fantasy, Young Adult, Fiction, Fantasy, Magic, Childrens, Adventure, Science Fiction Fantasy, Classics, Novels, Childrens, Middle Grade]",27770.0,299.0,734.0,"[1081875, 463920, 144699, 19224, 6183]",4.51,2000-07-08,7.0,35.0,6183.0,19224.0,144699.0,463920.0,1081875.0,1715901.0,1.0,1.0,1.0,0.0,1.0,0.0,0.0,0.0,0.0,1.0,0.0,1.0,0.0,1.0,0.0,0.0,0.0,0.0,0.0,0.0,0.0,0.0,0.0,0.0,0.0,0.0,0.0,0.0,0.0,0.0,0.0,2005-11-18,1959 days 00:00:00.000000000
3,http://www.imdb.com/title/tt0304141/,Harry Potter and the Prisoner of Azkaban,130000000,249358727,93687367,"
Bram Stoker Award for Best Work for Young Readers (1999), Hugo Award Nominee for Best Novel (2000), Locus Award for Best Fantasy Novel (2000), Whitbread Award for Children's Book of the Year (1999), Mythopoeic Fantasy Award for Children's Literature (2008)
...more
Smarties Prize (1999), Books I Loved Best Yearly (BILBY) Awards for Older Readers (2005), Colorado Blue Spruce Young Adult Book Award (2004), Maine Student Book Award (2000), Golden Archer Award for Intermediate (2001), Indian Paintbrush Book Award (2004), Soaring Eagle Book Award (2002), Hotze de Roosprijs (2001)
...less ",Harry Potter and the Prisoner of Azkaban (Harry Potter #3),"[Sirius Black, Draco Malfoy, Ron Weasley, Petunia Dursley, Vernon Dursley, Dudley Dursley, Albus Dumbledore, Severus Snape, Rubeus Hagrid, Minerva McGonagall, Neville Longbottom, Fred Weasley, George Weasley, Percy Weasley, Ginny Weasley, Colin Creevey, Filius Flitwick, Pomona Sprout, Arthur Weasley, Molly Weasley, Cho Chang, Marjorie Dursley, Cornelius Fudge, Remus Lupin, Sybil Trelawney, Peter Pettigrew, Poppy Pomfrey, Stan Shunpike, Oliver Wood, Cedric Diggory, Dean Thomas, Seamus Finnigan, Rolanda Hooch, Katie Bell, Ernie Prang, Harry Potter, Hermione Granger]","[Fantasy, Young Adult, Fiction]",32160.0,331.0,435.0,"[1144372, 477102, 158646, 19530, 6204]",4.51,1999-07-08,12.0,37.0,6204.0,19530.0,158646.0,477102.0,1144372.0,1805854.0,1.0,1.0,0.0,0.0,1.0,0.0,0.0,0.0,0.0,0.0,0.0,0.0,0.0,0.0,0.0,0.0,0.0,0.0,0.0,0.0,0.0,0.0,0.0,0.0,0.0,0.0,0.0,0.0,0.0,0.0,0.0,2004-06-04,1793 days 00:00:00.000000000
4,http://www.imdb.com/title/tt0241527/,Harry Potter and the Sorcerer's Stone,125000000,317557891,90294621,"
Mythopoeic Fantasy Award for Children's Literature (2008), British Book Award for Children's Book of the Year (1998), Smarties Prize (1997), Prijs van de Nederlandse Kinderjury for 6-9 jaar en 10-12 jaar (2002), American Booksellers Book Of The Year  Award for Children (1999)
...more
West Australian Young Readers' Book Award (WAYRBA) for Younger Readers (2000), Rebecca Caudill Young Reader's Book Award (2001), South Carolina Book Award for Junior Book Award (2001), Grand Canyon Reader Award for Teen Book (2000), Charlotte Award (2000), Nene Award (2000), Massachusetts Children's Book Award (2000), Colorado Blue Spruce Young Adult Book Award (2001), Blue Hen Book Award for Chapter Book (2001), Nevada Young Readers' Award for Young Reader Category (2000), Golden Archer Award for Middle/Junior High (2000), Indian Paintbrush Book Award (2000), Hotze de Roosprijs (2002), Kinderboekwinkelprijs (1999), National Book Award (UK) (1997), Parenting Book of the Year Award (1998), North East Teenage Book Award (1999), Washington State Sasquatch Award (2000), Literaturpreis der Jury der jungen Leser for Kinderbuch (1999), Carnegie Medal Nominee (1997)
...less ",Harry Potter and the Sorcerer's Stone (Harry Potter #1),"[Draco Malfoy, Ron Weasley, Petunia Dursley, Vernon Dursley, Dudley Dursley, Albus Dumbledore, Severus Snape, Quirinus Quirrell, Rubeus Hagrid, Lord Voldemort, Minerva McGonagall, Neville Longbottom, Fred Weasley, George Weasley, Percy Weasley, Filius Flitwick, Pomona Sprout, Molly Weasley, Poppy Pomfrey, Oliver Wood, Parvati Patil, Lavender Brown, Dean Thomas, James Potter, Lily Potter, Seamus Finnigan, Garrick Ollivander, Rolanda Hooch, Katie Bell, Harry Potter, Hermione Granger, Dedalus Diggle]","[Fantasy, Young Adult, Fiction]",67668.0,156.0,320.0,"[2650321, 1054137, 423981, 94447, 67115]",4.43,,24.0,32.0,67115.0,94447.0,423981.0,1054137.0,2650321.0,4290001.0,1.0,1.0,0.0,0.0,1.0,0.0,0.0,0.0,0.0,0.0,0.0,0.0,0.0,0.0,0.0,0.0,0.0,0.0,0.0,0.0,0.0,0.0,0.0,0.0,0.0,0.0,0.0,0.0,0.0,0.0,0.0,2001-11-16,
5,http://www.imdb.com/title/tt0295297/,Harry Potter and the Chamber of Secrets,100000000,261970615,88357488,"
Mythopoeic Fantasy Award for Children's Literature (2008), British Book Award (1999), Smarties Prize (1999), Booklist Editors' Choice (1999), Prijs van de Jonge Jury (2002)
...more
Books I Loved Best Yearly (BILBY) Awards for Older Readers (2006), Colorado Blue Spruce Young Adult Book Award (2008), Golden Archer Award for Middle/Junior High (2008)
...less ",Harry Potter and the Chamber of Secrets (Harry Potter #2),"[Draco Malfoy, Ron Weasley, Petunia Dursley, Vernon Dursley, Dudley Dursley, Albus Dumbledore, Severus Snape, Rubeus Hagrid, Lord Voldemort, Minerva McGonagall, Neville Longbottom, Fred Weasley, George Weasley, Percy Weasley, Ginny Weasley, Colin Creevey, Filius Flitwick, Gilderoy Lockhart, Lucius Malfoy, Pomona Sprout, Arthur Weasley, Molly Weasley, Cornelius Fudge, Poppy Pomfrey, Oliver Wood, Dobby, Parvati Patil, Dean Thomas, James Potter, Seamus Finnigan, Rolanda Hooch, Katie Bell, Harry Potter, Hermione Granger]","[Fantasy, Young Adult, Fiction, Fantasy, Magic, Childrens, Adventure, Science Fiction Fantasy, Classics, Childrens, Middle Grade, Novels]",29953.0,360.0,341.0,"[955969, 507584, 230507, 40686, 7721]",4.36,1998-04-12,7.0,34.0,7721.0,40686.0,230507.0,507584.0,955969.0,1742467.0,1.0,1.0,1.0,0.0,1.0,0.0,0.0,0.0,0.0,1.0,0.0,1.0,0.0,1.0,0.0,0.0,0.0,0.0,0.0,0.0,0.0,0.0,0.0,0.0,0.0,0.0,0.0,0.0,0.0,0.0,0.0,2002-11-15,1678 days 00:00:00.000000000
6,http://www.imdb.com/title/tt0417741/,Harry Potter and the Half-Blood Prince,250000000,301959197,77835727,"
British Book of the Year (2006)
",Harry Potter and the Half-Blood Prince (Harry Potter #6),"[Ron Weasley, Harry Potter, Hermione Granger, Albus Dumbledore]","[Fantasy, Young Adult, Fiction]",24934.0,255.0,652.0,"[1059719, 433145, 130525, 20619, 6852]",4.53,2005-07-16,1.0,4.0,6852.0,20619.0,130525.0,433145.0,1059719.0,1650860.0,1.0,1.0,0.0,0.0,1.0,0.0,0.0,0.0,0.0,0.0,0.0,0.0,0.0,0.0,0.0,0.0,0.0,0.0,0.0,0.0,0.0,0.0,0.0,0.0,0.0,0.0,0.0,0.0,0.0,0.0,0.0,2009-07-15,1460 days 00:00:00.000000000
7,http://www.imdb.com/title/tt1932888/,Eragon,,,,"
Book Sense Book of the Year Award for Children's Literature (2004), Books I Loved Best Yearly (BILBY) Awards for Older Readers (2007), Rebecca Caudill Young Reader's Book Award (2006), South Carolina Book Award for Young Adult Book (2006), Grand Canyon Reader Award for Teen Book (2006)
...more
Nene Award (2006), Colorado Blue Spruce Young Adult Book Award (2005), Pennsylvania Young Readers' Choice Award for Grades 6-8 (2005), Rhode Island Teen Book Award (2005), Beehive Award for Young Adult Book (2005), Evergreen Teen Book Award (2006), Golden Archer Award for Middle/Junior High (2006), Soaring Eagle Book Award (2005), Pacific Northwest Library Association Young Reader's Choice Award for Intermediate (2006), Iowa Teen Award (2008), Literaturpreis der Jury der jungen Leser for Kinderbuch (2005), Virginia Reader's Choice Award for Middle (2005), Missouri Gateway Readers Award for Young Adult (2006), Oklahoma Sequoyah Award for YA (2006)
...less ",Eragon (The Inheritance Cycle #1),"[Eragon (The Inheritance Cycle), Saphira (The Inheritance Cycle), Roran Garrowsson, Arya (The Inheritance Cycle), Brom (The Inheritance Cycle), Orik (The Inheritance Cycle), Horst (The Inheritance Cycle), Murtagh (The Inheritance Cycle), Solembum, Queen Islanzadi, Angela the Herbalist]","[Fantasy, Young Adult, Fiction, Fantasy, Dragons, Adventure, Fantasy, Magic, Fantasy, High Fantasy, Science Fiction Fantasy, Young Adult, Teen, Young Adult, Young Adult Fantasy]",17413.0,199.0,503.0,"[374199, 313859, 225705, 84229, 48311]",3.84,2017-06-02,18.0,11.0,48311.0,84229.0,225705.0,313859.0,374199.0,1046303.0,1.0,1.0,0.0,0.0,1.0,0.0,0.0,0.0,0.0,0.0,0.0,0.0,0.0,1.0,0.0,0.0,0.0,0.0,0.0,0.0,0.0,0.0,0.0,0.0,0.0,0.0,0.0,0.0,0.0,0.0,0.0,,
8,http://www.imdb.com/title/tt0397535/,Memoirs of a Geisha,85000000,57010853,682504,,Memoirs of a Geisha,"[Nitta Sayuri, Mr. Bekku, Mr. Tanaka, Dr. Crab]","[Fiction, Historical Fiction, Romance, Historical, Cultural, Japan]",24630.0,201.0,434.0,"[522756, 489841, 248098, 57061, 22646]",4.07,1997-09-12,0.0,4.0,22646.0,57061.0,248098.0,489841.0,522756.0,1340402.0,1.0,0.0,0.0,0.0,0.0,1.0,0.0,1.0,0.0,0.0,0.0,0.0,0.0,0.0,0.0,1.0,0.0,1.0,0.0,0.0,0.0,0.0,0.0,0.0,0.0,0.0,0.0,0.0,0.0,0.0,0.0,2005-12-23,3024 days 00:00:00.000000000
9,http://www.imdb.com/title/tt0312528/,The Cat in the Hat,109000000,100446895,38329160,"
Books I Loved Best Yearly (BILBY) Awards for Early Readers (2004, 2012) (2004)
",The Cat in the Hat (Beginner Books B-1),[The Cat in the Hat],"[Childrens, Childrens, Picture Books, Classics, Fiction]",4009.0,96.0,61.0,"[147625, 83392, 56319, 14189, 5992]",4.15,1957-03-12,2.0,1.0,5992.0,14189.0,56319.0,83392.0,147625.0,307517.0,1.0,0.0,1.0,0.0,0.0,0.0,0.0,0.0,0.0,1.0,0.0,0.0,0.0,0.0,0.0,0.0,0.0,0.0,0.0,0.0,0.0,0.0,0.0,0.0,0.0,0.0,0.0,0.0,0.0,0.0,0.0,2003-11-21,17055 days 00:00:00.000000000
10,http://www.imdb.com/title/tt1201607/,Harry Potter and the Deathly Hallows,125000000,381011219,169189427,"
Locus Award Nominee for Best Young Adult Novel (2008), Mythopoeic Fantasy Award for Children's Literature (2008), Odyssey Award for Excellence in Audiobook Production Honor (2008), Books I Loved Best Yearly (BILBY) Awards for Older Readers (2008), Teen Read Award Nominee for Best All-Time-Fave (2010)
...more
Puddly Award for Fiction (2008), Andre Norton Award for Young Adult Science Fiction and Fantasy (2007), Carnegie Medal Nominee (2008)
...less ",Harry Potter and the Deathly Hallows (Harry Potter #7),"[Sirius Black, Draco Malfoy, Ron Weasley, Petunia Dursley, Vernon Dursley, Dudley Dursley, Albus Dumbledore, Severus Snape, Rubeus Hagrid, Lord Voldemort, Minerva McGonagall, Neville Longbottom, Fred Weasley, George Weasley, Percy Weasley, Ginny Weasley, Colin Creevey, Filius Flitwick, Lucius Malfoy, Pomona Sprout, Arthur Weasley, Molly Weasley, Cho Chang, Remus Lupin, Sybil Trelawney, Peter Pettigrew, Oliver Wood, Fleur Delacour, Viktor Krum, Bellatrix Lestrange, Alastor Moody, Bill Weasley, Luna Lovegood, Nymphadora Tonks, Dolores Umbridge, Dobby, Kingsley Shacklebolt, Padma Patil, Parvati Patil, Kreacher, Narcissa Malfoy, Horace Slughorn, Rufus Scrimgeour, Lavender Brown, Dean Thomas, Aberforth Dumbledore, James Potter, Lily Potter, Xenophilius Lovegood, Seamus Finnigan, Garrick Ollivander, Katie Bell, Griphook, Lily Luna Potter, James Sirius Potter, Albus Severus Potter, Teddy Lupin, Rose Weasley, Hugo Weasley, Harry Potter, Hermione Granger]","[Fantasy, Young Adult, Fiction]",48842.0,256.0,784.0,"[1205643, 360677, 108348, 21270, 8804]",4.6,,7.0,61.0,8804.0,21270.0,108348.0,360677.0,1205643.0,1704742.0,1.0,1.0,0.0,0.0,1.0,0.0,0.0,0.0,0.0,0.0,0.0,0.0,0.0,0.0,0.0,0.0,0.0,0.0,0.0,0.0,0.0,0.0,0.0,0.0,0.0,0.0,0.0,0.0,0.0,0.0,0.0,2011-07-15,
11,http://www.imdb.com/title/tt0363771/,"The Lion, the Witch, and the Wardrobe",180000000,291709845,65556312,"
Hugo Award Nominee for Best Novel (1954), Lewis Carroll Shelf Award (1962)
","The Lion, the Witch, and the Wardrobe (The Chronicles of Narnia (Publication Order) #1)","[Aslan, Lucy Pevensie, Edmund Pevensie, Mr. Tumnus, Peter Pevensie, Susan Pevensie, Jadis, Mr. & Mrs. Beaver]","[Fantasy, Classics, Fiction, Young Adult, Childrens]",13935.0,467.0,206.0,"[658158, 469101, 242286, 51621, 17431]",4.18,1950-10-16,2.0,8.0,17431.0,51621.0,242286.0,469101.0,658158.0,1438597.0,1.0,1.0,1.0,0.0,1.0,0.0,0.0,0.0,0.0,1.0,0.0,0.0,0.0,0.0,0.0,0.0,0.0,0.0,0.0,0.0,0.0,0.0,0.0,0.0,0.0,0.0,0.0,0.0,0.0,0.0,0.0,2005-12-09,20143 days 00:00:00.000000000
12,http://www.imdb.com/title/tt5607976/,The Golden Compass,,,,"
Audie Award for Children's Titles (2000), Abraham Lincoln Award Nominee (2005), Carnegie Medal (1995)
",The Golden Compass (His Dark Materials #1),"[Lyra Belacqua, Pantalaimon, Lord Asriel, Iorek Byrnison, Iofur Raknison, Marisa Coulter, Lee Scoresby, Roger Parslow, Serafina Pekkala, Hester]","[Fantasy, Young Adult, Fiction, Childrens]",13892.0,276.0,399.0,"[350681, 291792, 187669, 61736, 36837]",3.92,1995-04-12,3.0,10.0,36837.0,61736.0,187669.0,291792.0,350681.0,928715.0,1.0,1.0,0.0,0.0,1.0,0.0,0.0,0.0,0.0,1.0,0.0,0.0,0.0,0.0,0.0,0.0,0.0,0.0,0.0,0.0,0.0,0.0,0.0,0.0,0.0,0.0,0.0,0.0,0.0,0.0,0.0,,
13,http://www.imdb.com/title/tt0814255/,The Lightning Thief,95000000,88761720,,"
Young Readers' Choice Award (2008), Books I Loved Best Yearly (BILBY) Awards for Older Readers (2011), Rebecca Caudill Young Reader's Book Award (2009), South Carolina Book Award for Junior Book Award (2008), Grand Canyon Reader Award for Tween Book (2008)
...more
Nene Award (2008), Massachusetts Children's Book Award (2008), Pennsylvania Young Readers' Choice Award for Grades 6-8 (2008), Sunshine State Young Readers Award for Grades 6-8 (2007), Pacific Northwest Library Association Young Reader's Choice Award for Intermediate (2008), Iowa Teen Award (2009), Abraham Lincoln Award Nominee (2009), Oklahoma Sequoyah Award for YA (2008)
...less ",The Lightning Thief (Percy Jackson and the Olympians #1),"[Percy Jackson, Annabeth Chase, Grover Underwood, Luke Castellan, Zeus, Dionysus, Ares, Poseidon, Chiron]","[Fantasy, Young Adult, Fantasy, Mythology, Fiction]",43019.0,174.0,377.0,"[619400, 396458, 202311, 44637, 16637]",4.22,2005-06-28,12.0,9.0,16637.0,44637.0,202311.0,396458.0,619400.0,1279443.0,1.0,1.0,0.0,0.0,1.0,0.0,0.0,0.0,0.0,0.0,0.0,0.0,0.0,0.0,0.0,0.0,0.0,0.0,0.0,0.0,0.0,0.0,0.0,0.0,0.0,0.0,0.0,0.0,0.0,0.0,0.0,2010-02-12,1690 days 00:00:00.000000000
14,http://www.imdb.com/title/tt0814255/,The Battle of the Labyrinth,95000000,88761720,,,The Battle of the Labyrinth (Percy Jackson and the Olympians #4),"[Nico di Angelo, Percy Jackson, Tyson, Annabeth Chase, Grover Underwood, Daedalus, Rachel Elizabeth Dare]","[Fantasy, Young Adult, Fantasy, Mythology]",13008.0,98.0,361.0,"[273102, 161996, 58920, 7690, 2346]",4.38,,0.0,7.0,2346.0,7690.0,58920.0,161996.0,273102.0,504054.0,0.0,1.0,0.0,0.0,1.0,0.0,0.0,0.0,0.0,0.0,0.0,0.0,0.0,0.0,0.0,0.0,0.0,0.0,0.0,0.0,0.0,0.0,0.0,0.0,0.0,0.0,0.0,0.0,0.0,0.0,0.0,2010-02-12,
15,http://www.imdb.com/title/tt0327679/,Ella Enchanted,35000000,22913677,6169030,"
Newbery Honor (1998), Mythopoeic Fantasy Award Nominee for Children's Literature (1999), Rebecca Caudill Young Reader's Book Award (2000), Grand Canyon Reader Award for Teen Book (1999), Maryland Black-Eyed Susan Book Award for Grade 6-9 (2000)
...more
Dorothy Canfield Fisher Children's Book Award (1999), Iowa Teen Award (2000)
...less ",Ella Enchanted,"[Ella Varner, Lucinda, Mandy, Prince Charmont, Areida, Hattie, Olive Abroholos Elephanta]","[Fantasy, Young Adult, Fiction, Romance, Fantasy, Fairy Tales, Childrens]",8084.0,55.0,232.0,"[121535, 105530, 77050, 19348, 6361]",3.96,1997-01-01,6.0,7.0,6361.0,19348.0,77050.0,105530.0,121535.0,329824.0,1.0,1.0,0.0,0.0,1.0,1.0,0.0,0.0,0.0,1.0,0.0,0.0,0.0,0.0,0.0,0.0,0.0,0.0,0.0,0.0,0.0,0.0,0.0,0.0,0.0,0.0,0.0,0.0,0.0,0.0,0.0,2004-04-09,2655 days 00:00:00.000000000
16,http://www.imdb.com/title/tt1259571/,New Moon,50000000,296623634,142839137,"
Books I Loved Best Yearly (BILBY) Awards for Older Readers (2010), South Carolina Book Award for Young Adult Book Award (2009), The Flume: New Hampshire Teen Reader's Choice Award (2008), Soaring Eagle Book Award (2007), Pacific Northwest Library Association Young Reader's Choice Award for Senior (2009)
",New Moon (Twilight #2),"[Edward Cullen, Jacob Black, Bella Swan, Billy Black, Esme Cullen, Alice Cullen, Jasper Hale, Carlisle Cullen, Emmett Cullen, Rosalie Hale, Charlie Swan, Mike Newton]","[Young Adult, Fantasy, Romance, Paranormal, Vampires, Fiction]",43367.0,184.0,563.0,"[335851, 278866, 281575, 153835, 98561]",3.52,,5.0,12.0,98561.0,153835.0,281575.0,278866.0,335851.0,1148688.0,1.0,1.0,0.0,0.0,1.0,1.0,0.0,0.0,0.0,0.0,0.0,0.0,0.0,0.0,0.0,0.0,0.0,0.0,0.0,0.0,1.0,0.0,0.0,0.0,0.0,0.0,0.0,0.0,0.0,0.0,0.0,2009-11-20,
17,http://www.imdb.com/title/tt1374989/,Pride and Prejudice,28000000,10907291,5324240,,Pride and Prejudice,"[Mr. Bennet, Mrs. Bennet, Jane Bennet, Elizabeth Bennet, Mary Bennet, Kitty Bennet, Lydia Bennet, Louisa Hurst, Caroline Bingley, Fitzwilliam Darcy, Georgiana Darcy, Lady Catherine de Bourgh, Anne de Bourgh, Colonel Fitzwilliam, Mr. Gardiner, Mrs. Gardiner, Sir William Lucas, Lady Lucas, Charlotte Lucas, Maria Lucas, Mr. Darcy, Charles Bingley, George Wickham, Mr. William Collins]","[Classics, Fiction, Romance, Historical Fiction]",45880.0,2887.0,279.0,"[1058669, 563191, 264835, 80726, 50206]",4.24,1813-04-12 00:00:00,0.0,24.0,50206.0,80726.0,264835.0,563191.0,1058669.0,2017627.0,1.0,0.0,1.0,0.0,0.0,1.0,0.0,1.0,0.0,0.0,0.0,0.0,0.0,0.0,0.0,0.0,0.0,0.0,0.0,0.0,0.0,0.0,0.0,0.0,0.0,0.0,0.0,0.0,0.0,0.0,0.0,2016-02-05,74078 days 00:00:00.000000000
18,http://www.imdb.com/title/tt1374989/,Pride and Prejudice and Zombies,28000000,10907291,5324240,"
The Kitschies Nominee for Red Tentacle (Novel) (2009), Goodreads Choice Award Nominee for Favorite Book & Fantasy (2009)
",Pride and Prejudice and Zombies (Pride and Prejudice and Zombies #1),"[Mr. Bennet, Mrs. Bennet, Jane Bennet, Elizabeth Bennet, Mary Bennet, Kitty Bennet, Lydia Bennet, Fitzwilliam Darcy, Georgiana Darcy, Lady Catherine de Bourgh, Colonel Fitzwilliam, Victoria Kitchen, Charles Bingley, George Wickham, Mr. William Collins, Zombies]","[Horror, Horror, Zombies, Fantasy, Humor, Classics, Romance, Historical Fiction]",11841.0,89.0,320.0,"[18056, 28392, 31990, 16368, 9574]",3.28,2009-04-12,2.0,16.0,9574.0,16368.0,31990.0,28392.0,18056.0,104380.0,0.0,1.0,1.0,0.0,0.0,1.0,0.0,1.0,0.0,0.0,0.0,0.0,0.0,0.0,0.0,0.0,0.0,0.0,1.0,1.0,0.0,0.0,0.0,0.0,0.0,0.0,0.0,0.0,0.0,0.0,0.0,2016-02-05,2490 days 00:00:00.000000000
19,http://www.imdb.com/title/tt0056592/,To Kill a Mockingbird,2000000,13129846,,"
Pulitzer Prize for Fiction (1961), Audie Award for Classic (2007), National Book Award Finalist for Fiction (1961), Alabama Author Award - Fiction (1961)
",To Kill a Mockingbird (To Kill a Mockingbird #1),"[Scout Finch, Atticus Finch, Jem Finch, Arthur Radley, Mayella Ewell, Aunt Alexandra, Bob Ewell]","[Classics, Fiction, Historical Fiction, Academic, School]",68288.0,439.0,324.0,"[1580161, 931743, 420622, 111263, 56960]",4.25,1960-04-12,4.0,7.0,56960.0,111263.0,420622.0,931743.0,1580161.0,3100749.0,1.0,0.0,1.0,0.0,0.0,0.0,0.0,1.0,0.0,0.0,0.0,0.0,0.0,0.0,0.0,0.0,0.0,0.0,0.0,0.0,0.0,0.0,0.0,0.0,0.0,0.0,0.0,0.0,0.0,0.0,0.0,1963-03-16,1068 days 00:00:00.000000000
20,http://www.imdb.com/title/tt0413895/,Charlotte's Web,,82506325,11457353,"
Newbery Honor (1953), AudioFile Earphones Award (0), George C. Stone Center for Children's Books Recognition of Merit Award (1970), Massachusetts Children's Book Award (1984), Laura Ingalls Wilder Award (1970)
",Charlotte's Web,"[Fern, Avery, Charlotte French, Wilbur, Templeton, פרם, וילבור, שרלוטה]","[Classics, Childrens, Fiction]",12003.0,167.0,184.0,"[440094, 320785, 178949, 38139, 16149]",4.14,1952-04-12,5.0,8.0,16149.0,38139.0,178949.0,320785.0,440094.0,994116.0,1.0,0.0,1.0,0.0,0.0,0.0,0.0,0.0,0.0,1.0,0.0,0.0,0.0,0.0,0.0,0.0,0.0,0.0,0.0,0.0,0.0,0.0,0.0,0.0,0.0,0.0,0.0,0.0,0.0,0.0,0.0,2006-12-15,19970 days 00:00:00.000000000
