,Link,New Book Name,Budget,Gross,Opening,Awards List,Book Name,Characters,Genres,Num_reviews,Other editions,Pages,Star votes,Stars,publish_date,Award Count,Num Characters,Star_count_5,Star_count_4,Star_count_3,Star_count_2,Star_count_1,Star_count_total,Genre_Fiction,Genre_Fantasy,Genre_Classics,Genre_Mystery,Genre_Young Adult,Genre_Romance,Genre_Literature,Genre_Historical Fiction,Genre_Thriller,Genre_Childrens,Genre_Science Fiction,Genre_Novels,Genre_Contemporary,Genre_Adventure,Genre_Crime,Genre_Cultural,Genre_Sequential Art,Genre_Historical,Genre_Humor,Genre_Horror,Genre_Paranormal,Genre_Nonfiction,Genre_War,Genre_European Literature,Genre_Biography,Genre_Womens Fiction,Genre_Suspense,Genre_Chick Lit,Genre_Adult,Genre_Autobiography,Genre_History,Release Date,Time Diff
279,http://www.imdb.com/title/tt0054698/,Breakfast at Tiffany's,2500000,8000000,,,Breakfast at Tiffany's,"[Holly Golightly, Doc Golightly, Joe Bell, I.Y. Yunioshi]","[Classics, Fiction, Literature, American, Literature, Short Stories, Novels, Literature, 20th Century, Classics, Modern Classics, Literary Fiction, Adult]",6664.0,227.0,178.0,"[40373, 55991, 35920, 7537, 1737]",3.89,1958-04-12,0.0,4.0,1737.0,7537.0,35920.0,55991.0,40373.0,141558.0,1.0,0.0,1.0,0.0,0.0,0.0,1.0,0.0,0.0,0.0,0.0,1.0,0.0,0.0,0.0,0.0,0.0,0.0,0.0,0.0,0.0,0.0,0.0,0.0,0.0,0.0,0.0,0.0,1.0,0.0,0.0,1961-10-05,1272 days 00:00:00.000000000
280,http://www.imdb.com/title/tt0120791/,Practical Magic,48000000,46732881,13104694,,Practical Magic,"[Sally Owens, Gillian Owens, Antonia Owens, Kylie Owens]","[Fiction, Fantasy, Magical Realism, Romance, Fantasy, Magic, Paranormal, Witches, Fantasy, Paranormal]",2364.0,41.0,286.0,"[8931, 12399, 9335, 2372, 555]",3.8,1995-04-12,0.0,4.0,555.0,2372.0,9335.0,12399.0,8931.0,33592.0,1.0,1.0,0.0,0.0,0.0,1.0,0.0,0.0,0.0,0.0,0.0,0.0,0.0,0.0,0.0,0.0,0.0,0.0,0.0,0.0,1.0,0.0,0.0,0.0,0.0,0.0,0.0,0.0,0.0,0.0,0.0,1998-10-16,1283 days 00:00:00.000000000
281,http://www.imdb.com/title/tt0085101/,The Thorn Birds,,,,,The Thorn Birds,"[Ralph de Bricassart, Meghann Cleary, Luke O'Neill, Fiona Cleary, Padraic Cleary, Francis Cleary, Dane O'Neill, Justine O'Neill]","[Romance, Historical Romance, Adult, Epic, Contemporary, History, Religion, Romantic, Literary Fiction, Media Tie In, Movies, Romance, Love Story]",4273.0,191.0,692.0,"[119492, 81733, 40637, 8775, 2747]",4.21,1977-04-12,0.0,8.0,2747.0,8775.0,40637.0,81733.0,119492.0,253384.0,0.0,0.0,0.0,0.0,0.0,1.0,0.0,0.0,0.0,0.0,0.0,0.0,1.0,0.0,0.0,0.0,0.0,0.0,0.0,0.0,0.0,0.0,0.0,0.0,0.0,0.0,0.0,0.0,1.0,0.0,1.0,,
282,http://www.imdb.com/title/tt0305669/,Bringing Down the House: The Inside Story of Six M.I.T. Students Who Took Vegas for Millions,33000000,132541238,31101026,,Bringing Down the House: The Inside Story of Six M.I.T. Students Who Took Vegas for Millions,[],"[Nonfiction, Biography, Autobiography, Memoir]",1697.0,45.0,272.0,"[4556, 8416, 5043, 872, 151]",3.86,2002-04-12,0.0,0.0,151.0,872.0,5043.0,8416.0,4556.0,19038.0,0.0,0.0,0.0,0.0,0.0,0.0,0.0,0.0,0.0,0.0,0.0,0.0,0.0,0.0,0.0,0.0,0.0,0.0,0.0,0.0,0.0,1.0,0.0,0.0,1.0,0.0,0.0,0.0,0.0,1.0,0.0,2003-03-07,329 days 00:00:00.000000000
283,http://www.imdb.com/title/tt0116654/,The Island of Dr. Moreau,40000000,27663982,9101987,,The Island of Dr. Moreau,"[Dr. Moreau, Dr. Montgomery, Edward Prendick]","[Horror, Fiction, Science Fiction Fantasy, Novels, Fantasy, Classics, Classics, Classic Literature]",2492.0,546.0,153.0,"[14214, 25359, 21117, 4746, 846]",3.71,1896-04-12 00:00:00,0.0,3.0,846.0,4746.0,21117.0,25359.0,14214.0,66282.0,1.0,1.0,1.0,0.0,0.0,0.0,0.0,0.0,0.0,0.0,0.0,1.0,0.0,0.0,0.0,0.0,0.0,0.0,0.0,1.0,0.0,0.0,0.0,0.0,0.0,0.0,0.0,0.0,0.0,0.0,0.0,1996-08-23,36657 days 00:00:00.000000000
284,http://www.imdb.com/title/tt0327056/,Mystic River,25000000,90135191,640815,"
Barry Award for Best Novel (2002), Macavity Award Nominee for Best Mystery Novel (2002), Anthony Award for Best Novel (2002), Hammett Prize Nominee (2001), Dilys Award (2002)
...more
Massachusetts Book Award for Fiction (2002), Prix des libraires du Québec for Lauréats hors Québec (2003)
...less ",Mystic River,[],"[Mystery, Fiction, Mystery, Crime, Thriller, Thriller, Mystery Thriller, Suspense]",2613.0,87.0,416.0,"[33308, 32659, 11934, 2049, 762]",4.19,2001-04-12,6.0,0.0,762.0,2049.0,11934.0,32659.0,33308.0,80712.0,1.0,0.0,0.0,1.0,0.0,0.0,0.0,0.0,1.0,0.0,0.0,0.0,0.0,0.0,1.0,0.0,0.0,0.0,0.0,0.0,0.0,0.0,0.0,0.0,0.0,0.0,1.0,0.0,0.0,0.0,0.0,2003-10-15,916 days 00:00:00.000000000
285,http://www.imdb.com/title/tt0976051/,The Reader,32000000,34194407,2380376,"
Exclusive Books Boeke Prize (1999), Prix des libraires du Québec for Lauréats hors Québec (1997), Prix Laure Bataillon (1997), Ελληνο-γερμανικό Βραβείο Μετάφρασης (2000)
",The Reader,"[Michael Berg, Hanna Schmitz]","[Fiction, Historical Fiction, World War II, Holocaust, European Literature, German Literature]",8097.0,181.0,216.0,"[30481, 52785, 37702, 10574, 2844]",3.73,1995-04-12,4.0,2.0,2844.0,10574.0,37702.0,52785.0,30481.0,134386.0,1.0,0.0,0.0,0.0,0.0,0.0,0.0,1.0,0.0,0.0,0.0,0.0,0.0,0.0,0.0,0.0,0.0,0.0,0.0,0.0,0.0,0.0,0.0,1.0,0.0,0.0,0.0,0.0,0.0,0.0,0.0,2009-01-30,5042 days 00:00:00.000000000
286,http://www.imdb.com/title/tt0080468/,Brave New World,,,,,Brave New World,"[John (Brave New World), Bernard Marx, Lenina Crowne, Helmholtz Watson, Mustapha Mond, The Warden, Pope, Linda (Brave New World), Fanny Crowne, The Director, The Arch-Community Songster]","[Classics, Fiction, Science Fiction, Science Fiction, Dystopia]",18034.0,559.0,268.0,"[349275, 358155, 205043, 56565, 24821]",3.96,1932-04-12,0.0,11.0,24821.0,56565.0,205043.0,358155.0,349275.0,993859.0,1.0,0.0,1.0,0.0,0.0,0.0,0.0,0.0,0.0,0.0,1.0,0.0,0.0,0.0,0.0,0.0,0.0,0.0,0.0,0.0,0.0,0.0,0.0,0.0,0.0,0.0,0.0,0.0,0.0,0.0,0.0,,
287,http://www.imdb.com/title/tt0384806/,The Amityville Horror,19000000,65233369,23507007,"
South Carolina Book Award for Young Adult Book Award (1980)
",The Amityville Horror,[],"[Horror, Fiction, Fantasy, Paranormal, Thriller, Paranormal, Ghosts, Fantasy, Supernatural, Mystery, Classics, Crime, True Crime, Fantasy]",1435.0,38.0,315.0,"[24495, 23522, 21371, 6147, 1825]",3.81,1977-08-01,1.0,0.0,1825.0,6147.0,21371.0,23522.0,24495.0,77360.0,1.0,1.0,1.0,1.0,0.0,0.0,0.0,0.0,1.0,0.0,0.0,0.0,0.0,0.0,1.0,0.0,0.0,0.0,0.0,1.0,1.0,0.0,0.0,0.0,0.0,0.0,0.0,0.0,0.0,0.0,0.0,2005-04-15,10119 days 00:00:00.000000000
288,http://www.imdb.com/title/tt4008996/,Crossing the Seas: A Diary of My Thoughts,,,,,Crossing the Seas: A Diary of My Thoughts,[],[Nonfiction],30.0,2.0,328.0,"[70, 20, 3, 0, 6]",4.49,,0.0,0.0,6.0,0.0,3.0,20.0,70.0,99.0,0.0,0.0,0.0,0.0,0.0,0.0,0.0,0.0,0.0,0.0,0.0,0.0,0.0,0.0,0.0,0.0,0.0,0.0,0.0,0.0,0.0,1.0,0.0,0.0,0.0,0.0,0.0,0.0,0.0,0.0,0.0,,
289,http://www.imdb.com/title/tt0118884/,Contact,90000000,100853835,20584908,"
Locus Award for Best First Novel (1986)
",Contact,[Ellie Arroway],"[Science Fiction, Fiction]",1929.0,79.0,580.0,"[34307, 33587, 17075, 3247, 837]",4.09,1985-04-12,1.0,1.0,837.0,3247.0,17075.0,33587.0,34307.0,89053.0,1.0,0.0,0.0,0.0,0.0,0.0,0.0,0.0,0.0,0.0,1.0,0.0,0.0,0.0,0.0,0.0,0.0,0.0,0.0,0.0,0.0,0.0,0.0,0.0,0.0,0.0,0.0,0.0,0.0,0.0,0.0,1997-07-11,4473 days 00:00:00.000000000
290,http://www.imdb.com/title/tt0460792/,Fast Food Nation: The Dark Side of the All-American Meal,,1004059,410804,"
Puddly Award for Nonfiction (2003)
",Fast Food Nation: The Dark Side of the All-American Meal,[],"[Nonfiction, Food and Drink, Food, Health, Sociology, Politics]",4940.0,58.0,399.0,"[44856, 66845, 46278, 12051, 7800]",3.72,2001-01-17,1.0,0.0,7800.0,12051.0,46278.0,66845.0,44856.0,177830.0,0.0,0.0,0.0,0.0,0.0,0.0,0.0,0.0,0.0,0.0,0.0,0.0,0.0,0.0,0.0,0.0,0.0,0.0,0.0,0.0,0.0,1.0,0.0,0.0,0.0,0.0,0.0,0.0,0.0,0.0,0.0,2006-11-17,2130 days 00:00:00.000000000
291,http://www.imdb.com/title/tt0430674/,The Thief Lord,,,,"
Book Sense Book of the Year Award for Children's Literature (2003), Batchelder Award (2003), Zilveren Griffel (2004), Grand Canyon Reader Award for Teen Book (2004), Massachusetts Children's Book Award (2005)
...more
Zurich Children's Book Award (2000), The Children's Book Award from the Vienna House of Literature (2001), Pacific Northwest Library Association Young Reader's Choice Award for Junior (2005), Literaturpreis der Jury der jungen Leser for Kinderbuch (2001)
...less ",The Thief Lord,[],"[Fantasy, Young Adult, Adventure, Childrens, Middle Grade, Childrens, Mystery, Fiction]",3239.0,82.0,350.0,"[21109, 24612, 15883, 3359, 731]",3.94,2000-01-01,8.0,0.0,731.0,3359.0,15883.0,24612.0,21109.0,65694.0,1.0,1.0,0.0,1.0,1.0,0.0,0.0,0.0,0.0,1.0,0.0,0.0,0.0,1.0,0.0,0.0,0.0,0.0,0.0,0.0,0.0,0.0,0.0,0.0,0.0,0.0,0.0,0.0,0.0,0.0,0.0,,
292,http://www.imdb.com/title/tt1790864/,The Maze Runner,34000000,102413606,,"
Georgia Peach Book Award (2011), Romantic Times Reviewers' Choice Award (RT Award) Nominee for Best Young Adult Paranormal/Fantasy Novel  (2009), Charlotte Award (2012), Pennsylvania Young Readers' Choice Award Nominee (2011), Evergreen Teen Book Award (2012)
...more
Milwaukee County Teen Book Award Nominee (2011), Abraham Lincoln Award (2012), Missouri Truman Readers Award (2012)
...less ",The Maze Runner (The Maze Runner #1),"[Chuck, Teresa Agnes, Minho, Alby, Gally, Thomas, Ben, Newt]","[Young Adult, Science Fiction, Dystopia, Science Fiction, Fiction]",47052.0,139.0,384.0,"[269614, 238667, 134034, 38262, 13242]",4.03,,7.0,8.0,13242.0,38262.0,134034.0,238667.0,269614.0,693819.0,1.0,0.0,0.0,0.0,1.0,0.0,0.0,0.0,0.0,0.0,1.0,0.0,0.0,0.0,0.0,0.0,0.0,0.0,0.0,0.0,0.0,0.0,0.0,0.0,0.0,0.0,0.0,0.0,0.0,0.0,0.0,2014-09-19,
293,http://www.imdb.com/title/tt0482193/,The Pillars of the Earth,,,,,The Pillars of the Earth (The Pillars of the Earth #1),"[Thomas Becket, Henry II of England, Tom Builder, Prior Philip, Aliena, Jack Jackson, Stephen of England, Empress Matilda, William Hamleigh, Ellen, Richard of Kingsbridge, Alfred Builder, Waleran Bigod, Lord Percy Hamleigh, Lady Regan Hamleigh, Remigius]","[Historical Fiction, Fiction, Historical]",25428.0,239.0,973.0,"[243695, 139195, 54705, 16106, 8789]",4.28,1989-10-01,0.0,16.0,8789.0,16106.0,54705.0,139195.0,243695.0,462490.0,1.0,0.0,0.0,0.0,0.0,0.0,0.0,1.0,0.0,0.0,0.0,0.0,0.0,0.0,0.0,0.0,0.0,1.0,0.0,0.0,0.0,0.0,0.0,0.0,0.0,0.0,0.0,0.0,0.0,0.0,0.0,,
294,http://www.imdb.com/title/tt0096425/,Watchers,,940173,,"
Japan Adventure Fiction Association Prize for Best Translated Novel (1993)
",Watchers,[],"[Fiction, Thriller, Horror, Science Fiction, Mystery, Suspense]",2547.0,97.0,624.0,"[46704, 36188, 19895, 3569, 1161]",4.15,1987-04-12,1.0,0.0,1161.0,3569.0,19895.0,36188.0,46704.0,107517.0,1.0,0.0,0.0,1.0,0.0,0.0,0.0,0.0,1.0,0.0,1.0,0.0,0.0,0.0,0.0,0.0,0.0,0.0,0.0,1.0,0.0,0.0,0.0,0.0,0.0,0.0,1.0,0.0,0.0,0.0,0.0,1988-12-02,600 days 00:00:00.000000000
295,http://www.imdb.com/title/tt0963794/,The Ruins,8000000,17432844,8003241,,The Ruins,"[Jeff, Eric Ross, Alyec Ilychovich, Pablo Soler, Stacy, Mathias]","[Fiction, Horror, Suspense, Mystery]",2653.0,57.0,319.0,"[4608, 7358, 6478, 2760, 1457]",3.48,2006-04-12,0.0,6.0,1457.0,2760.0,6478.0,7358.0,4608.0,22661.0,1.0,0.0,0.0,1.0,0.0,0.0,0.0,0.0,0.0,0.0,0.0,0.0,0.0,0.0,0.0,0.0,0.0,0.0,0.0,1.0,0.0,0.0,0.0,0.0,0.0,0.0,1.0,0.0,0.0,0.0,0.0,2008-04-04,723 days 00:00:00.000000000
296,http://www.imdb.com/title/tt0844794/,Northanger Abbey,,,,,Northanger Abbey,"[Catherine Morland, Henry Tilney, Eleanor Tilney, General Tilney, John Thorpe, Isabella Thorpe]","[Classics, Fiction, Romance, Historical Fiction, Gothic, Literature, Literature, 19th Century, Historical, European Literature, British Literature, Classics, Classic Literature]",7896.0,1040.0,251.0,"[57435, 78122, 60944, 15070, 3850]",3.79,1817-12-12 00:00:00,0.0,6.0,3850.0,15070.0,60944.0,78122.0,57435.0,215421.0,1.0,0.0,1.0,0.0,0.0,1.0,1.0,1.0,0.0,0.0,0.0,0.0,0.0,0.0,0.0,0.0,0.0,1.0,0.0,0.0,0.0,0.0,0.0,1.0,0.0,0.0,0.0,0.0,0.0,0.0,0.0,,
297,http://www.imdb.com/title/tt1686821/,Vampire Academy,30000000,7791146,4101000,,Vampire Academy (Vampire Academy #1),"[Vasilisa ""Lissa"" Dragomir, Dimitri Belikov, Christian Ozera, Mason Ashford, Victor Dashkov, Mia Rinaldi, Janine Hathaway, Natalie Dashkov, Edison ""Eddie"" Castile, Ellen Kirova, Rosemarie ""Rose"" Hathaway, Camille Conta, Stan Alto, Jesse Zeklos, Tatiana Ivashkov]","[Young Adult, Paranormal, Vampires, Fantasy, Fantasy, Paranormal, Romance]",18889.0,117.0,332.0,"[203962, 120866, 67931, 20261, 11526]",4.14,2007-08-16,0.0,15.0,11526.0,20261.0,67931.0,120866.0,203962.0,424546.0,0.0,1.0,0.0,0.0,1.0,1.0,0.0,0.0,0.0,0.0,0.0,0.0,0.0,0.0,0.0,0.0,0.0,0.0,0.0,0.0,1.0,0.0,0.0,0.0,0.0,0.0,0.0,0.0,0.0,0.0,0.0,2014-02-07,2367 days 00:00:00.000000000
298,http://www.imdb.com/title/tt0184791/,Othello,5000000,16017403,6916625,,Othello,"[Iago, Bianca, Othello, Miguel Cássio, Desdêmona, Emilia, Rodrigo]","[Fiction, Classics, Plays, Poetry, Plays, Theatre, Young Adult, High School, European Literature, British Literature, Academic, College, Literature, English Literature, Literature, 17th Century]",3869.0,430.0,314.0,"[74721, 87241, 61831, 15879, 4089]",3.87,,0.0,7.0,4089.0,15879.0,61831.0,87241.0,74721.0,243761.0,1.0,0.0,1.0,0.0,1.0,0.0,1.0,0.0,0.0,0.0,0.0,0.0,0.0,0.0,0.0,0.0,0.0,0.0,0.0,0.0,0.0,0.0,0.0,1.0,0.0,0.0,0.0,0.0,0.0,0.0,0.0,2001-08-31,
299,http://www.imdb.com/title/tt2134092/,Journey to the Center of the Earth,,43748,,,Journey to the Center of the Earth (Extraordinary Voyages #3),"[Axel, Otto Liedenbrock, Hans Bjelke, Gräuben]","[Classics, Science Fiction, Adventure, Fantasy, Cultural, France, Literature, Novels, Literature, 19th Century, Science Fiction Fantasy, Classics, Classic Literature]",3151.0,1096.0,240.0,"[27317, 38859, 29290, 5933, 1157]",3.83,1864-11-25 00:00:00,0.0,4.0,1157.0,5933.0,29290.0,38859.0,27317.0,102556.0,0.0,1.0,1.0,0.0,0.0,0.0,1.0,0.0,0.0,0.0,1.0,1.0,0.0,1.0,0.0,1.0,0.0,0.0,0.0,0.0,0.0,0.0,0.0,0.0,0.0,0.0,0.0,0.0,0.0,0.0,0.0,,
300,http://www.imdb.com/title/tt2134092/,Twenty Thousand Leagues Under the Sea,,43748,,,Twenty Thousand Leagues Under the Sea (Extraordinary Voyages #6),"[Captain Nemo, Pierre Aronnax, Ned Land]","[Classics, Science Fiction, Fiction, Adventure]",4152.0,1387.0,394.0,"[39072, 50299, 35818, 8265, 2155]",3.85,1869-03-20 00:00:00,0.0,3.0,2155.0,8265.0,35818.0,50299.0,39072.0,135609.0,1.0,0.0,1.0,0.0,0.0,0.0,0.0,0.0,0.0,0.0,1.0,0.0,0.0,1.0,0.0,0.0,0.0,0.0,0.0,0.0,0.0,0.0,0.0,0.0,0.0,0.0,0.0,0.0,0.0,0.0,0.0,,
301,http://www.imdb.com/title/tt2134092/,Around the World in Eighty Days,,43748,,"
Audie Award for Classic (2006)
",Around the World in Eighty Days (Extraordinary Voyages #11),"[Fix, Phileas Fogg, Jean Passepartout, Aouda]","[Classics, Fiction, Adventure, Science Fiction, Cultural, France, Fantasy, Travel, Literature, Historical Fiction, Novels]",3875.0,1572.0,252.0,"[37959, 51984, 34833, 6344, 1194]",3.9,1872-04-12 00:00:00,1.0,4.0,1194.0,6344.0,34833.0,51984.0,37959.0,132314.0,1.0,1.0,1.0,0.0,0.0,0.0,1.0,1.0,0.0,0.0,1.0,1.0,0.0,1.0,0.0,1.0,0.0,0.0,0.0,0.0,0.0,0.0,0.0,0.0,0.0,0.0,0.0,0.0,0.0,0.0,0.0,,
302,http://www.imdb.com/title/tt1130884/,Shutter Island,80000000,128012934,41062440,"
Barry Award Nominee for Best Novel (2004), Anthony Award Nominee for Best Novel (2004), Hammett Prize Nominee (2003), Grand Prix des lectrices de Elle for roman policier (2004)
",Shutter Island,"[Teddy Daniels, Chuck Aule, Dr. John Cawley, Dr. Jeremiah Naehring]","[Mystery, Fiction, Thriller, Suspense, Horror, Mystery, Crime]",6667.0,125.0,369.0,"[42016, 46645, 20874, 4508, 1563]",4.06,2003-04-15,4.0,4.0,1563.0,4508.0,20874.0,46645.0,42016.0,115606.0,1.0,0.0,0.0,1.0,0.0,0.0,0.0,0.0,1.0,0.0,0.0,0.0,0.0,0.0,1.0,0.0,0.0,0.0,0.0,1.0,0.0,0.0,0.0,0.0,0.0,0.0,1.0,0.0,0.0,0.0,0.0,2010-02-19,2502 days 00:00:00.000000000
303,http://www.imdb.com/title/tt0109642/,Dolores Claiborne,,24361867,5721920,,Dolores Claiborne,[],"[Horror, Thriller, Mystery]",1537.0,137.0,324.0,"[26257, 31321, 26143, 7340, 1567]",3.79,1992-11-12,0.0,0.0,1567.0,7340.0,26143.0,31321.0,26257.0,92628.0,0.0,0.0,0.0,1.0,0.0,0.0,0.0,0.0,1.0,0.0,0.0,0.0,0.0,0.0,0.0,0.0,0.0,0.0,0.0,1.0,0.0,0.0,0.0,0.0,0.0,0.0,0.0,0.0,0.0,0.0,0.0,1995-03-24,862 days 00:00:00.000000000
304,http://www.imdb.com/title/tt0338427/,Shopgirl,,10281585,229685,"
Grammy Award Nominee for Best Spoken Word Album (2001)
",Shopgirl,"[Mirabelle Buttersfield, Ray Porter, Jeremy Malory]","[Fiction, Romance, Contemporary, Humor, Novels]",2413.0,42.0,130.0,"[4536, 10395, 11189, 4205, 1056]",3.42,,1.0,3.0,1056.0,4205.0,11189.0,10395.0,4536.0,31381.0,1.0,0.0,0.0,0.0,0.0,1.0,0.0,0.0,0.0,0.0,0.0,1.0,1.0,0.0,0.0,0.0,0.0,0.0,1.0,0.0,0.0,0.0,0.0,0.0,0.0,0.0,0.0,0.0,0.0,0.0,0.0,2005-11-04,
305,http://www.imdb.com/title/tt0087428/,The Hotel New Hampshire,7500000,5068118,1075800,"
National Book Award Finalist for Fiction (Hardcover) (1982)
",The Hotel New Hampshire,"[John Berry, Franny Berry, Frank Berry, Win Berry, Lilly Berry]","[Fiction, Contemporary, Literature]",1331.0,9.0,520.0,"[13255, 19605, 12409, 2531, 508]",3.88,1981-04-12,1.0,5.0,508.0,2531.0,12409.0,19605.0,13255.0,48308.0,1.0,0.0,0.0,0.0,0.0,0.0,1.0,0.0,0.0,0.0,0.0,0.0,1.0,0.0,0.0,0.0,0.0,0.0,0.0,0.0,0.0,0.0,0.0,0.0,0.0,0.0,0.0,0.0,0.0,0.0,0.0,1984-03-09,1062 days 00:00:00.000000000
306,http://www.imdb.com/title/tt0041386/,The Fountainhead,,,,,The Fountainhead,"[Howard Roark, Peter Keating, Ellsworth Toohey, Dominique Francon]","[Classics, Novels, Architecture, Politics]",9687.0,148.0,720.0,"[92480, 72970, 42503, 18080, 17540]",3.84,1943-04-12,0.0,4.0,17540.0,18080.0,42503.0,72970.0,92480.0,243573.0,0.0,0.0,1.0,0.0,0.0,0.0,0.0,0.0,0.0,0.0,0.0,1.0,0.0,0.0,0.0,0.0,0.0,0.0,0.0,0.0,0.0,0.0,0.0,0.0,0.0,0.0,0.0,0.0,0.0,0.0,0.0,1949-07-02,2273 days 00:00:00.000000000
307,http://www.imdb.com/title/tt0861689/,Blindness,25000000,3073392,,,Blindness (Blindness #1),"[The doctor (Blindness), The doctor's wife, The girl with the dark glasses, The first blind man, The first blind man's wife, The boy with the squint, The old man with the black eye patch, The car thief]","[Fiction, Science Fiction, Dystopia, Science Fiction, Literature]",10147.0,218.0,326.0,"[48803, 43730, 20042, 6340, 2775]",4.06,1995-04-12,0.0,8.0,2775.0,6340.0,20042.0,43730.0,48803.0,121690.0,1.0,0.0,0.0,0.0,0.0,0.0,1.0,0.0,0.0,0.0,1.0,0.0,0.0,0.0,0.0,0.0,0.0,0.0,0.0,0.0,0.0,0.0,0.0,0.0,0.0,0.0,0.0,0.0,0.0,0.0,0.0,2008-10-03,4923 days 00:00:00.000000000
308,http://www.imdb.com/title/tt0440963/,The Bourne Ultimatum,110000000,227471070,69283690,,The Bourne Ultimatum (Jason Bourne #3),[Jason Bourne],"[Fiction, Thriller, Mystery, Spy Thriller, Espionage, Action]",742.0,87.0,725.0,"[17034, 18671, 9917, 1924, 505]",4.04,1990-04-12,0.0,1.0,505.0,1924.0,9917.0,18671.0,17034.0,48051.0,1.0,0.0,0.0,1.0,0.0,0.0,0.0,0.0,1.0,0.0,0.0,0.0,0.0,0.0,0.0,0.0,0.0,0.0,0.0,0.0,0.0,0.0,0.0,0.0,0.0,0.0,0.0,0.0,0.0,0.0,0.0,2007-08-03,6322 days 00:00:00.000000000
309,http://www.imdb.com/title/tt1781769/,Anna Karenina,,12802907,320690,,Anna Karenina,"[Princess Ekaterina ""Kitty"" Aleksandrovna Shcherbatskaya, Anna Arkadyevna Karenina, Count Aleksei Kirillovich Vronsky, Konstantin ""Kostya"" Dmitrievitch Levin, Prince Stepan ""Stiva"" Arkadyevitch Oblonsky]","[Classics, Fiction, Cultural, Russia, Romance, Literature]",16904.0,1307.0,964.0,"[170425, 145643, 82156, 25198, 10908]",4.01,1877-04-12 00:00:00,0.0,5.0,10908.0,25198.0,82156.0,145643.0,170425.0,434330.0,1.0,0.0,1.0,0.0,0.0,1.0,1.0,0.0,0.0,0.0,0.0,0.0,0.0,0.0,0.0,1.0,0.0,0.0,0.0,0.0,0.0,0.0,0.0,0.0,0.0,0.0,0.0,0.0,0.0,0.0,0.0,,
310,http://www.imdb.com/title/tt1002992/,The Good Earth,,,,"
Pulitzer Prize for Novel (1932), William Dean Howells Medal (1935)
",The Good Earth (House of Earth #1),"[Wang Lung, O-lan]","[Classics, Fiction, Historical Fiction, Cultural, China, Literature, Historical, Novels, Academic, School, Adult Fiction, Classics, Classic Literature]",7841.0,1.0,418.0,"[68168, 64289, 37001, 11097, 5102]",3.97,1931-04-12,2.0,2.0,5102.0,11097.0,37001.0,64289.0,68168.0,185657.0,1.0,0.0,1.0,0.0,0.0,0.0,1.0,1.0,0.0,0.0,0.0,1.0,0.0,0.0,0.0,1.0,0.0,1.0,0.0,0.0,0.0,0.0,0.0,0.0,0.0,0.0,0.0,0.0,0.0,0.0,0.0,2007-10-07,27937 days 00:00:00.000000000
311,http://www.imdb.com/title/tt0096639/,Lonesome Dove,,,,"
Pulitzer Prize for Fiction (1986), PEN/Faulkner Award for Fiction Nominee (1986), National Book Critics Circle Award Nominee (1985), Spur Award for Best Western Novel (1985)
",Lonesome Dove (Lonesome Dove #1),"[Captain Woodrow Call, Augustus ""Gus"" McCrae, Joshua Deets, Newt Dobbs]","[Fiction, Western, Historical Fiction, Classics, Historical]",5038.0,49.0,945.0,"[68186, 28026, 10227, 2081, 1027]",4.46,1985-04-12,4.0,4.0,1027.0,2081.0,10227.0,28026.0,68186.0,109547.0,1.0,0.0,1.0,0.0,0.0,0.0,0.0,1.0,0.0,0.0,0.0,0.0,0.0,0.0,0.0,0.0,0.0,1.0,0.0,0.0,0.0,0.0,0.0,0.0,0.0,0.0,0.0,0.0,0.0,0.0,0.0,,
312,http://www.imdb.com/title/tt1722102/,Murder on the Orient Express,,,,,Murder on the Orient Express (Hercule Poirot #10),"[Samuel Edward Ratchett, Hector MacQueen, Masterman, Colonel Arbuthnot, Harriet Hubbard, Count Rudolf Andrenyi, Countess Elena Andrenyi, Princess Natalia Dragomiroff, Mary Debenham, Hildegarde Schmidt, Antonio Foscarel, Greta Ohlsson, Pierre Michel, Cyrus Hardman, Dr. Constantine, M. Bouc, Hercule Poirot]","[Mystery, Mystery, Detective, Thriller, Mystery Thriller, Classics, Fiction]",6761.0,386.0,322.0,"[56514, 60212, 26800, 3580, 603]",4.14,1934-04-12,0.0,17.0,603.0,3580.0,26800.0,60212.0,56514.0,147709.0,1.0,0.0,1.0,1.0,0.0,0.0,0.0,0.0,1.0,0.0,0.0,0.0,0.0,0.0,0.0,0.0,0.0,0.0,0.0,0.0,0.0,0.0,0.0,0.0,0.0,0.0,0.0,0.0,0.0,0.0,0.0,,
313,http://www.imdb.com/title/tt2582846/,The Fault in Our Stars,12000000,124853062,48002523,"
Georgia Peach Book Award (2013), Buxtehuder Bulle (2012), Odyssey Award for Excellence in Audiobook Production Honor (2013), Audie Award for Teens (2013), West Australian Young Readers' Book Award (WAYRBA) for Older Readers (2013)
...more
Pennsylvania Young Readers' Choice Award for Young Adults (2013), Milwaukee County Teen Book Award (2013), Indies Choice Book Award for Young Adult (2013), Deutscher Jugendliteraturpreis for Preis der Jugendjury (2013), Amelia Elizabeth Walden Award (ALAN/NCTE) (2013), Dioraphte Jongerenliteratuurprijs for vertaald boek en publieksprijs (2013), The Inky Awards for Silver Inky (2012), Abraham Lincoln Award (2014), Luisterboek Award (2015), Goodreads Choice Award for Best Young Adult Fiction (2012), Green Mountain Book Award (2014), The Inky Awards Shortlist for Silver Inky (2012), Missouri Gateway Readers Award (2015), Louisiana Teen Readers' Choice Award (2015), Oklahoma Sequoyah Award for High School (2015), Alabama Author Award - Young Adult (2013), Premio El Templo de las Mil Puertas for Mejor novela extranjera independiente (2012)
...less ",The Fault in Our Stars,"[Hazel Grace Lancaster, Augustus Waters, Isaac]","[Young Adult, Fiction, Romance, Contemporary]",137084.0,216.0,313.0,"[1190756, 613959, 280400, 78389, 39484]",4.29,,21.0,3.0,39484.0,78389.0,280400.0,613959.0,1190756.0,2202988.0,1.0,0.0,0.0,0.0,1.0,1.0,0.0,0.0,0.0,0.0,0.0,0.0,1.0,0.0,0.0,0.0,0.0,0.0,0.0,0.0,0.0,0.0,0.0,0.0,0.0,0.0,0.0,0.0,0.0,0.0,0.0,2014-06-06,
314,http://www.imdb.com/title/tt0062622/,2001: A Space Odyssey,12000000,56954992,,,2001: A Space Odyssey (Space Odyssey #1),"[Heywood Floyd, HAL 9000, Dave Bowman, Frank Poole]","[Science Fiction, Fiction, Classics]",3339.0,207.0,297.0,"[65320, 62634, 30375, 6056, 1916]",4.1,1968-04-28,0.0,4.0,1916.0,6056.0,30375.0,62634.0,65320.0,166301.0,1.0,0.0,1.0,0.0,0.0,0.0,0.0,0.0,0.0,0.0,1.0,0.0,0.0,0.0,0.0,0.0,0.0,0.0,0.0,0.0,0.0,0.0,0.0,0.0,0.0,0.0,0.0,0.0,0.0,0.0,0.0,,
315,http://www.imdb.com/title/tt1139797/,Let the Right One In,4000000,2122065,49295,"
James Tiptree Jr. Award Honor List (2008)
",Let the Right One In,"[Eli, Oskar Eriksson, Håkan Bengtsson, Jonny Forsberg]","[Horror, Fiction, Paranormal, Vampires, Fantasy, Fantasy, Paranormal]",4600.0,94.0,513.0,"[23570, 22576, 10484, 2700, 1212]",4.07,2004-05-01,1.0,4.0,1212.0,2700.0,10484.0,22576.0,23570.0,60542.0,1.0,1.0,0.0,0.0,0.0,0.0,0.0,0.0,0.0,0.0,0.0,0.0,0.0,0.0,0.0,0.0,0.0,0.0,0.0,1.0,1.0,0.0,0.0,0.0,0.0,0.0,0.0,0.0,0.0,0.0,0.0,2008-12-12,1686 days 00:00:00.000000000
316,http://www.imdb.com/title/tt6080188/,Different Seasons,,,,"
World Fantasy Award Nominee for Best Anthology/Collection (1982)
",Different Seasons,[Adrian Mellon],"[Horror, Fiction, Short Stories, Thriller]",2894.0,133.0,560.0,"[64479, 45277, 16620, 2100, 390]",4.33,1982-08-27,1.0,1.0,390.0,2100.0,16620.0,45277.0,64479.0,128866.0,1.0,0.0,0.0,0.0,0.0,0.0,0.0,0.0,1.0,0.0,0.0,0.0,0.0,0.0,0.0,0.0,0.0,0.0,0.0,1.0,0.0,0.0,0.0,0.0,0.0,0.0,0.0,0.0,0.0,0.0,0.0,,
317,http://www.imdb.com/title/tt0944947/,A Game of Thrones,,,,"
Nebula Award Nominee for Best Novel (1997), Locus Award for Best Fantasy Novel (1997), World Fantasy Award Nominee for Best Novel (1997), Ignotus for Novela extranjera (2003)
",A Game of Thrones (A Song of Ice and Fire #1),"[Brandon Stark, Catelyn Stark, Tyrion Lannister, Daenerys Targaryen, Eddard Stark, Jon Snow, Theon Greyjoy, Robb Stark, Arya Stark, Jaime Lannister, Cersei Lannister, Joffrey Baratheon, Robert Baratheon, Tywin Lannister, Lysa Arryn, Petyr Baelish, Sansa Stark, Viserys Targaryen, Varys, Hodor, Jorah Mormont]","[Fantasy, Fiction, Fantasy, Epic Fantasy]",44265.0,260.0,835.0,"[787484, 371198, 104658, 26310, 17989]",4.44,1996-08-06,4.0,21.0,17989.0,26310.0,104658.0,371198.0,787484.0,1307639.0,1.0,1.0,0.0,0.0,0.0,0.0,0.0,0.0,0.0,0.0,0.0,0.0,0.0,0.0,0.0,0.0,0.0,0.0,0.0,0.0,0.0,0.0,0.0,0.0,0.0,0.0,0.0,0.0,0.0,0.0,0.0,,
